{"__metadata__": {"TESTSET": "tests/test-sets/ragas_single_hop.jsonl", "REWRITING": false, "ALPHA": 0.5, "AUTOCUT": true, "TOP_K": 3, "RERANKING": true, "RERANKER_CUTOFF": 0.3, "MODEL": "gpt-4o", "TEMPERATURE": 0.2, "EMBEDDING": "sentence-transformers/all-mpnet-base-v2", "CHUNK_SIZE_LIMIT": 374, "OVERLAP": "1 sentence", "average_input_tokens": 2584.82}}
{"user_input": "What role does archaeology play in understanding Ancient China?", "retrieved_contexts": ["Archaeology\n\nArchaeology, or archeology, is the study of the human past. It looks at remains and objects left by the people who lived long ago. These remains may include old coins, tools, buildings, and inscriptions. Archaeologists, the people who study archaeology, use these remains to understand how people lived. When archaeologists do fieldwork, they look for remains, often by digging in the ground. As settlements (places where people lived in groups) change and grow, old buildings get buried. Usually, this is a natural process. A typical student project is to leave an object in a place where there is nothing going on. It will get covered rather quickly, because wind, water and plants will bury it. Sometimes buildings are deliberately buried to make way for new buildings. Ancient Rome, for example, is now up to 40\u00a0feet (12\u00a0metres) below the present city. This process of natural or man-made burial is why archaeological fieldwork involves digging, and is expensive and takes a long time. When things are found, or even when nothing is found, the results of the fieldwork are taken back to a base. Short term, the base is often on or near the site. Longer term, the results will usually go to a university or museum. Everything is written down on paper or entered into a computer. Gradually, they build up a picture of what happened long ago. Archaeologists publish their research so others can understand what they learned. Archaeologists do not all study the same topics. They have specialties. Some fields of interest include Ancient Egypt (these specialists are called Egyptologists), Ancient China, or the Vikings. Archaeologists study every civilization that is known, especially the ones where there is no written history. They can study any time period. For example, one might study the beginning of human life in Africa, or study World War II.", "It has archaeological evidence over 5,000 years old. It also has one of the world's oldest writing systems (and the oldest in use today), and is viewed as the source of many major inventions. Ancient China was one of the first civilizations and was active since the 2nd millennium BC as a feudal society. Chinese civilization was also one of the few to invent writing, with the others being Mesopotamia, the Indus Valley civilization, the Maya civilization, the Minoan civilization of ancient Greece, and Ancient Egypt. It reached its golden age during the Tang Dynasty (c. A.D. 10th century). Home of Confucianism and Daoism, it had great influence on nearby countries including Japan, Korea, and Vietnam in the areas of political system, philosophy, religion, art, and even writing and literature. China is home to some of the oldest artwork in the world. Statues and pottery, as well as decorations made of jade, are some classic examples. Before the Qin Dynasty united China, there were hundreds of small states that fought each other for hundreds of years in a war to control China. This is known as the Warring States Period. Although the continuing wars made people suffer, it was at this time when many of the great philosophies of the East were born, including Confucianism and Daoism. Confucianism and Daoism alone have been the foundation of many social values seen in modern eastern-Asian cultures today. Its geography mostly looked like that of modern China, except with northern and western edges that varied. It was often attacked by northern nomadic people such as the Turkic tribes and the Mongols lead by Genghis Khan and Kublai Khan.", "For example, one might study the beginning of human life in Africa, or study World War II. Marine archaeologists study things that are now underwater. They search for sunken ships or cities that have been lost under the sea. There are many different ways of doing archaeology. these depend on the methods used, the things studied, and the environment. Some of these subdisciplines overlap with each other. Archaeology relating to oceans, seas and lakes is usually done underwater. It includes the study of sunken ships and submerged coastlines. \"Maritime archaeology\" is a part of this subdivision. It refers to the archaeological investigation of past ships and seafaring. A famous example of maritime archaeology is the recovery and restoration of the ship burial at Sutton Hoo. When a glacier melts, objects that were captured in it are revealed. The recovery and study of these objects is called \"ice-patch archaeology\". A famous example is \u00d6tzi the Iceman. Historical archaeology deals with places, things, and issues from the past or present at or related to sites with written records or oral traditions. Or it can be defined as \"the archaeological investigation of any past culture that has developed a literate tradition.\" A prominent example of historical archaeology is the work done at Colonial Williamsburg. This relatively new branch of archaeology consists of \"the systematic study of structures and artefacts as a means of enlarging our understanding of the industrial past.\" Archaeozoology, or zooarchaeology, is the study of the relationships between humans and animals in the archaeological record. This includes the study of bones, feathers, teeth and other body parts as well as their interpretation. This field involves attempts at replicating the actions and conditions of ancient cultures. Good examples are Butser Ancient Farm and Overton Down.", "Some important sciences that are used to find out more about pre-history are palaeontology, astronomy, biology, geology, anthropology, and archaeology. Archaeologists study things left over from prehistory to try to understand what was happening. Anthropologists study the traces of human behavior to learn what people were doing and why. After people started to record events, first by drawing symbols (called \"pictographs\") and then by writing, it became much easier to tell what happened, and history started. These records can tell us the names of leaders (such as Kings and Queens), important events like floods and wars, and the things people did in their daily lives. The time when \"prehistory\" ended and \"history\" started is different in different places, depending on when people began to write and if their records were kept safe or lost so they could be found later on. In places like Mesopotamia, China, and Ancient Egypt, things were recorded from very early times (around 3200 BC in Ancient Egypt) and these records can be looked at and studied. In New Guinea, the end of prehistory came much later, around 1900.", "China\n\nChina ( Pinyin: Zh\u014dnggu\u00f3) is a cultural region, an ancient civilization, and a nation in East Asia. The official name is People's Republic of China or PRC. The last Chinese Civil War (19271949) resulted in two different political powers today: China is one of the world's oldest civilizations: it has the oldest continuous civilization near the Yellow River region. There is archaeological evidence over 5,000 years old. China also has one of the world's oldest writing systems (and the oldest in use today). China has been the source of many major inventions. Geographically, China\u2019s longest river is the Yangtze River which runs through mega cities and is home to many species. It is the world\u2019s third longest river. The first recorded use of the word \"China\" is dated 190. It is derived from \"ch\u012bn\u012b\", a Persian adjective meaning 'Chinese' which was popularized in Europe by Marco Polo. Ancient China was one of the first civilizations and was active since the 2nd millennium BC as a feudal society. Chinese civilization was also one of the few to invent writing, with the others being Mesopotamia, the Indus Valley civilization, the Maya civilization, the Minoan civilization of ancient Greece, and Ancient Egypt. It reached its golden age during the Tang Dynasty (c. A.D. 10th century). Home of Confucianism and Daoism, it had great influence on nearby countries including Japan, Korea, and Vietnam in the areas of political system, philosophy, religion, art, writing and literature. China is home to some of the oldest artwork in the world. Statues and pottery, as well as decorations made of jade, are some classic examples.", "Ancient China\n\nAncient China is one of the world's oldest civilizations. Prehistory means the history of a time before any written record. In such cases, it is very difficult to tell anything definite about the prehistory of China or any other country. Even then, historians believe some facts about the China of that period. About a few million years ago Homo erectus, an early human species, lived in China. Later, about 65,000 years ago, modern human beings Homo sapiens reached China from Africa. For food, they hunted wild animals. They also began to pick and gather fruits, eventually resulting in the Chinese learning to farm by 5000 BC. They had started cultivating rice and possibly other types of grains. By 2500 BC, the Bronze Age had come to China. A ruling class with kings and queens had come into society. Some scholars think that about 4000 years ago, the Xia dynasty ruled China. Yu(Da Yu) was the first ruler of this dynasty. There are few credible sources about Yu (who could have been legendary), his time, and other rulers of the Xia dynasty. Most Chinese historians of that time think that one dynasty came after another but it is possible that two dynasties were ruling in different parts of China at the same time. Therefore, some scholars think that Xia dynasty and Shang Dynasty may have ruled at the same time, but in different areas of China. There are written records of the history of China which date from 1500 BC in the Shang dynasty (c. 1600\u20131046 BC). Turtle shells with writing like ancient Chinese writing from the Shang Dynasty () have been carbon dated to about 1500 BC. Scholars believe that present-day Henan was the ninth and last capital of kings of the Shang Dynasty. This began what we call the Chinese civilization.", "This began what we call the Chinese civilization. Ancient China fought wars and Civil wars and was also sometimes conquered by other people. Chinese civilization originated in various regional centers along both the Yellow River and the Yangtze River valleys in the Neolithic era, but the Yellow River is said to be the cradle of Chinese civilization. The written history of China can be found as early as the Shang Dynasty (c. 1600 \u2013 1046 BC) although ancient historical texts such as the Records of the Grand Historian (ca. 100 BC) and Bamboo Annals say that a Xia Dynasty existed before the Shang. Much of Chinese culture, literature and philosophy further developed during the Zhou Dynasty (1045 \u2013 256 BC). About 1046 BC, the Zhou Dynasty defeated the last king of the Shang Dynasty and came to power. They changed the capital from Henan to a place near present-day Xi'an, near the Yellow River. The Zhou Dynasty also brought a new theory to China(see the Mandate of Heaven). Almost all dynasties of Chinese rulers continued to repeat this theory. The kings of this dynasty won many new areas. For the first time in the history of China, a large number of people also moved from one area to another area for settlement. The Spring and Autumn Period was around the 8th century BC. The Zhou dynasty continued, but its power waned as the lords gained lands and followers. Many kings ruled in different parts of China. China became several fragmented states, each ruled by a different king. In some cases, a king ruled just a village with a small fort. During this period in China, many new lines of thinking arose. Some of them continue to be important. They are Confucianism, Taoism, Legalism and Mohism. The Spring and Autumn Period continued for about 300 years.", "Good examples are Butser Ancient Farm and Overton Down. In many countries, governments and other groups of people protect important archaeological sites so they will not be destroyed and so that visitors can always come and see them. Sometimes archaeological sites are found when foundations are dug for new buildings. Archaeologists have to work quickly when this happens, because people who are building often don't have a lot of time. As soon as the archaeologists are done with their work, the remains that they have found will be covered over, unless they are very important.", "History of China\n\nThe History of China covers thousands of years. The earliest records are from about 1250 BC but a few things are known about earlier times. Chinese history covers many periods and dynasties. See Ancient China for the earliest times. The Qin Dynasty was very important in the history of China. They followed the philosophy of Legalism. Their capital was at Xianyang. Under the king of this dynasty, China became a powerful country. Many new things were done for the first time. A tight legal system was followed. Written language was developed. The common currency was used. The building of the Great Wall of China was started. The Han dynasty was founded by Liu Bang after the Qin dynasty ended. During the Han dynasty, the territory of China expanded, and many advancements in science and technology took place. It was considered a golden age in Chinese history. The Three Kingdoms period (traditional Chinese: \u4e09\u570b; simplified Chinese: \u4e09\u56fd; pinyin: S\u0101ngu\u00f3) is a period of history where China was divided into the states of Cao Wei, Shu Han, and Eastern Wu. The Eastern Han dynasty lost all power. Eventually, the Han dynasty emperor abdicated. The Jin dynasty (1115\u20131234) is also known as the Jurchen dynasty and as the Great Jin. It was one of the last dynasties before the Mongol invasion (and eventual conquest) of China. The dynasty was founded by the Wanyan (\u5b8c\u984f W\u00e1ny\u00e1n) clan of the Jurchens. [1] These were the ancestors of the Manchu, who established the Qing dynasty some 500 years later. The Jin Dynasty was founded in northern Manchuria, The founder was Wanyan Aguda (\u5b8c\u984f\u963f\u9aa8\u6253). [2]", "It probably ended at about 30\u00a0BC when the country was invaded by the Roman Empire. The society of ancient Egypt depended on a balance of natural and human resources, especially the irrigation of the Nile Valley so that Egyptians could grow crops. There was a great difference between classes in this society, as there is today. Most of the people were farmers but they did not own the agricultural products they produced. These were property of the state, temple, or noble family that owned the land. There was slavery, but it is not clear how it was practiced. The Religion of Ancient Egypt encouraged people to respect their rulers and their past. The Egyptians are known for writing in hieroglyphs, building the famous pyramids, and their successful agriculture. The religion of Judaism formed about 1500 BC. China began as city-states in the Yellow River valley. The Shang Dynasty (\u5546\u671d) was the first dynasty of Ancient China.Turtle shells with writing on them have been carbon dated to about 1500\u00a0BC. The Zhou Dynasty came after the Shang Dynasty. \"Kong Fuzi\" and Laozi lived at the end of the Zhou Dynasty. They were the greatest Chinese philosophers. They founded new philosophies, or ways of thinking. Confucius founded Confucianism and Laozi founded Daoism. After the Zhou Dynasty came the Warring States Period. The Qin (\u79e6) dynasty came after the Warring States Period. The Qin emperor Qin Shi Huang created the first centralized state in China in 221\u00a0BC. It was based on his based on his political philosophy of legalism. He made everyone write the same way. He fought against \"Confucianism\". He also started building what would later become the Great Wall. In 202\u00a0BC the Han Dynasty took over. It was about as strong as the Roman Empire.", "Silk Road\n\nThe Silk Road was a group of trade routes that went across Asia to the Mediterranean Sea. This let China trade with the Middle East and the Mediterranean world. It was called the Silk Road because silk was traded along it. At the time, silk was only made in China, and it was a valuable material. The Silk Road not only earned China a lot of money, but all along the route cities prospered and markets flourished. Cities like Samarkand and Bukhara were built largely on the trade from the silk route. Trade on the Silk Road played a big part in the growth of the ancient cultures of China, Egypt, Mesopotamia, Persia, India, and Rome, and helped to make the beginning of today's world. The term Silk Road is English for the German word \"Seidenstra\u00dfe\". The first person who called it that was a German geographer in 1877. Of course, many other things were also traded, even ideas. Because the traders came from many places, different ideas were brought to China, and China's ideas were taken to other places. Some of the other things traded were porcelain and other types of pottery, food, wine, and spices. Chess pieces from northern India were brought to China and Persia. Paper arrived in the west from China. Metals and jewels were certainly transported, and very likely slaves also. Probably no trader went the whole way along. Goods would be traded on at every stopping-point. Deals might be needed to get past difficult places. The Silk Road first traveled west from northern China. Then the part of the Silk Road on land split into two branches. One branch went north of the Tibetan Plateau, and the other branch went south of it.", "They designed and made the pyramids, which are nearly perfect geometrically. They could make cement, and developed large irrigation networks. Science was also important. Mathematics was used in Egypt, and the golden ratio was used in the construction of the Pyramids. Another ability of the Egyptians was glass making. Archaeologists have found many pieces of beads, jars, figures and ornaments in tombs across the nation. In 2005, the remains of an ancient glassmaking factory was found.", "Ancient history\n\nAncient history is all the events we know about between the invention of writing and the start of the Middle Ages. Writing is one of the greatest inventions of the human species. It was invented after the Neolithic revolution in which people settled in small towns and started agriculture. Writing dates from about 3,300 BC, which is over 5000 years ago, in the Middle East. The first people to use writing were the Sumerians and the Ancient Egyptians. Before writing, the only things we have are the tools and monuments made by earlier people. This is studied by archaeology rather than history. The period of ancient history ends with the early Middle Ages. Finding facts about ancient history is difficult because people wrote less in those times: only scribes could write. Most of what they did write has been lost. There were very few copies made because there was no printing. What people wrote they wrote by hand. More people could read and write in Ancient Rome than in other places but much of what they wrote is now lost. Archaeology is looking at things that were made or used in the past to learn about that time. Things like clay pots, solid tools, and metal weapons often exist at the same time. Things like paper, wood, and cloth can be easily broken, burnt or damaged. Some ancient things found using archaeology are: Primary sources are written by people who lived in ancient times. They tell us most of what we know about ancient history. But people in ancient history may have believed different things from each other. They may also be wrong. Some famous people who wrote ancient history are: Herodotus, Josephus, Livy, Polybius, Suetonius, Tacitus, Thucydides and Sima Qian."], "reference_contexts": ["Archaeology Archaeology, or archeology, is the study of the human past. It looks at remains and objects left by the people who lived long ago. These remains may include old coins, tools, buildings, and inscriptions. Archaeologists, the people who study archaeology, use these remains to understand how people lived. When archaeologists do fieldwork, they look for remains, often by digging in the ground. As settlements (places where people lived in groups) change and grow, old buildings get buried. Usually, this is a natural process. A typical student project is to leave an object in a place where there is nothing going on. It will get covered rather quickly, because wind, water and plants will bury it. Sometimes buildings are deliberately buried to make way for new buildings. Ancient Rome, for example, is now up to 40 feet (12 metres) below the present city. This process of natural or man-made burial is why archaeological fieldwork involves digging, and is expensive and takes a long time. When things are found, or even when nothing is found, the results of the fieldwork are taken back to a base. Short term, the base is often on or near the site. Longer term, the results will usually go to a university or museum. Everything is written down on paper or entered into a computer. Gradually, they build up a picture of what happened long ago. Archaeologists publish their research so others can understand what they learned. Archaeologists do not all study the same topics. They have specialties. Some fields of interest include Ancient Egypt (these specialists are called Egyptologists), Ancient China, or the Vikings. Archaeologists study every civilization that is known, especially the ones where there is no written history. They can study any time period. For example, one might study the beginning of human life in Africa, or study World War II. Marine archaeologists study things that are now underwater. They search for sunken ships or cities that have been lost under the sea. There are many different ways of doing archaeology. these depend on the methods used, the things studied, and the environment. Some of these subdisciplines overlap with each other. Archaeology relating to oceans, seas and lakes is usually done underwater. It includes the study of sunken ships and submerged coastlines. \"Maritime archaeology\" is a part of this subdivision. It refers to the archaeological investigation of past ships and seafaring. A famous example of maritime archaeology is the recovery and restoration of the ship burial at Sutton Hoo. When a glacier melts, objects that were captured in it are revealed. The recovery and study of these objects is called \"ice-patch archaeology\". A famous example is \u00d6tzi the Iceman. Historical archaeology deals with places, things, and issues from the past or present at or related to sites with written records or oral traditions. Or it can be defined as \"the archaeological investigation of any past culture that has developed a literate tradition.\" A prominent example of historical archaeology is the work done at Colonial Williamsburg. This relatively new branch of archaeology consists of \"the systematic study of structures and artefacts as a means of enlarging our understanding of the industrial past.\" Archaeozoology, or zooarchaeology, is the study of the relationships between humans and animals in the archaeological record. This includes the study of bones, feathers, teeth and other body parts as well as their interpretation. This field involves attempts at replicating the actions and conditions of ancient cultures. Good examples are Butser Ancient Farm and Overton Down. In many countries, governments and other groups of people protect important archaeological sites so they will not be destroyed and so that visitors can always come and see them. Sometimes archaeological sites are found when foundations are dug for new buildings. Archaeologists have to work quickly when this happens, because people who are building often don't have a lot of time. As soon as the archaeologists are done with their work, the remains that they have found will be covered over, unless they are very important."], "response": "Archaeology plays a crucial role in understanding Ancient China by providing evidence of its early civilizations, such as the existence of Homo erectus and Homo sapiens in the region, and the development of agriculture by 5000 BC. Archaeological findings, like turtle shells with ancient writing from the Shang Dynasty, help trace the origins of Chinese civilization and its dynastic history. These findings offer insights into the social structures, cultural practices, and technological advancements of Ancient China, which are not always documented in written records [File: wiki_15.txt, Section: Ancient China].", "reference": "Archaeology is crucial in understanding Ancient China as it involves the study of remains and objects left by people from that era. Archaeologists examine artifacts such as tools, coins, and inscriptions to gain insights into how people lived in Ancient China. This field of study helps build a picture of the civilization, especially in areas where there is no written history."}
{"user_input": "What is the role of the European Union in Belgium?", "retrieved_contexts": ["Western European Union\n\nThe Western European Union (WEU) was a European defence and security organization. It was set up by Treaty of Brussels of 1948, West Germany and Italy joined in 1954. It should not be confused with the European Union (EU). The WEU headquarters were in Brussels. After the Cold War its functions were gradually transferred to the European Union and the Council of Europe. It was dissolved on 31 March 2011. The Treaty of Brussels was signed by the United Kingdom, France, Belgium, Luxembourg, and the Netherlands on March 17, 1948. It was changed on October 23, 1954 when West Germany and Italy joined. The WEU's three main aims are: The WEU was led by a Council of Ministers, helped by a Council of Permanent Representatives (ambassadors). The Parliamentary Assembly eventually had the same members as the Parliamentary Assembly of the Council of Europe). Social and cultural activities were handed to the Council of Europe to avoid duplication.", "Belgium\n\nBelgium (officially the Kingdom of Belgium; , , ) is a country in Western Europe. Its capital, Brussels, is the home of many organizations including the European Union and NATO. Belgium is bordered by The Netherlands in the north, Germany to the east, Luxembourg to the southeast and France to the south. Belgium has an area of . Around 11.6 million people live in Belgium. It is a founding member of the European Union and is home to its headquarters. There are three regions in Belgium. The regions are mainly based on language and culture. Flanders and Wallonia are both split up into five provinces each. The population is about 60% Dutch-speaking, 39% French-speaking, and 1% German-speaking (the so-called \"Deutschbelgier\"). To look after all these groups, Belgium has a complex system of government with highly autonomous regions. The name 'Belgium' comes from \"Gallia Belgica\". This was a Roman province in the northernmost part of Gaul. Before Roman invasion in 100\u00a0BC, the \"Belgae\", a mix of Celtic and Germanic peoples, lived there. The Germanic Frankish tribes during the 5th century brought the area under the rule of the Merovingian kings. A slow shift of power during the 8th century led the kingdom of the Franks to change into the Carolingian Empire. The Treaty of Verdun in 843 divided the region into Middle and West Francia. They were vassals either of the King of France or of the Holy Roman Emperor. Many of these fiefdoms were united in the Burgundian Netherlands of the 14th and 15th centuries. The Eighty Years' War (1568\u20131648) divided the Low Countries into the northern United Provinces and the Southern Netherlands.", "European Commission\n\nThe European Commission (officially called the Commission of the European Communities) is one of the seven organisations that manage the European Union (EU). The Commission manages the day-to-day running of the EU and writes laws, like a government. Laws written by the commission are discussed and changed by the European Parliament and the Council of the European Union. The Commission sits in Brussels. The commission is made of 27 people, one from each of the countries in the EU. One of these people is the President, who was chosen by the Council and Parliament, he decides (with each country) who the other members are and what they do. Each one has a different job, such as looking after industry or trade. If they do not do their job properly, the President can remove them. If he does not, or if the President does not do his job, the Parliament can remove the whole Commission from their jobs (this only happened in 1999). The name Commission can also mean the 25,000 people who work for the President and his team. They follow the commission's instructions in looking after the EU or writing a new law. It works in three languages, English, French and German. The first Commission was created in 1952 and was called the \"High Authority\". But the modern Commission was created in 1957 and since then has had twelve Presidents;", "European Union\n\nThe European Union (abbreviation: EU) is a union of 27 member countries in Europe established by the Maastricht Treaty in 1992-1993. It is a sui generis political organisation that has both the characteristics of a federation and of a confederation. The EU grew out of the European Economic Community (EEC) which was established by the Treaty of Rome in 1957. It has created a common economic area with Europe-wide laws allowing the citizens of EU countries to move and trade in other EU countries almost the same as they do in their own. Nineteen of these countries also share the same type of money: the euro. The name of Europe comes from the Latin Europa, which in turn derives from the Greek \u0395\u1f50\u03c1\u03ce\u03c0\u03b7, from \u03b5\u1f50\u03c1\u03cd\u03c2 eurys \"wide\" and \u1f64\u03c8 ops \"face\". The Treaty of Lisbon is the most recent treaty that says how the Union is run. Every member state signed to say that they each agreed with what it says. Most importantly, it says which jobs (\u2019powers\u2019) the Union should do for the members and which jobs they should do themselves. The members decide how the Union should act by voting for or against proposals. The objective of the EU is to bring its member states closer together with respect to human rights and democracy. It does this with common rules about fair trading with each other, common agreements about law enforcement, a common style of passport, and other agreements. Most members share a common currency (the euro) and most allow people to travel from one country to another without having to show a passport. It does this with common rules about fair trading with each other, common agreements about law enforcement, and other agreements. It has a common style for (its) passports.", "Council of the European Union\n\nThe Council of the European Union \"(often called Council of Ministers or just Council)\" is one of the three organisations that manage the European Union. Along with the European Parliament, it is responsible for law making for the European Union (EU). Its members are the government ministers of the member countries who are responsible for the law that is being discussed. As an example, suppose the law is going to be about farming, then the Agriculture Ministers are the council for that day. As well as making laws, they can meet to discuss their problems. For example, the European Union does not decide on tax - each country decides on its own tax. But the Finance Ministers meet anyway because sometimes they can help each other catch people who do not want to pay tax at all. The council is called different things in different countries, according to the language they speak (for example in French it is \"Conseil de l'Union Europ\u00e9enne\" and in German it is \"Rat der Europ\u00e4ischen Union\"). It is also known internationally, and so it appears on its logo, with the Latin word Consilium. A simple way of putting it, is that The 'Council of the European Union' is helped by most countries in the world and it is very important.", "Council of Europe\n\nThe Council of Europe (, ) is an international organization of 47 member states in the European region. One of its first successes was the European Convention on Human Rights in 1950, which serves as the basis for the European Court of Human Rights. The seat of the Council of Europe is in Strasbourg on the Franco-German border. The original meeting place was in the city's University Palace. The Palais de l'Europe, about two kilometres from city centre, has taken its place. Membership is open to all European democracies which accept the principle of the rule of law and guarantee fundamental human rights, civil rights and freedoms to their citizens and respect of rights of minority groups. The Council of Europe is not to be confused with the Council of the European Union or the European Council, as it is a separate organisation and not part of the European Union. But all member states of European Union are also the member states of Council of Europe. On 15 March 2022, Russia is excluded from Council of Europe because of 2022 Russian invasion of Ukraine.", "Brussels\n\nBrussels (, , ) is the capital city of Belgium and the European Union. In 2007, 145,917 people lived there. But the area around it, known as the Brussels-Capital Region, had 1,031,215 people (which makes it the largest city area in Belgium). The people of Brussels speak mainly French and Flemish (a type of Dutch). There are lots of other languages spoken as well, because the European Union offices are there and because many thousands of immigrants from all over the world live there. The city is at 50\u00b0 50 North, 04\u00b0 21 East. It has an oceanic climate (\"Cfb\" in the K\u00f6ppen climate classification). Thirty-one people were killed in a terrorist attack on 22 March 2016. Many popular European comics came from Brussels, such as Tintin, The Smurfs, Snorks, and Lucky Luke. It is also well known for a style of building known as \"Art Nouveau\". The vegetables Brussels sprouts are named after the city, and Brussels is also famous for its waffles and its chocolates. A lot of tourists visit Brussels for the statue \"Manneken Pis\".", "European Parliament\n\nThe European Parliament (formerly European Parliamentary Assembly or Common Assembly) is the parliament of the European Union (EU). EU citizens elect its members once every five years. Together with the Council of Ministers, it is the law-making branch of the institutions of the Union. It meets in two locations: Strasbourg and Brussels . The Parliament has 751 members, called \"MEPs\". Each member speaks for a place in Europe, for example Paris, Denmark or Sicily. Anyone can be elected, they are elected by all the EU citizens, the people who are citizens of a country in the EU. People have been elected to Parliament since 1979, before that they came from the Parliaments of each country. Because MEPs come from different countries, they speak different languages (24 in 2013) at Parliament. They have a protected right to first language (multilingualism), and the Parliament needs many interpreters. Unlike other international groups of politicians, MEPs do not sit in groups of countries, but they sit next to people who they share ideas with. The two largest groups are the \"European People's Party-European Democrats\" and the \"Party of European Socialists\". But these groups work together to agree, so they do not fight to make a law if the other group dislike it. The European Parliament's power depends on which area of the EU it is working in. The EU has three areas, the \"Community\", its representation to other countries, and things to do with police and courts. In the last two areas, it can not do much as the Council takes care of those issues, but in the Community (which is the largest area) it can change or stop any law. But the council also has to agree, and sometimes they disagree and cannot make a law.", "European Union member state\n\nA European Union member state is any one of the twenty-seven countries that have joined the European Union (EU) since it was found in 1958 as the European Economic Community (EEC). From an original membership of six states, there have been five successive enlargements. The largest happened on 1 May 2004, when ten member states joined. Following the addition of Croatia in 2013, the EU's membership now stands at twenty-eight. Negotiations are also under way with other states. The process of enlargement is sometimes referred to as European integration. However, this term is also used to refer to the intensification of cooperation between EU member states as national governments allow for the gradual centralising of power within European institutions. Before being allowed to join the European Union, a state must fulfill the economic and political conditions generally known as the Copenhagen criteria: these basically require that a candidate member state must enjoy a secular, democratic system of government, together with the corresponding freedoms and institutions, and respect the rule of law. Under the terms of the Treaty on European Union, enlargement of the Union is conditional upon the agreement of each existing member state as well as approval by the European Parliament. Bulgaria and Romania make up the second part of the EU's fifth enlargement, and joined the EU on 1 January 2007. This date was agreed upon at the Thessaloniki Summit in 2003, confirmed at Brussels on 18 June 2004, and affirmed by the country reports of October 2004 and the final report delivered on 26 September 2006. Bulgaria and Romania signed their Treaty of Accession on 25 April 2005 at a ceremony held at Neum\u00fcnster Abbey in Luxembourg. The United Kingdom was a former EU member state. It joined the European Economic Community on 1 January 1973.", "The European Commission runs the day-to-day running of the EU and writes laws, like a government. Laws written by the commission are discussed and changed by the European Parliament and the Council of the European Union. The commission has one President and 27 Commissioners, selected by the European Council. The Commission President is appointed by the European Council with the approval of the European Parliament. The commission operates like a cabinet government. There is one Commissioner per member state, though Commissioners are bound to represent the interests of the EU as a whole rather than their home state. The Parliament has a total of 705 members (called Members of the European Parliament, or MEP). They are elected in their countries every five years by the citizens of the European Union member countries. The Parliament can approve, reject or change proposed laws. It can also sack the European Commission. In that case, the entire commission would have to give up their jobs. There are many discussions in the EU about how it should develop and change in the future. The main reasons why European countries came together are political and economic: In 1951, six countries made the \"European Coal and Steel Community\", a basic version of what the EU is now. These six then went further and in 1957 they made the European Economic Community and the European Coal and Steel Community. The UK and others decided not to join, and then when the UK changed its mind it was stopped from joining by French President Charles de Gaulle. When he was no longer President, the UK and others started to join. Today there are 27 members but the idea that more should join is not seen as a good one by everyone. Serbia, Montenegro, North Macedonia, Turkey and Iceland are \"candidate countries\"; they are being considered for membership. Albania, Bosnia and Herzegovina and Kosovo are expected to follow.", "European Broadcasting Union\n\nThe European Broadcasting Union (EBU), known in French as <nowiki>L'</nowiki>Union Europ\u00e9enne de Radio-T\u00e9l\u00e9vision (UER), and unrelated to the European Union, was formed on 12 February 1950 by 23 broadcasting organizations from Europe and the Mediterranean at a conference in the coastal resort of Torquay in Devon, England. In 1993, the International Radio and Television Organisation (\"OIRT\"), an equivalent organisation of broadcasters from Central and Eastern Europe, was merged with the EBU.", "Products made in one member country can be sold in any other member country without any special permissions or extra taxes. For this reason, the members agree rules on product safety - they want to know that a product made in another country will be as safe as it would be if it had been made in their own. The Council of the European Union is the main decision-making group. The cabinet ministers of the member countries meet (Ministers for Foreign affairs, for Agriculture, for Justice, etc...) and discuss issues that are important to them. Before the Treaty of Lisbon (written in 2007, implemented in 2008) each member state took a turn at being President of the council for six months. For example, from January 2007 until July 2007, Germany held the presidency. The six months before that, Finland held the presidency. Now the President of the European Union chairs the council summits. The President of the council is the organiser and manager and is voted into office for a duration of two and a half years. He or she does not have the power to make decisions about the European Union like the President of the United States does for that country. Member countries with a large population (Germany, France, United Kingdom, etc.) have more votes than countries with small populations (Luxembourg, Malta, etc.) but a decision cannot be made if enough countries vote against the decision. Twice a year, the heads of government (Prime Ministers) and/or the heads of state (Presidents) meet to talk about the main issues and make decisions on different issues. This meeting is different and not as formal. It is known as a European Council. The European Commission runs the day-to-day running of the EU and writes laws, like a government.", "It has a common style for (its) passports. After World War II, the countries in Europe wanted to live peacefully together and help one another's economies. Instead of fighting each other for coal and steel, the first member countries (West) Germany, France, Italy, Belgium, Netherlands, and Luxembourg created one European Coal and Steel Community in 1952. In 1957 in the Italian city of Rome, the member countries signed another treaty and made the European Economic Community. Now it was a community for coal, steel and for trade. Later it changed the name to the European Community. In 1993, with the \"Treaty of Maastricht\" it changed its name to the European Union. Now the member countries work together not only in politics and economy (coal, steel and trade), but also in money, justice (laws), and foreign affairs. With the Schengen Agreement, 22 member countries of the EU opened their borders to each other, so people can now travel from one country to the other without a passport or identity card. Many of the countries of the EU also share a currency, which is called the euro. 10 new countries became members of the EU in 2004, 2 more became members in 2007, and 1 more in 2013. In 2016, the United Kingdom voted to leave the EU. In 2024 there are 27 member countries. A person who is a citizen of the European Union can live and work in any of the 27 member states without needing a work permit or visa. For example, a French person can move to Greece to work there, or just to live there, and he or she does not need permission from an authority in Greece. Products made in one member country can be sold in any other member country without any special permissions or extra taxes.", "The ECB is governed by European law directly, but its set-up resembles that of a corporation in the sense that the ECB has shareholders and stock capital. Its capital is \u20ac11 billion held by the national central banks of the member states as shareholders. The initial capital allocation key was determined in 1998 on the basis of the states' population and GDP, but the capital key has been adjusted. Shares in the ECB are not transferable and cannot be used as collateral. The European Central Bank is the main bank of the European Union. The European Central Bank is in Frankfurt am Main. The main goal of the European Central Bank is to maintain price stability, in other words make sure inflation is below 2%. This is done by e.g. controlling the interest rates. It is also the only bank allowed to issue euro banknotes (\u20ac), used by 16 of the 28 member states of the European Union (EU). Presidents:", "Personal union\n\nA personal union is a relationship of two or more sovereign states, which, through law, share the same person as their head of state. Personal unions can begin for very different reasons. In many cases a princess who is already married to a king becomes pregnant, and their child inherits the crown of both countries. However, a personal union sometimes was seen as a means against uprisings if a state wants an annexation of an other state. The unions can be written down in a constitution, which clearly expresses that both states shall share the same person as head of state. When that is not the case, a personal union can easily be broken. Personal union with the Congo Free State from 1885 to 1908, when it annexed the Congo Free State. Personal union with Belgium from 1885 to 1908, when Belgium annexed it. The actual situation was slightly more complex with the Dutch provinces Holland, Zeeland, Utrecht, Gelderland and Overijssel entering into personal union in 1689 and Drenthe in 1696. Only 2 Dutch provinces never entered into the personal union: Friesland and Groningen.", "It joined the European Economic Community on 1 January 1973. On 23 June 2016, 51.9% of voters chose to leave the EU. The country formally withdrew from the EU on 31 January 2020. This means that there is 27 members of the European Union.", "The Eighty Years' War (1568\u20131648) divided the Low Countries into the northern United Provinces and the Southern Netherlands. Southern Netherlands were ruled by the Spanish and the Austrian Habsburgs. This made up most of modern Belgium. After the , the Low Countries were added into the French First Republic. This ended Austrian rule in the area. Adding back the Low Countries formed the United Kingdom of the Netherlands. This happened at the end of the First French Empire in 1815. The Belgian Revolution was in 1830. Leopold became king on 1831. This is now celebrated as Belgium's National Day. The Berlin Conference of 1885 gave control of the Congo Free State to King Leopold\u00a0II. Millions of Congolese people were hurt or killed, mostly to make rubber, and Leopold became very wealthy. In 1908 the Belgian state took control of the colony after a scandal about the deaths. Germany invaded Belgium in 1914. This was part of World War I. The opening months of the war were very bad in Belgium. During the war Belgium took over Ruanda-Urundi (modern-day Rwanda and Burundi). After the War, the Prussian districts of Eupen and Malmedy were added into Belgium in 1925. The country was again invaded by Germany in 1940 and under German control until 1944. After World War II, the people made king Leopold III leave his throne in 1951. This is because they thought he helped the Germans. Belgium joined NATO as a founding member. In 1960 the Belgian Congo stopped being under Belgian rule. Two years later Ruanda-Urundi also became free. Belgium is next to France, Germany, Luxembourg and the Netherlands. Its total area is 34,143\u00a0square kilometers (including sea area). The land area alone is 30,689\u00a0km\u00b2, of which 195\u00a0km\u00b2 or 0.64% are inland and coastal waters.", "Independence and Democracy\n\nIndependence and Democracy is a group in the European Parliament. It used to be called the Group of Europe of Democracies and Diversities. It has about 37 members in it. The members of this group either want their country to leave the European Union, or want to change it.", "The land area alone is 30,689\u00a0km\u00b2, of which 195\u00a0km\u00b2 or 0.64% are inland and coastal waters. Belgium has three main geographical regions. The coastal plain is in the north-west. The central plateau are part of the Anglo-Belgian Basin. The Ardennes uplands are in the south-east. The Paris Basin reaches a small fourth area at Belgium's southernmost tip, Belgian Lorraine. The coastal plain is mostly sand dunes and polders. Further inland is a smooth, slowly rising landscape. There are fertile valleys. The hills have many forests. The plateaus of the Ardennes are more rough and rocky. They have caves and small, narrow valleys. Signal de Botrange is the country's highest point at 694 metres (2,277\u00a0ft). Belgium is divided into three regions: Flemish Region (Flanders), Walloon Region (Wallonia), and Brussels-Capital Region (Brussels Region or Brussels - also the name of the city): \u00b9 The city of Brussels does not lie in Flanders Region and therefore cannot be the largest city of this region. \u00b2 German name: Wallonie(n): the very eastern part of the Walloon Region is officially German-speaking, the so-called German-speaking Community of Belgium. Flanders and Wallonia are divided into provinces. Brussels (Region) is not part of any province. \u00b9 German name: L\u00fcttich - the very eastern part of the province of Li\u00e8ge is officially German-speaking, the so-called German-speaking Community of Belgium. Belgium has a mostly oceanic climate, but the Belgian Ardennes has a continental climate. The highest temperature ever recorded in Belgium was , on 25 July 2019 in Begijnendijk. The lowest temperature ever recorded in Belgium was , on 20 January 1940 in Lesse."], "reference_contexts": ["Belgium Belgium (officially the Kingdom of Belgium; , , ) is a country in Western Europe. Its capital, Brussels, is the home of many organizations including the European Union and NATO. Belgium is bordered by The Netherlands in the north, Germany to the east, Luxembourg to the southeast and France to the south. Belgium has an area of . Around 11.6 million people live in Belgium. It is a founding member of the European Union and is home to its headquarters. There are three regions in Belgium. The regions are mainly based on language and culture. Flanders and Wallonia are both split up into five provinces each. The population is about 60% Dutch-speaking, 39% French-speaking, and 1% German-speaking (the so-called \"Deutschbelgier\"). To look after all these groups, Belgium has a complex system of government with highly autonomous regions. The name 'Belgium' comes from \"Gallia Belgica\". This was a Roman province in the northernmost part of Gaul. Before Roman invasion in 100 BC, the \"Belgae\", a mix of Celtic and Germanic peoples, lived there. The Germanic Frankish tribes during the 5th century brought the area under the rule of the Merovingian kings. A slow shift of power during the 8th century led the kingdom of the Franks to change into the Carolingian Empire. The Treaty of Verdun in 843 divided the region into Middle and West Francia. They were vassals either of the King of France or of the Holy Roman Emperor. Many of these fiefdoms were united in the Burgundian Netherlands of the 14th and 15th centuries. The Eighty Years' War (1568\u20131648) divided the Low Countries into the northern United Provinces and the Southern Netherlands. Southern Netherlands were ruled by the Spanish and the Austrian Habsburgs. This made up most of modern Belgium. After the , the Low Countries were added into the French First Republic. This ended Austrian rule in the area. Adding back the Low Countries formed the United Kingdom of the Netherlands. This happened at the end of the First French Empire in 1815. The Belgian Revolution was in 1830. Leopold became king on 1831. This is now celebrated as Belgium's National Day. The Berlin Conference of 1885 gave control of the Congo Free State to King Leopold II. Millions of Congolese people were hurt or killed, mostly to make rubber, and Leopold became very wealthy. In 1908 the Belgian state took control of the colony after a scandal about the deaths. Germany invaded Belgium in 1914. This was part of World War I. The opening months of the war were very bad in Belgium. During the war Belgium took over Ruanda-Urundi (modern-day Rwanda and Burundi). After the War, the Prussian districts of Eupen and Malmedy were added into Belgium in 1925. The country was again invaded by Germany in 1940 and under German control until 1944. After World War II, the people made king Leopold III leave his throne in 1951. This is because they thought he helped the Germans. Belgium joined NATO as a founding member. In 1960 the Belgian Congo stopped being under Belgian rule. Two years later Ruanda-Urundi also became free. Belgium is next to France, Germany, Luxembourg and the Netherlands. Its total area is 34,143 square kilometers (including sea area). The land area alone is 30,689 km\u00b2, of which 195 km\u00b2 or 0.64% are inland and coastal waters. Belgium has three main geographical regions. The coastal plain is in the north-west. The central plateau are part of the Anglo-Belgian Basin. The Ardennes uplands are in the south-east. The Paris Basin reaches a small fourth area at Belgium's southernmost tip, Belgian Lorraine. The coastal plain is mostly sand dunes and polders. Further inland is a smooth, slowly rising landscape. There are fertile valleys. The hills have many forests. The plateaus of the Ardennes are more rough and rocky. They have caves and small, narrow valleys. Signal de Botrange is the country's highest point at 694 metres (2,277 ft). Belgium is divided into three regions: Flemish Region (Flanders), Walloon Region (Wallonia), and Brussels-Capital Region (Brussels Region or Brussels - also the name of the city): \u00b9 The city of Brussels does not lie in Flanders Region and therefore cannot be the largest city of this region. \u00b2 German name: Wallonie(n): the very eastern part of the Walloon Region is officially German-speaking, the so-called German-speaking Community of Belgium. Flanders and Wallonia are divided into provinces. Brussels (Region) is not part of any province. \u00b9 German name: L\u00fcttich - the very eastern part of the province of Li\u00e8ge is officially German-speaking, the so-called German-speaking Community of Belgium. Belgium has a mostly oceanic climate, but the Belgian Ardennes has a continental climate. The highest temperature ever recorded in Belgium was , on 25 July 2019 in Begijnendijk. The lowest temperature ever recorded in Belgium was , on 20 January 1940 in Lesse. Since 1993, Belgium is a federal state, divided into three regions and three communities."], "response": "Belgium is a founding member of the European Union and is home to its headquarters. The capital, Brussels, hosts many EU organizations, including the European Commission and the European Parliament, which are key institutions in the EU's governance and legislative processes [File: wiki_00.txt, Section: Belgium].", "reference": "Belgium is a founding member of the European Union and is home to its headquarters, with Brussels being the capital where many organizations, including the European Union, are located."}
{"user_input": "How did Daoism emerge as a philosophical response during the Warring States Period in ancient China?", "retrieved_contexts": ["Despite the bloodiness and strife of the period, this was the time when many great philosophies emerged - including Confucianism and Daoism as a response to disintegrating central authority of the Zhou kings and fluctuating power of the vassal states, and the general uncertainty of that era. Confucianism and Daoism have been the foundation of many social values seen in modern east Asian cultures today. Other notable dynasties include the Han (from which is derived the ethnonym the Han Chinese, which is synonymous with the older self-referential term - the Huaxia) as well as dynasties such as the Tang, Song, and Ming, which were characterised by periods of affluence, wealth, population growth, and the proliferation of literature. During the later years, China was often raided or invaded by northern nomadic people such as the Xiongnu, the Xianbei, the Jurchens and the Mongols (the latter led by Genghis Khan and Kublai Khan). One effect of regular nomadic invasion and the collapse of native dynasties was the massive migration of Han Chinese - especially the aristocratic elite and the literati, to sparsely populated frontier regions south of the Yangzi river such as Jiangsu, Zhejiang, Guangdong and Fujian. Several notable waves of Han Chinese immigration to Jiangsu, Zhejiang, Guangdong and Fujian took place during the collapse of the Jin, the Tang, and the Song. Some nomadic groups succeeded in conquering the whole territory of China, establishing dynasties such as the Yuan (Mongol) and Qing (Manchu). Each time, they also brought new elements into Chinese culture - for instance, military uniform, the qipao and the pigtail, the latter of which was deeply resented by the Han Chinese.", "Legalism\n\nLegalism was one of the four main philosophies in Chinese history during the Warring States Period. It is a political philosophy which says that people are bad by nature and need to be controlled by the government. It was introduced by Qin Shi Huang. One of the most important contributors to Legalism was Han Fei (). He said that a ruler must use following tools to govern a state:", "Statues and pottery, as well as decorations made of jade, are some classic examples. Before the Qin Dynasty united China, there were many small feudal states, nominally loyal to the Zhou King, that fought each other for hundreds of years in a war to control China. The majority of these states were ruled by relatives and clansmen of the Zhou royal house and carried the surname Ji (\u59ec) and so were tied by family bonds to the Zhou king, to whom they were ritually subordinate, as members of collateral or lesser lineages. A minority of these states, such as the Qin and Chu, were ruled by non-Zhou clansmen, and were awarded their fiefs on account of some merit. Over time, these feudal states attained to power and wealth, that exceeded that of their Zhou nominal overlord, whose direct authority became confined to a very small territory near present-day Zhengzhou. These states also began to acquire some distinctive characteristics and identities of their own during the long centuries of loose control by the Zhou. Eventually, the Zhou kings were eclipsed in power by two especially problematic vassals - the Qin and Chu, and the functional independence of the Qin later led to its gradual conquest of all other vassal states and the formal supplantation of the Zhou to form a heavily centralised Empire. The long decline of the Zhou, incidentally the longest ruling dynastic house of China, is known as the Warring States Period. Despite the bloodiness and strife of the period, this was the time when many great philosophies emerged - including Confucianism and Daoism as a response to disintegrating central authority of the Zhou kings and fluctuating power of the vassal states, and the general uncertainty of that era.", "It has archaeological evidence over 5,000 years old. It also has one of the world's oldest writing systems (and the oldest in use today), and is viewed as the source of many major inventions. Ancient China was one of the first civilizations and was active since the 2nd millennium BC as a feudal society. Chinese civilization was also one of the few to invent writing, with the others being Mesopotamia, the Indus Valley civilization, the Maya civilization, the Minoan civilization of ancient Greece, and Ancient Egypt. It reached its golden age during the Tang Dynasty (c. A.D. 10th century). Home of Confucianism and Daoism, it had great influence on nearby countries including Japan, Korea, and Vietnam in the areas of political system, philosophy, religion, art, and even writing and literature. China is home to some of the oldest artwork in the world. Statues and pottery, as well as decorations made of jade, are some classic examples. Before the Qin Dynasty united China, there were hundreds of small states that fought each other for hundreds of years in a war to control China. This is known as the Warring States Period. Although the continuing wars made people suffer, it was at this time when many of the great philosophies of the East were born, including Confucianism and Daoism. Confucianism and Daoism alone have been the foundation of many social values seen in modern eastern-Asian cultures today. Its geography mostly looked like that of modern China, except with northern and western edges that varied. It was often attacked by northern nomadic people such as the Turkic tribes and the Mongols lead by Genghis Khan and Kublai Khan.", "The Spring and Autumn Period continued for about 300 years. By the 5th century BC, there were only seven main Chinese states left. They had taken over all the smaller areas. These states continued to fight each other. Historians call this period the Warring States Period due to wars and fights among these states. In 221 BC, Ying Zheng, king of the State of Qin, united all seven states. He made himself the Emperor of China and founded the Qin Dynasty. Between eras of multiple kingdoms and warlordism, Chinese dynasties have ruled parts or all of China. In some eras, control has stretched as far as Central Asia, Tibet and Vietnam. This Chinese imperialism began with the Qin Dynasty: in 221 BC, Qin Shi Huang conquered the various warring kingdoms and created the first Chinese empire. The Qin () emperor Qin Shi Huang made everyone write the same way. He also had ideas about the state which he based on legalism and fought Confucianism. Successive dynasties in Chinese history developed bureaucratic systems that gave the Emperor of China direct control of vast territories. The conventional view of Chinese history is that of alternating periods of political unity and disunity, with China occasionally being dominated by steppe peoples, most of whom were in turn assimilated into the Han Chinese population. Cultural and political influences from many parts of Asia, carried by successive waves of immigration, expansion, and cultural assimilation, are part of the modern culture of China.", "It probably ended at about 30\u00a0BC when the country was invaded by the Roman Empire. The society of ancient Egypt depended on a balance of natural and human resources, especially the irrigation of the Nile Valley so that Egyptians could grow crops. There was a great difference between classes in this society, as there is today. Most of the people were farmers but they did not own the agricultural products they produced. These were property of the state, temple, or noble family that owned the land. There was slavery, but it is not clear how it was practiced. The Religion of Ancient Egypt encouraged people to respect their rulers and their past. The Egyptians are known for writing in hieroglyphs, building the famous pyramids, and their successful agriculture. The religion of Judaism formed about 1500 BC. China began as city-states in the Yellow River valley. The Shang Dynasty (\u5546\u671d) was the first dynasty of Ancient China.Turtle shells with writing on them have been carbon dated to about 1500\u00a0BC. The Zhou Dynasty came after the Shang Dynasty. \"Kong Fuzi\" and Laozi lived at the end of the Zhou Dynasty. They were the greatest Chinese philosophers. They founded new philosophies, or ways of thinking. Confucius founded Confucianism and Laozi founded Daoism. After the Zhou Dynasty came the Warring States Period. The Qin (\u79e6) dynasty came after the Warring States Period. The Qin emperor Qin Shi Huang created the first centralized state in China in 221\u00a0BC. It was based on his based on his political philosophy of legalism. He made everyone write the same way. He fought against \"Confucianism\". He also started building what would later become the Great Wall. In 202\u00a0BC the Han Dynasty took over. It was about as strong as the Roman Empire."], "reference_contexts": ["Human body The human body is the body of a person. It is the physical structure of a person. The body is a thing that can be hurt or killed. Its functions are stopped by death. You need your muscles and your joints to move. Some people study the human body. They look at where it is different from, or the same as, other animals' bodies. These animals can be alive today. Or they can be extinct animals like other hominids. (Hominids are primates that are close to humans. Neanderthals and \"Homo erectus\" were hominids.) Some people study how the human body works and lives in its environment. Some people study what people think about their body. Artists study how to draw or paint the human body. China China ( Pinyin: Zh\u014dnggu\u00f3) is a cultural region, an ancient civilization, and a nation in East Asia. The official name is People's Republic of China or PRC. The last Chinese Civil War (19271949) resulted in two different political powers today: China is one of the world's oldest civilizations: it has the oldest continuous civilization near the Yellow River region. There is archaeological evidence over 5,000 years old. China also has one of the world's oldest writing systems (and the oldest in use today). China has been the source of many major inventions. Geographically, China\u2019s longest river is the Yangtze River which runs through mega cities and is home to many species. It is the world\u2019s third longest river. The first recorded use of the word \"China\" is dated 190. It is derived from \"ch\u012bn\u012b\", a Persian adjective meaning 'Chinese' which was popularized in Europe by Marco Polo. Ancient China was one of the first civilizations and was active since the 2nd millennium BC as a feudal society. Chinese civilization was also one of the few to invent writing, with the others being Mesopotamia, the Indus Valley civilization, the Maya civilization, the Minoan civilization of ancient Greece, and Ancient Egypt. It reached its golden age during the Tang Dynasty (c. A.D. 10th century). Home of Confucianism and Daoism, it had great influence on nearby countries including Japan, Korea, and Vietnam in the areas of political system, philosophy, religion, art, writing and literature. China is home to some of the oldest artwork in the world. Statues and pottery, as well as decorations made of jade, are some classic examples. Before the Qin Dynasty united China, there were many small feudal states, nominally loyal to the Zhou King, that fought each other for hundreds of years in a war to control China. The majority of these states were ruled by relatives and clansmen of the Zhou royal house and carried the surname Ji (\u59ec) and so were tied by family bonds to the Zhou king, to whom they were ritually subordinate, as members of collateral or lesser lineages. A minority of these states, such as the Qin and Chu, were ruled by non-Zhou clansmen, and were awarded their fiefs on account of some merit. Over time, these feudal states attained to power and wealth, that exceeded that of their Zhou nominal overlord, whose direct authority became confined to a very small territory near present-day Zhengzhou. These states also began to acquire some distinctive characteristics and identities of their own during the long centuries of loose control by the Zhou. Eventually, the Zhou kings were eclipsed in power by two especially problematic vassals - the Qin and Chu, and the functional independence of the Qin later led to its gradual conquest of all other vassal states and the formal supplantation of the Zhou to form a heavily centralised Empire. The long decline of the Zhou, incidentally the longest ruling dynastic house of China, is known as the Warring States Period. Despite the bloodiness and strife of the period, this was the time when many great philosophies emerged - including Confucianism and Daoism as a response to disintegrating central authority of the Zhou kings and fluctuating power of the vassal states, and the general uncertainty of that era. Confucianism and Daoism have been the foundation of many social values seen in modern east Asian cultures today."], "response": "Daoism emerged as a philosophical response during the Warring States Period in ancient China as a reaction to the disintegrating central authority of the Zhou kings and the fluctuating power of the vassal states. The general uncertainty and strife of that era led to the development of Daoism, alongside Confucianism, as a way to address the challenges of the time [File: wiki_00.txt, Section: China].", "reference": "Daoism emerged as a response to the disintegrating central authority of the Zhou kings and the fluctuating power of the vassal states during the Warring States Period. This era, marked by bloodiness and strife, was a time when many great philosophies, including Daoism, were developed to address the general uncertainty and challenges faced by society."}
{"user_input": "Wut is the Ming dynasty known for?", "retrieved_contexts": ["Sarasvati River\n\nSarasvati River was one of the major rivers of Ancient India. The river flowed through parts of western and northern India. Then in Allahabad, the river merged with the Jamuna River. At one time, Sarasvati was a deep river. The river dried up and became lost over a few hundred years, possibly between 2000 and 1500 BC. Ming dynasty The Ming dynasty was the family of emperors who led China from 1368 to 1644. The name is also used to talk about the that they led and the 276 years in Chinese history that it lasted. It is also famous for its pottery from Jingdezhen in Jiangxi and Dehua in Fujian. The Ming dynasty is known in Chinese as the \"M\u00edng\". This is written as in Chinese characters. The character is a sun () and a moon () together and means \"bright\". Chinese uses different words to talk about the different meanings of a Chinese \"dynasty\" in English: their government is called the \"M\u00edng ch\u00e1o\" , their country is called the \"D\u00e0 M\u00edng d\u00ecgu\u00f3\" ( or , and their time in Chinese history is called the \"M\u00edng d\u00e0i\" . Unlike in English, the name of the dynasty is not the same as the family name of the leaders. The family that led China during the Ming were the Zh\u016bs. This is written as in Chinese characters. Today, it is just a common Chinese family name, but at that time it meant a kind of red coloring made from cinnabar (HgS). The Yuan dynasty before them had been part of the Mongol Empire started by Genghis Khan. The Yuan dynasty was established by Kublai Khan. Its emperors had been Mongolian people, but most of China was Han Chinese.", "The Yongle Emperor did not like many of the people in government who got there by doing well on their tests. He gave more power to eunuchs, men who were hurt as children to stop them from being able to have children of their own. One of these was Zheng He, a Muslim who led great treasure ships south from Suzhou and Nanjing in 7 big trips between 1405 and 1433. The first trips may have been looking for the Jianwen Emperor, but they also became trips that taught China about the South China Sea and Indian Ocean and opened up more buying and selling between their countries and China. The Mings' main capital of Beijing fell in 1644 to a rebellion led by Li Zicheng, who established the Shun dynasty. This was soon replaced by the Manchu-led Qing dynasty. The people who still liked the Ming continued to fight as the Southern Ming up to 1683. The Ming Empire has been described as \"one of the greatest eras of orderly government and social stability in human history\". It was the last Chinese dynasty led by the Han Chinese, not counting the short-lived governments of Li Zicheng and Yuan Shikai. It is also famous for its pottery from Jingdezhen in Jiangxi and Dehua in Fujian.", "He opened up China to many other cultures and improved life for the Chinese very much. In 1368, a rebellion led by Zhu Yuanzhang broke out in southern China and eventually overthrew the Yuan Dynasty. Then Zhu Yuanzhang founded the Ming Dynasty at Nanjing, its capital until Emperor Yongle changed the capital to Beijing. In the 15th century, a man named Zheng He took the majority of the Ming navy to explore the Indian Ocean and brought wealth and power to the Ming Dynasty. The empire experienced a prosperous period until 1449 when the Battle of Tumu Fortress broke out. In the battle, the Mongol descendants of Yuan captured the emperor and surrounded the capital. After the war with the Mongols, the Ming started to decline. During this time, the empire had two wars with the Japanese (the first against the Japanese pirates took place in southeastern China; the second against the armies of Toyotomi Hideyoshi that invaded Korea), and one war with the Portuguese of Macao. These wars eventually weakened the declining empire. In 1616, rebellions broke out at Manchuria and Shanxi. Twenty-eight years later, the Manchus crossed the Great Wall, invaded the capital, and destroyed the Shanxi rebels. Horses, cattle, farms, villages, servants, slaves, homes, and wives were given by Nurhaci to Jurchens who defected like Guwalca, Hurha, and Warka as well as Han Chinese defectors and Mongol defectors to Later Jin. Jurchen chiefs were given Korean women as wives by Joseon to control them. Scholars commissioned by Qianlong when editing historical texts and making commentaries on them often made up fanciful and completely fictional etymologies.", "Nurhaci\n\nTaizu Emperor (, 1559 - 1626) was the founding father of the Qing Dynasty. His name was Nurhaci and Aisin Gioro was his surname. The reign name was Tian Ming. Nurhaci was Manchurian. He was also the creator of the Manchu alphabet. In 1580, Nurhaci became the Jianzhou general of the Ming Dynasty. He unified the Manchu tribe and organised the Eight Banners. In 1616, Nurhaci declared himself Khan (King) and founded the Jin Dynasty in Liaoning. In 1618, in order to encourage people to against the Ming Dynasty. Nurhaci wrote an article called the Seven Great Vexations and sent it to the public. Form 1618 until 1622, Nurhaci led armies to against the Ming Dynasty. He successfully occupied 70 cities in the north-eastern part of China. The capital was changed to Liao Yang after several battles. In 1622, Nurhaci's armies captured Guangning. In 1626, Nurhaci led armies to attack the Ningyuan city. Unluckily, Nurhaci was wounded by Yuan Chonghuan's Portuguese cannon and he died 2 days later at a little town called De-A Man.", "The dynasty is important because it reunited Southern and Northern China and the Grand Canal was built then. The Tang Dynasty was founded by the Li (\u674e) family, who came to power during the fall of the Sui Empire. The dynasty was interrupted for a short time by the Second Zhou Dynasty (16 October 690\u20133 March 705) when Empress Wu Zetian managed to claim the throne, becoming the first and only Chinese Empress. The capital of the Tang, Chang'an (today Xi'an), was the biggest city in the world at the time. Many historians see the Tang dynasty as a high point in Chinese civilization and as a golden age of cosmopolitan culture. The concept of inalienable private property has grown in China since the Tang dynasty. Chinese land deeds are preserved from medieval times and there were even land deeds for the afterlife in tombs in the Six dynasties. The Song dynasty maintained the image and memory of the \"universal empire\" of the Han dynasty and Tang dynasty periods despite contracting in size. One of the descendants of the Yan clan during the Song dynasty was Yan Zhengqing. When Eastern Jin was set up by Han Chinese nobles fleeing south, Yan Han was among the nobles and he was the ancestor of the Yan clan, who were related by blood to the Langye nobles who they married including the Wang clan of Langye, the Yin Clan of Chen commandery and Shen clan of Wuxing. Yan Han was the 13th generation ancestor of Yan Zhenqing. The Yuan Dynasty was first ruled by Genghis Khan, a Mongolian leader who took control of the Song Dynasty. He was considered a barbarian and not civilized. His grandson, Kublai Khan, was one of the most famous and liked rulers of the Yuan dynasty. He opened up China to many other cultures and improved life for the Chinese very much.", "Yuan dynasty\n\nThe Yuan dynasty was a Mongol dynasty that ruled Mongolia and China from 1271 to 1368. Before this dynasty, China was ruled by the Song dynasty. After the Yuan dynasty, the Ming dynasty ruled China. Genghis Khan and his army of Mongols conquered many parts of China. His grandson Kublai Khan added more parts of China to his kingdom. He founded the Yuan dynasty in 1271. In the year of 1206, Genghis Khan ruled the Mobi tribes(a part of a country) to establish the Mongol country at the Onon River. Jin was the main race in Mongolia, but Jin and Xia were in decline, Mongolia had attacked the Western Xia and Jin in August 1227, and Jin lost, so Mongolia occupied the whole north of China in March 1234. In 1259, M\u00f6ngke Khan died after the Song Yuan dynasty war. His brothers all wanted to be king. His fourth brother, Kublai, and his seventh brother, Ali Khan, fought to rule the Mobi tribes. And finally in 1264, Kublai won. Kublai made the name \"DaYuan\" in 1271 and proclaimed the Yuan Dynasty and said its founder was his grandfather Genghis. In 1276, Yuan ruled southern of Song, so yuan ruled the whole China in this year. In 1279, the Kublai subdued southern Song dynasty. The Yuan dynasty ruled China and brought different parts of China together that had been split since the late Tang dynasty. They were the first foreign dynasty to rule just about all of China. For centuries, most of what the West knew about China came from the book by Marco Polo about his visit to Kublai's empire. The Yuan dynasty ended in 1368 when the Ming dynasty took control."], "reference_contexts": ["Other notable dynasties include the Han (from which is derived the ethnonym the Han Chinese, which is synonymous with the older self-referential term - the Huaxia) as well as dynasties such as the Tang, Song, and Ming, which were characterised by periods of affluence, wealth, population growth, and the proliferation of literature. During the later years, China was often raided or invaded by northern nomadic people such as the Xiongnu, the Xianbei, the Jurchens and the Mongols (the latter led by Genghis Khan and Kublai Khan). One effect of regular nomadic invasion and the collapse of native dynasties was the massive migration of Han Chinese - especially the aristocratic elite and the literati, to sparsely populated frontier regions south of the Yangzi river such as Jiangsu, Zhejiang, Guangdong and Fujian. Several notable waves of Han Chinese immigration to Jiangsu, Zhejiang, Guangdong and Fujian took place during the collapse of the Jin, the Tang, and the Song. Some nomadic groups succeeded in conquering the whole territory of China, establishing dynasties such as the Yuan (Mongol) and Qing (Manchu). Each time, they also brought new elements into Chinese culture - for instance, military uniform, the qipao and the pigtail, the latter of which was deeply resented by the Han Chinese. While China achieved many things in the First millennium and early 2nd millennium, it became an isolationist country in the 15th century C.E. This was because Spain found enormous silver in the new continent, which was the main currency (money) in China and Europe at the time, and China did not want to be bought by the foreigners. By the time of the Renaissance, European powers started to take over other countries in Asia. While China was never actually taken over, many European countries, such as Britain and France built spheres of influence in China. Since China had cut itself off from the world over the previous few centuries, by the Qing Dynasty, it had fallen behind other countries in technology, and was helpless to stop this from happening. This had become clear when it lost the Opium Wars to Britain in the 19th century. Still influenced by Western sources, China faced internal strife. The Taiping Rebellion or Taiping War occurred in China from 1851 through 1864. The Taiping Rebellion was led by Hong Xiuquan from Guangdong. Hong Xiuquan was influenced by Christian missionaries and declared himself the brother of Jesus. Hong made his mission to bring down the Qing Dynasty. Gaining influence on the southern Chinese population, the Taiping Rebellion attracted tens of thousands of supporters. The Taiping regime successfully created a state within the Qing Empire with the capital at Nanjing. Hong called his new state the Taiping Tianguo or \"The Heavenly State of Great Peace\". Local armies eventually suppressed the rebellion at the final battle of Nanjing. In 1911, the Republic of China was founded after the Xinhai revolution led by Sun Yat-sen, but its government was very weak. Warlords controlled many areas. Chiang Kai-shek led wars against them, and he became president and dictator. In 1931, Japan invaded Manchuria, a place in the northeastern part of China. On July 7, 1937, the Japanese attacked the rest of the country, starting what was called the Second Sino-Japanese War. On December 13 of that same year, The Japanese Army killed an estimated (guessed) 200,000 to 300,000 Chinese civilians (people) which is called Nanjing Massacre. The war later became part of World War II. The war was fought for eight years and millions of Chinese people were killed. However, the Chinese Civil War later started between the Kuomintang (Nationalists) of the Republic of China (ROC) and the Communists of the People's Republic of China (PRC). The Communists wanted to make China like the Soviet Union, whereas the other side wanted to keep China in its current state at the time. The Communists were led by Mao Zedong, Liu Shaoqi, Zhou Enlai and others. The Communists eventually won the war by uniting all the people from different positions. The Nationalists (led by Chiang Kai-shek) fled to the island of Taiwan and set up their new capital city in Taipei. After the Chinese Civil War, the Communist leader Mao Zedong declared a new country, the People's Republic of China (PRC), in Beijing on October 1, 1949. Under Mao the country stayed poor while Taiwan became richer. His attempt at industrialization and collectivization with the Great Leap Forward led to the deaths of many people from famine. The Cultural Revolution caused great social upheaval. After 1976, China underwent market economy reforms under Deng Xiaoping, and experienced rapid economic growth, which made the former progress made by Taiwan became overshadowed. China is now one of the largest economies in the world, relying mainly on exports and manufactering. In recent history, China has had problems with protests, blocking of information on the Internet, and censorship of news. 1989 was notable for the controversial Tiananmen Square protests. Since the 2008 Olympics, China has hosted many major international events, and the 2022 Winter Olympics were held in Beijing, China. China's landscape is vast and diverse. It ranges from the Gobi and Taklamakan Deserts in the north to subtropical forests in the south. The Himalaya, Karakoram, Pamir and Tian Shan mountain ranges separate China from much of South and Central Asia. The Yangtze and Yellow Rivers run from the Tibetan Plateau to the densely populated eastern coast. The Yangtze River is the third-longest river in the world while the Yellow River is the sixth-longest. China's coastline along the Pacific Ocean is 14,500 kilometers (9,000 mi) long. It is bounded by the Bohai, Yellow, East China and South China seas. China connects through the Kazakh border to the Eurasian Steppe. The Eurasian Steppe has been an artery of communication between East and West since the Neolithic through the Steppe route. The Steppe Route is the ancestor of the terrestrial Silk Road(s). China's constitution states that The People's Republic of China \"is a socialist state under the people's democratic dictatorship led"], "response": "The Ming dynasty is known for its pottery from Jingdezhen in Jiangxi and Dehua in Fujian, as well as being one of the greatest eras of orderly government and social stability in human history. It was the last Chinese dynasty led by the Han Chinese. The dynasty is also noted for the voyages of Zheng He, who led treasure ships on seven major expeditions between 1405 and 1433, opening up trade and cultural exchanges between China and other regions [File: wiki_15.txt, Section: Sarasvati River].", "reference": "The Ming dynasty is characterized by periods of affluence, wealth, population growth, and the proliferation of literature."}
{"user_input": "What is the significance of the People's Liberation Army in the context of China's military structure and its global standing?", "retrieved_contexts": ["China's constitution states that The People's Republic of China \"is a socialist state under the people's democratic dictatorship led by the working class and based on the alliance of workers and peasants\". It also states the state organs \"apply the principle of democratic centralism.\" The PRC is one of the world's only socialist states openly being communist. With 2.3 million active troops, the People's Liberation Army (PLA) is the largest standing military force in the world. The PLA is commanded by the Central Military Commission (CMC). China has the second-biggest military reserve force, only behind North Korea. The PLA consists of the Ground Force (PLAGF), the Navy (PLAN), the Air Force (PLAAF), and the People's Liberation Army Rocket Force (PLARF). According to the Chinese government, China's military budget for 2017 was US$151,5 billion. China has the world's second-largest military budget. China was once a world leader in science and technology up until the Ming dynasty. There are many Ancient Chinese discoveries and inventions. For example, papermaking, printing, the compass, and gunpowder are known as the Four Great Inventions. They became widespread across East Asia, the Middle East and later to Europe. Chinese mathematicians were the first to use negative numbers. By the 17th century, Europe and the Western world became better than China in science and technology. The national census of 2010 recorded the population of the People's Republic of China to be about 1,370,536,875. About 16.60% of the population were 14 years old or younger, 70.14% were between 15 and 59 years old, and 13.26% were over 60 years old.", "The current president is Xi Jinping, who is also the General Secretary of the Communist Party of China and the Chairman of the Central Military Commission, making him China's Paramount leader. The Premier is the head of government, heading the State Council alongside with four vice premiers and the heads of ministries and commissions. The current premier is Li Keqiang, who is also a senior member of the Politburo Standing Committee of the CPC, China's \"de facto\" top decision-making body. The PRC Armed Forces, also known as the People's Liberation Army (PLA), is one of the most powerful armies in the world. Nowadays PRC is among the atomic powers in the world. It also has the largest standing army in the world of over 2 million soldiers on active duty. There are 56 recognized ethnic minority groups in China. Han_Chinese is the largest ethnic group in China. Mandarin Chinese is the main spoken language. China is the origin of Eastern martial arts, called Kung Fu or Wushu. China is also the home of the well-respected Spa Monastery and Wudang Mountains. Martial art started more for the purpose of survival, defense, and warfare than art. Over time some art forms have branched off, while others have retained their distinct Chinese characteristics. China has had renowned artists including Wong Fei Hung and many others. Art has also co-existed with a variety of paints including the more standard 18 colors. Legendary and controversial moves like Big Mak are also praised and talked about within the culture. China has many traditional festivals, such as the Chinese New Year, Dragon Boat Festival, Mid-Autumn Festival and so on. The most significant is Chinese New Year. Another important holiday is the National Day celebration around October.", "Local armies eventually suppressed the rebellion at the final battle of Nanjing. In 1911, the Republic of China was founded after the Xinhai revolution led by Sun Yat-sen, but its government was very weak. Warlords controlled many areas. Chiang Kai-shek led wars against them, and he became president and dictator. In 1931, Japan invaded Manchuria, a place in the northeastern part of China. On July 7, 1937, the Japanese attacked the rest of the country, starting what was called the Second Sino-Japanese War. On December 13 of that same year, The Japanese Army killed an estimated (guessed) 200,000 to 300,000 Chinese civilians (people) which is called Nanjing Massacre. The war later became part of World War II. The war was fought for eight years and millions of Chinese people were killed. However, the Chinese Civil War later started between the Kuomintang (Nationalists) of the Republic of China (ROC) and the Communists of the People's Republic of China (PRC). The Communists wanted to make China like the Soviet Union, whereas the other side wanted to keep China in its current state at the time. The Communists were led by Mao Zedong, Liu Shaoqi, Zhou Enlai and others. The Communists eventually won the war by uniting all the people from different positions. The Nationalists (led by Chiang Kai-shek) fled to the island of Taiwan and set up their new capital city in Taipei. After the Chinese Civil War, the Communist leader Mao Zedong declared a new country, the People's Republic of China (PRC), in Beijing on October 1, 1949. Under Mao the country stayed poor while Taiwan became richer. His attempt at industrialization and collectivization with the Great Leap Forward led to the deaths of many people from famine.", "People's Republic of China\n\nThe People's Republic of China (PRC) () is a one-party state in East Asia governed by the Communist Party of China (CPC). It was founded on 1 October 1949. It currently has more than 1.4 billion people (as of 2017). It covers an area of 9.6 million square kilometers. The capital city is Beijing and Shanghai is the city with the most people living in it. Along with the cities of Tianjin and Chongqing, these four cities are \"municipalities\" directly controlled by the national government. Two other cities are given the status of \"special administrative region\" (SAR). They are Hong Kong, which was once a colony of the United Kingdom and given back to China in 1997 and Macau, which Portugal gave back in 1999. These two cities remain highly autonomous or have much of their own power. Aside from the \"municipalities\" and the \"SARs\", there are 23 provinces and five \"autonomous regions\" or regions with more law-making rights than the provinces and with many people of a minority group population. They are the Xinjiang Uyghur Autonomous Region, the Tibet Autonomous Region or Xizang Autonomous Region, the Guangxi Zhuang Autonomous Region, the Inner Mongolia Autonomous Region or Nei Mongol Autonomous Region and the Ningxia Hui Autonomous Region. In the SARs, the central government is responsible for defense and foreign affairs but not daily operations for 50 years. PRC claims Taiwan as one of its many provinces. However, PRC does not have control of Taiwan. It has an entirely different political system and is officially known as the Republic of China. China has one of the world's oldest civilizations and has the oldest continuous civilization. It has archaeological evidence over 5,000 years old.", "Britain eventually relied on its superior military capabilities to force open the lucrative Chinese market, while imposing an illicit trade in opium on the Chinese people. While China was never actually taken over by Europeans, many European countries, such as Britain and France built spheres of influence in China. Since China had cut itself off from the world over the previous few centuries, by the Qing Dynasty, it had fallen behind other countries in technology, and was helpless to stop this from happening. This had become clear when it lost the Opium Wars to Britain in the 19th century. In 1912, the Qing dynasty was overthrown by the Sun Yat-sen and the Kuomintang, a nationalist party, and the Republic of China established. Over time, Marxist ideas grew popular and the Communist party was formed. The Chinese Civil War later started between the Kuomintang (Nationalists) of the Republic of China (ROC) and the Communists of the People's Republic of China (PRC). The Communists wanted to make China like the Soviet Union, whereas the other side wanted to keep China in its current state at the time. The Communists were led by Mao Zedong, Zhou Enlai, Liu Shaoqi and others. Later Liu lost influence with Mao and his death to this day remains unresolved. The Communists eventually won the war. The Nationalists (led by Chiang Kai-shek) fled to the island of Taiwan and set up their new capital city in Taipei. After the Chinese Civil War, the Communist leader Mao Zedong declared a new country, the People's Republic of China (PRC), in Beijing on October 1, 1949. In 1927, the Chinese Civil War began as the Kuomintang, led by Chiang Kai-shek, and the Communists fought one another.", "People's Republic\n\nPeople's Republic (sometimes called Popular Republic) is a name for a communist, usually Marxist-Leninist country. Currently, the People's Republic of China (PRC) is the only Marxist-Leninist state in the world that uses the title \"People's Republic\". Because of this, \"People's Republic\" is sometimes used to refer to China. The term is also found in the official name of North Korea - Democratic People's Republic of Korea.", "Chinese Civil War\n\nThe Chinese Civil War () was a civil war fought from 1927 to 1949 because of differences in thinking between the Communist Party of China (CPC) and the Kuomintang (KMT), or Chinese Nationalist Party). The war was a fight for legitimacy of the government of China. The war began in April 1927 because of the Northern Expedition (\u570b\u6c11\u9769\u547d\u8ecd\u5317\u4f10) and mostly ended in 1950. Some people say the war has not ended, but no large battles have started since that year. Relations between the Republic of China (ROC) and the People's Republic of China (PRC) are still poor because both claim to be the legitimate sovereign government of all of China. The Chinese Civil War was the third-largest war of all time, after World War 1 and World War 2. It was part of the Interwar period in the aftermath of the Great War from 1918 to 1939 and was also part of the Cold War in the aftermath of World War 2 from 1945 to 1949. The war is usually divided into two parts: 1927-1937 and 1946-1949. It started and stopped several times before the Second Sino-Japanese War and there was less fighting after the Empire of Japan had invaded. The war between the CPC and the KMT started again in 1946 after Japan's defeat in World War II. The CPC took control of most of China, and the KMT had only islands left. About two million Chinese fled to Taiwan in late 1949. In 1950, no large battles were started. The loss of the KMT in Mainland China is said to be for several reasons: No agreement was made between the two governments and so some say that the war has not ended.", "It was often attacked by northern nomadic people such as the Turkic tribes and the Mongols lead by Genghis Khan and Kublai Khan. During the history of ancient China, the northern nomadic people and the Chinese people had been fighting each other and taking turns to rule the land and the people of China. However, when the northern people beat the Chinese people and came to rule the kingdom, they also Incorporated the Chinese way of living and became like the Chinese. Many of the strongest dynasties of China were ruled by the northern people, including the Qin, Tang, Yuan (Mongolian), and Qing (Manchu). Each time, they also brought new elements into the Chinese culture. While China achieved many things in the First millennium and early 2nd millennium, it became an isolationist country in the 15th century C.E. This was because Spain found a lot of silver in the newly explored continents of North and South America. Silver was the main currency (money) in China and Europe at the time, and China did not want to be bought by the foreigners. By the time of the Renaissance, European powers started to take over other countries in Asia. During this time the opium epidemic was growing in China. Foreign traders (primarily British) had been illegally exporting opium mainly from India to China since the 18th century, but that trade grew dramatically from about 1820. The resulting widespread addiction in China was causing serious social and economic disruption there. This led to what is now known as the first opium war. The first Opium War between China and Great Britain lasted from 1839 to 1842. The conflict was the result of years of attempts by the British to exploit China as a market for British goods. Britain eventually relied on its superior military capabilities to force open the lucrative Chinese market, while imposing an illicit trade in opium on the Chinese people.", "Kuomintang\n\nKuomintang (KMT; ; English: Chinese Nationalist Party), also known as Guomindang (GMD), is the main political party in Republic of China (Taiwan). It was ruling in Mainland China until 1949 when Communists captured the mainland and the KMT moved to Taiwan. It was founded by Song Jiaoren and Sun Yat-sen. Chiang Kai-shek later led the party for decades. Chiang Kai shek Chiang Kai-shek was a Chinese nationalist politician and military leader who was President of the Republic of China, born in Xikou on October 31, 1887. His father was a merchant who died when Chiang was eight years old. Chiang became an officer in the army of the Manchu empire, but supported the Chinese Xinhai Revolution of 1911 that converted China into a republic. He led the Republic of China from 1930 to 1949 on mainland China until he was overthrown by Mao Zedong in the Chinese Civil War. He fled to Taiwan where he ruled from 1950 until his death in 1975, although his government was still officially called the Republic of China. Chiang Kai-Shek was born on October 31, 1887, in Zhejiang province, China. He received a military education at the Baoding Military Academy and later studied in Japan at the Tokyo Shinbu Gakko. These formative years laid the groundwork for his future role as a military and political leader. Chiang's exposure to different ideologies and military strategies influenced his approach during pivotal moments in Chinese history. After his father died, Chiang joined the army. At first, he went to Baoding in northern China to study military science. Later, he went to Japan to learn more about the military.", "Political status of Taiwan\n\nThe political status of Taiwan is a difficult situation that many people disagree about. There are two countries in the world that call themselves China. The People's Republic of China (PRC) is the country most people think of when they hear the name China. The Republic of China (ROC) also calls itself China. It is better known in most of the world as Taiwan. Taiwan was a part of China for thousands of years. After the First Sino-Japanese War, Taiwan and Penghu was illegally taken by Japan. After World War II, the Japanese gave up any claim to Taiwan, but did not say who they were giving control to. At the time, the Republic of China governed all of China, and represented China in the United Nations. After losing a civil war in 1949, the ROC government fled to the island of Taiwan, leaving the PRC to control mainland China. The PRC says it owns the island of Taiwan (which is also known as Taiwan province) and the other islands. The ROC says that it was\u2014and is\u2014the rightful government of China, including mainland China, Taiwan, and Mongolia. In 1971, the ROC lost its United Nations seat as China. The seat was given to the PRC instead. This made the PRC the recognized government of China internationally. The major issue is whether Taiwan is a part of the PRC or is (as it claims) an independent country. Today, the ROC (Taiwan) is a fully democratic society, with its own economy, currency, military, and elected officials. The Chinese mainland is ruled by the communist PRC government. Most countries have accepted the PRC as the leaders of China. Several countries, including the United States, have been careful to not say officially which parts of the original China are part of the PRC. 14 countries have official diplomatic relations with Taiwan.", "Flag of the People's Republic of China\n\nThe Flag of China has one big star and four small yellow stars on a red background. The big star stands for the communist government, and the four small stars stand for the workers, peasants, middle-class citizens and soldiers. The red background stands for the blood lost while the history of China was made.", "His attempt at industrialization and collectivization with the Great Leap Forward led to the deaths of many people from famine. The Cultural Revolution caused great social upheaval. After 1976, China underwent market economy reforms under Deng Xiaoping, and experienced rapid economic growth, which made the former progress made by Taiwan became overshadowed. China is now one of the largest economies in the world, relying mainly on exports and manufactering. In recent history, China has had problems with protests, blocking of information on the Internet, and censorship of news. 1989 was notable for the controversial Tiananmen Square protests. Since the 2008 Olympics, China has hosted many major international events, and the 2022 Winter Olympics were held in Beijing, China. China's landscape is vast and diverse. It ranges from the Gobi and Taklamakan Deserts in the north to subtropical forests in the south. The Himalaya, Karakoram, Pamir and Tian Shan mountain ranges separate China from much of South and Central Asia. The Yangtze and Yellow Rivers run from the Tibetan Plateau to the densely populated eastern coast. The Yangtze River is the third-longest river in the world while the Yellow River is the sixth-longest. China's coastline along the Pacific Ocean is 14,500\u00a0kilometers (9,000\u00a0mi) long. It is bounded by the Bohai, Yellow, East China and South China seas. China connects through the Kazakh border to the Eurasian Steppe. The Eurasian Steppe has been an artery of communication between East and West since the Neolithic through the Steppe route. The Steppe Route is the ancestor of the terrestrial Silk Road(s). China's constitution states that The People's Republic of China \"is a socialist state under the people's democratic dictatorship led by the working class and based on the alliance of workers and peasants\"."], "reference_contexts": ["by the working class and based on the alliance of workers and peasants\". It also states the state organs \"apply the principle of democratic centralism.\" The PRC is one of the world's only socialist states openly being communist. With 2.3 million active troops, the People's Liberation Army (PLA) is the largest standing military force in the world. The PLA is commanded by the Central Military Commission (CMC). China has the second-biggest military reserve force, only behind North Korea. The PLA consists of the Ground Force (PLAGF), the Navy (PLAN), the Air Force (PLAAF), and the People's Liberation Army Rocket Force (PLARF). According to the Chinese government, China's military budget for 2017 was US$151,5 billion. China has the world's second-largest military budget. China was once a world leader in science and technology up until the Ming dynasty. There are many Ancient Chinese discoveries and inventions. For example, papermaking, printing, the compass, and gunpowder are known as the Four Great Inventions. They became widespread across East Asia, the Middle East and later to Europe. Chinese mathematicians were the first to use negative numbers. By the 17th century, Europe and the Western world became better than China in science and technology. The national census of 2010 recorded the population of the People's Republic of China to be about 1,370,536,875. About 16.60% of the population were 14 years old or younger, 70.14% were between 15 and 59 years old, and 13.26% were over 60 years old. The population growth rate for 2013 is estimated to be 0.46%. China is the origin of Eastern martial arts, called Kung Fu or its first name Wushu. China is also the home of the well-respected Spa Monastery and Wudang Mountains. Martial art started more for the purpose of survival, defense, and warfare than art. Over time some art forms have branched off, while others have retained their distinct Chinese flavor. China has had renowned artists including Wong Fei Hung (Huang Fei Hung or Hwang Fei Hung) and many others. Art has also co-existed with a variety of paints including the more standard 18 colors. Legendary and controversial moves like Big Mak are also praised and talked about within the culture. China has many traditional festivals, such as Spring Festival, Dragon Boat Festival, Mid-autumn Festival and so on. The most important is Chinese New Year. People in China will have holidays to celebrate these festivals. OK OK (okay) is a word in the English language. It is used to mean that something is good or correct. It is the opposite of the word bad. It can often be used instead of the word Yes. It is not certain where the word \"OK\" originally comes from, but some experts say it came from a funny way of writing \"Ol Korrect\" (All correct). It is also the two-letter abbreviation for the state of Oklahoma in the United States of America. You also find the phrase \"Ola kala\" in Greek, which means \"All Correct\"."], "response": "The People's Liberation Army (PLA) is the largest standing military force in the world, with 2.3 million active troops. It is commanded by the Central Military Commission (CMC) and consists of the Ground Force (PLAGF), the Navy (PLAN), the Air Force (PLAAF), and the People's Liberation Army Rocket Force (PLARF). China has the world's second-largest military budget, which was US$151.5 billion in 2017. The PLA is considered one of the most powerful armies globally, and China is among the world's atomic powers [File: wiki_00.txt, Section: China] [File: wiki_01.txt, Section: People's Republic of China].", "reference": "The People's Liberation Army (PLA) is significant as it is the largest standing military force in the world, with 2.3 million active troops. It is commanded by the Central Military Commission (CMC) and consists of various branches, including the Ground Force (PLAGF), the Navy (PLAN), the Air Force (PLAAF), and the People's Liberation Army Rocket Force (PLARF). Additionally, China has the second-largest military budget globally, which was reported to be US$151.5 billion in 2017. This military structure and budget reflect China's prominent position in global military affairs."}
{"user_input": "How did the architectural contributions of the Ancient Greeks influence the development of Classical Architecture?", "retrieved_contexts": ["Ancient Greece\n\nAncient Greek civilization, also commonly called Ancient Greece, was a large area, mostly along the northeast shore of the Mediterranean Sea, where people spoke the Greek language. The area was much larger than today's country of Greece. The Greek civilization thrived from the archaic period of the 8th to the 6th centuries BC to 146 BC. The period ended with the Roman conquest of Greece at the Battle of Corinth. For most of the time, the Greeks did not have one government or ruler although they had a common language and culture. Greek is an Indo-European language. There were many city-states, each with its own constitution. Athens, Sparta and Corinth were powerful city-states. Some had kings, and others, like Athens, had a form of democracy. As time went on, the most powerful city-states collected others into groups known as \"leagues\". That applied to many of the Greek colonies in Asia Minor, most of which had close ties to one or to another of the three biggest cities. In the middle of the period, Classical Greece flourished during the 5th to 4th centuries BC. Athenian leadership repelled the threat of Persian invasion during the Greco-Persian Wars. The Athenian Golden Age ended with the defeat of Athens at the hands of Sparta in the Peloponnesian War in 345 BC. In the last period, Greece was unified by the conquests of Alexander the Great. The city-states continued under the overall influence of Macedonia during the Hellenistic Period. Greek culture had some influence on the Roman Empire, the main power of the Ancient World. That made classical Greece part of the foundation of Western civilization. Greek was also the language of the Byzantine Empire. The history of Ancient Greece went through several stages: In the 8th century B.C., the Greeks learned how to read and write a second time.", "Architecture\n\nArchitecture is the process of designing structures and buildings. It uses both art and engineering. Examples include houses, churches, hotels, office buildings, roads, tunnels and bridges. Architecture is the profession of an architect. Usually, a person must study at an institution of higher education (university) to become an architect. There were architects long before there was higher education. They learnt by being an apprentice to an established architect. Architecture can do small designs, such as for a garage, or large designs, such as for a whole new town. The capital cities of Bras\u00edlia, and Canberra were designed. Architects often work with structural engineers to make structurally sound buildings. In the past, people built huts and wood houses to protect themselves from the weather. For safety, they were often close together. Great civilizations like the Ancient Egyptians built large temples and structures, like the Great Pyramids of Giza. The Ancient Greeks and Romans made what we now call \"Classical Architecture\". The Romans, working over 2000 years ago, copied the arch from the Etruscans, who copied it from the Mesopotamians. Classical architecture was formal, and it always obeyed laws. It used symmetry, which really means balance, and it used proportion between shapes. The Golden Mean was a rule which said, (to put it simply) if you are making a room, or any other thing, it will work best if you always make the long side 1.6 times as long as the short side. There are many 'laws' in classical architecture, like how high the middle of an arched bridge needs to be (which depends on how wide the bridge needs to be). These laws were learned from thousands of years of experience and they are often used today. However, today more notice is taken of specific facts, such as what wind speeds occur once or twice in a century.", "In the 8th century B.C., the Greeks learned how to read and write a second time. They had lost literacy at the end of the Mycenaean culture, as the Mediterranean world fell into the Dark Ages. The Greek Dark Ages (~1100 BC\u2013750 BC), also called the Bronze Age collapse, is a period in the history of Ancient Greece and Anatolia for which there are no written records and few archaeological remains. The Greeks learned about the alphabet from another ancient people, the Phoenicians. They made some adjustments to it. In particular, the Greeks introduced regular letters for vowels, which were more important in their language. Their alphabet was, in turn, modified by the Etruscans and then the Romans, and much of the world now uses the Roman alphabet. Ancient Greece had one language and culture but was not unified until 337 BC, when Macedonia defeated Athens and Thebes. That marked the end of the Classical period and the start of the Hellenistic period. Even then, the conquered cities were merely joined to Philip II of Macedon's Corinthian League, were not occupied and ruled themselves. Ancient Greece consisted of several hundred more or less independent city states. That was different from other societies, which were either tribal or kingdoms that ruled over relatively large territories. The geography of Greece, which is divided and sub-divided by hills, mountains and rivers, certainly contributed to the nature of ancient Greece. On the one hand, the ancient Greeks had no doubt that they were \"one people\" since they had the same religion, same basic culture, and same language. However, each city-state, or polis, was independent; unification was something rarely discussed by the ancient Greeks.", "However, today more notice is taken of specific facts, such as what wind speeds occur once or twice in a century. Several bridges have blown down because that was not properly taken into consideration. In some parts of the world, like India, the architecture is famous for carving the stone on temples and palaces. Different architectural styles occur in China, Japan, Southeast Asia, Africa, Mexico, and Central and South America. Architects in Western Europe in the Middle Ages made Romanesque architecture, then Gothic architecture. Gothic buildings have tall, pointed windows and arches. Many churches have Gothic architecture. Castles were also built at this time. In Eastern Europe, churches usually had domes. People added their own ideas and decoration to the Classical Architecture of the past. The Renaissance brought a return to classical ideas. In the late 18th century with the Industrial Revolution, people began to invent machines to make things quickly and cheaply. Many factories and mills were built during, or after this revolution. Decades later, in the Victorian era, architects like George Fowler Jones and Decimus Burton still followed the Gothic style to build new churches. Up to this point, buildings were limited in size and style by the strength of the wood and masonry used to construct them. Gothic cathedrals were among the largest buildings because the gothic arch when combined with buttresses allowed stone buildings to be built taller. For example, the cathedral in Ulm, Germany is over 500 feet tall. However, building with stone has its limits, and building too tall could result in collapse. This happened to the Beauvais Cathedral, which was never completed. Towards the end of the 19th Century with a second Industrial Revolution, steel became much cheaper. Architects began to use inventions like metal girders and reinforced concrete to build. An example is the Eiffel Tower in Paris. Buildings can now be built taller than ever before.", "The only playwright from the period whose work has survived is Menander. One of New Comedy's most important contributions was its influence on Roman comedy, an influence that can be seen in the surviving works of Plautus and Terence. The plays originally had a chorus of up to 50 people, who performed the plays in verse accompanied by music, beginning in the morning and lasting until the evening. The performance space was a simple semi-circular space, the \"orchestra\", where the chorus danced and sang. The orchestra was on a flattened terrace at the foot of a hill, the slope of which produced a natural \"theatron\" (watching place). Later, the term \"theatre\" came to be applied to the whole area of theatron, orchestra, and sken\u00e9 (scene). The theatres were made very large. Audiences might have up to fourteen thousand people. Actors' voices needed to be heard throughout the theatre, including the very top row of seats. The Greeks' understanding of acoustics compares well with the current state of the art. In 465 BC, the playwrights began using a backdrop or scenic wall, which hung or stood behind the orchestra, which also served as an area where actors could change their costumes. It was known as the \"sk\u00ean\u00ea\" (scene). In 425 BC a stone scene wall, called a \"paraskenia\", became a common supplement to \"sk\u00ean\u00ea\" in the theatres. The proskenion (\"in front of the scene\") was columned, and was similar to the modern day proscenium. Greek theatres also had entrances for the actors and chorus members called \"parodoi\". They were tall arches that opened onto the orchestra, through which the performers entered.", "Classical mythology\n\nClassical or Greco-Roman mythology usually means the mythology, and the related polytheistic rituals and practices, of Classical Antiquity. Roman religion joined with Greek religion over time. This began in the eighth century BC when Greeks colonized Magna Graecia in southern Italy. The two traditions had joined to the point of being almost the same by the first century BC. See"], "reference_contexts": ["Architecture Architecture is the process of designing structures and buildings. It uses both art and engineering. Examples include houses, churches, hotels, office buildings, roads, tunnels and bridges. Architecture is the profession of an architect. Usually, a person must study at an institution of higher education (university) to become an architect. There were architects long before there was higher education. They learnt by being an apprentice to an established architect. Architecture can do small designs, such as for a garage, or large designs, such as for a whole new town. The capital cities of Bras\u00edlia, and Canberra were designed. Architects often work with structural engineers to make structurally sound buildings. In the past, people built huts and wood houses to protect themselves from the weather. For safety, they were often close together. Great civilizations like the Ancient Egyptians built large temples and structures, like the Great Pyramids of Giza. The Ancient Greeks and Romans made what we now call \"Classical Architecture\". The Romans, working over 2000 years ago, copied the arch from the Etruscans, who copied it from the Mesopotamians. Classical architecture was formal, and it always obeyed laws. It used symmetry, which really means balance, and it used proportion between shapes. The Golden Mean was a rule which said, (to put it simply) if you are making a room, or any other thing, it will work best if you always make the long side 1.6 times as long as the short side. There are many 'laws' in classical architecture, like how high the middle of an arched bridge needs to be (which depends on how wide the bridge needs to be). These laws were learned from thousands of years of experience and they are often used today. However, today more notice is taken of specific facts, such as what wind speeds occur once or twice in a century. Several bridges have blown down because that was not properly taken into consideration. In some parts of the world, like India, the architecture is famous for carving the stone on temples and palaces. Different architectural styles occur in China, Japan, Southeast Asia, Africa, Mexico, and Central and South America. Architects in Western Europe in the Middle Ages made Romanesque architecture, then Gothic architecture. Gothic buildings have tall, pointed windows and arches. Many churches have Gothic architecture. Castles were also built at this time. In Eastern Europe, churches usually had domes. People added their own ideas and decoration to the Classical Architecture of the past. The Renaissance brought a return to classical ideas. In the late 18th century with the Industrial Revolution, people began to invent machines to make things quickly and cheaply. Many factories and mills were built during, or after this revolution. Decades later, in the Victorian era, architects like George Fowler Jones and Decimus Burton still followed the Gothic style to build new churches. Up to this point, buildings were limited in size and style by the strength of the wood and masonry used to construct them. Gothic cathedrals were among the largest buildings because the gothic arch when combined with buttresses allowed stone buildings to be built taller. For example, the cathedral in Ulm, Germany is over 500 feet tall. However, building with stone has its limits, and building too tall could result in collapse. This happened to the Beauvais Cathedral, which was never completed. Towards the end of the 19th Century with a second Industrial Revolution, steel became much cheaper. Architects began to use inventions like metal girders and reinforced concrete to build. An example is the Eiffel Tower in Paris. Buildings can now be built taller than ever before. We call them skyscrapers. This new technology has made us free from traditional limitations, and because of the new possibilities presented by these materials, many traditional methods of construction and ideas about style were reevaluated, replaced, or abandoned. Cheap, strong glass soon brought transparent exterior walls, especially for office buildings. Modernism is the name for the architectural style which developed because of these new building technologies, and its beginnings can been seen as early as 1890. Modernism can also refer to a specific group of architects and buildings from the early to late 20th century, and so may not be the proper term to use for many building built since then, which are sometimes called \"post-modern\". Many of the world's greatest structures were built by modern-day architects such as Frank Lloyd Wright; Sir Hugh Casson; Norman Foster; I. M. Pei; Adrian Smith; Edward Durell Stone; Frank Gehry; Fazlur Khan; Gottfried B\u00f6hm; and Bruce Graham."], "response": "The Ancient Greeks contributed significantly to the development of Classical Architecture, which was characterized by formal structures that obeyed specific laws. Greek architecture emphasized symmetry and proportion, concepts that were integral to Classical Architecture. The Greeks also introduced the use of the Golden Mean, a rule for creating aesthetically pleasing proportions. These principles were later adopted and adapted by the Romans, who further developed Classical Architecture [File: wiki_00.txt, Section: Architecture].", "reference": "The Ancient Greeks, along with the Romans, are credited with creating what we now refer to as 'Classical Architecture.' This architectural style was characterized by its formal nature, adherence to laws of symmetry and proportion, and the application of principles such as the Golden Mean. The Greeks' contributions laid the groundwork for architectural practices that emphasized balance and proportion, which have continued to influence architecture throughout history."}
{"user_input": "What are some key historical and cultural aspects of Finland that a Cultural Heritage Researcher should consider in their studies?", "retrieved_contexts": ["Finland\n\nFinland (Finnish: \"Suomi\") is a country in Northern Europe and is a member state of the European Union. Finland is one of the Nordic countries and is also part of Fennoscandia. Finland is located between the 60th and 70th latitudes North. Its neighbours are Sweden to the west, Norway to the north, Russia to the east and Estonia to the south, beyond the sea called Gulf of Finland. Most of western and southern coast is on the shore of the Baltic Sea. The capital of Finland is Helsinki; the second largest city is Tampere. The official currency of the country is the euro (EUR); before 2002 it was the markka, the Finnish mark (FIM). The president of Finland is Sauli Niinist\u00f6. 5.5 million people live in Finland. Finnish and Swedish both are the official languages of Finland; the most spoken languages is Finnish, mother tongue of about 90% of the population. Swedish is spoken by the Swedish speaking minority of Finland, called the Finnish Swedes, who make up 5% of the total population. Finland became independent of Russia on 6 December 1917. The most important cities and towns in Finland are Helsinki, Espoo, Tampere, Vantaa, Turku, Oulu, Lahti, Kuopio, Jyv\u00e4skyl\u00e4 and Pori. Finland is a highly industrialised First World country. The most important Finnish industrial products are paper, and steel products such as machines and electronics. Nokia (the mobile company) is originally a company of Finland, named after a small town called Nokia. Finland has been top of the list of least corrupt countries on the Corruption Perceptions Index more times than any other country. The people of Finland are called Finns. Most Finns speak Finnish as their mother tongue.", "Scandinavia\n\nScandinavia is a group of countries in northern Europe. Scandinavia has Denmark, Norway, and Sweden. Some people also think Finland is part of Scandinavia and that Iceland and the Faroe Islands should count. Most of the time, \"Scandinavia\" is used to mean places where people speak Scandinavian languages, also called North Germanic languages or Nordic. The Scandinavian languages (Swedish, Norwegian, Danish, Icelandic, and Faroese) are very similar to each other, and many Scandinavians understand parts of the other languages because they are alike. Finnish is not part of the North Germanic language group. What people mean when they say \"Scandinavia\" depends on what they think is important at the time. When people talk about about maps, natural land formations and how the economy works, they may say Finland is part of Scandinavia but Iceland is not. When people talk about history and what languages people speak, they say Iceland is part of Scandinavia but Finland is not. The Scandinavian Peninsula is a large peninsula reaching west from northern Europe over the north side of the Baltic Sea. Norway, Sweden and some of Finland are on this peninsula. However, Denmark is considered part of Scandinavia in the ethnic sense more often than Finland is. This is because Danish is a Scandinavian language but Finnish is not. \"Nordic countries\" include Norway, Sweden, Denmark (including the Faroe Islands), Finland, and Iceland. These five countries use the Nordic Council to work together on political and cultural activities. Denmark, Sweden, and Finland are also members of the European Union, but only Finland is part of the eurozone, meaning that it uses the Euro as its money. The other Nordic countries still use their own money, called \"krone\" or \"krona\" (from the word \"crowns\").", "People first came to Finland 10,000 years ago. That was just after an ice age, after a glacier that covered the ground had receded. Some think the first people in Finland already spoke a language similar to the Finnish language that is spoken today. It is known that an early form of the Finnish language was spoken in Finland in the Iron Age. (The Iron Age in Finland was 2,500\u2013800 years ago). The first residents in Finland hunted animals, as \"hunter-gatherers\". Some people started to farm crops about 5,200 years ago. Farming slowly became more and more popular and became the major way of life until the modern age. The ancient Finns were pagans. The most important god of the Finnish pantheon was Ukko. He was a god of sky and thunder, much like Odin, another Scandinavian god-king. These powers were common among the pagan god kings in pantheons ranging from the Finnish Ukko, to the Scandinavian/Germanic/Saxon Odin, all the way east to Zeus of the Greeks and Jupiter of the Romans. Around a thousand years ago, when most of Europe was adopting Christianity, Finland also began following Christianity. During the Reformation of Christianity in the 16th century, most Finns became Protestants. Some pagan practices still remain amongst the now Christian Finns, such as bear worship. From the Middle Ages Finland was a part of Sweden. Then, in the year 1809, Russia took Finland from Sweden. Finland was a part of Russia, but after a short period of time it became autonomous. The Finns essentially controlled Finland, though the Tsar was in control officially. Finns could create their own laws and had their own currency, (called the \"markka\"), their own stamps and own customs. However, Finland did not have its own army.", "Most Finns speak Finnish as their mother tongue. About six percent of Finns have the Swedish language as their mother tongue. They live mostly in the western part of Finland and on \u00c5land (Finnish Ahvenanmaa) Finns also study mandatory English and Swedish in school. Most Finns work either in services (that is: shops, banks, offices or businesses) or in factories. Finns often like saunas and nature. Many Finnish families have summer cottages, small houses where they go to relax on their summer holidays. The most important festivals that Finnish people celebrate are Midsummer and Christmas. The most popular sports in Finland are ice hockey, skiing, track and field and association football (soccer). Finns have also won events in swimming, motor sports and gymnastics. There is a group of a few thousand S\u00e1mis (also called Lapps) in the most northern part of Finland, called Lapland. Most of the Samis live in Norway and Sweden. Many Sami people farm reindeers. Originally, Samis were hunter-gatherers. In the past the Sami were nomads, but nowadays they live in regular houses. Minority groups in Finland include Swedish\u2013speakers (5.3 per cent), Russian-speakers (1.4 per cent), Estonians (0.9 per cent), Roma (0.2 per cent, and S\u00e1mi (0.1 per cent). There is a also small number of Jews. Very few people in Finland are from other countries. In 2016 about 4% of residents were born in another country. Most of Finland is covered by pine forest. The swan, which was considered holy long ago, is the national bird of Finland. Wood is the most important natural resource of Finland.", "Wood is the most important natural resource of Finland. It is estimated that up to one-third of all wood resources of the European Union are in Finland. The national animal of Finland is the brown bear. The largest animal is the elk, a type of moose, which is a member of the deer family. There are hundreds of rivers and thousands of fresh water lakes. Fishing is a popular sport. It is estimated there are almost 180,000 lakes in Finland. Many islands in the Baltic Sea belong to Finland, too. Thousands of islands are part of the \u00c5land archipelago. Tourists from all over the world come to see the fells and the northern lights in Lapland. The highest mountain of Finland is Halti, which is 1328 meters high. The largest lake is Saimaa, 4,400 square kilometres. The longest river of Finland is Tornionjoki. The largest river (by watershed) is Kemijoki, 552 kilometres long. The weather in Finland varies widely by season. Summer usually lasts from May to early September, and temperatures can reach up to +30\u00a0\u00b0C. Autumns are dark and rainy. Winter snow usually begins to fall in Helsinki in early December (in Lapland it can fall as early as October) and in the winter the temperature can drop to -40\u00a0\u00b0C. Highest temperature recorded in Finland is +37,2\u00a0\u00b0C and lowest temperature is -51,5\u00a0\u00b0C. Winter usually lasts to mid-March, when the snow melts in Helsinki (in Lapland the snow usually doesn't melt until early May), and Spring lasts till late May. Spring can be erratic, and the weather can change from frost to sunshine within a matter of days. The famed Northern Lights are common in Lapland. People first came to Finland 10,000 years ago.", "World Heritage Site\n\nWorld Heritage Sites are places in the world which are very important from a cultural or natural point of view. A part of the United Nations called UNESCO selects these sites. The World Heritage Convention (\"Convention Concerning the Protection of World Cultural and Natural Heritage\") is a United Nations treaty. It governs how World Heritage Sites are selected and protected. Nations that have agreed to the treaty elect 21 countries to the UNESCO World Heritage Committee. That committee sets the list of sites. Each site is a place or a thing (such as a forest, mountain, lake, desert, monument, building, complex, or city). , there were 1007 sites in 161 different countries. These included 779 cultural sites, 197 natural sites, and 31 mixed properties (which are both naturally and culturally important). Italy has 50 World Heritage Sites - more than any other country. Each World Heritage Site is part of the legal territory of the nation where the site is located. UNESCO wants everyone in the world to work to protect each site. Sometimes UNESCO provides funds to help protect a site. Islamic State of Iraq and the Levant have destroyed some sites. The UNESCO selection committee has held a session each year since 1977. The first session was held in Paris, France. At these sessions, the committee choses which applications for World Heritage Site status are added to their list. When something is added to the list, it is said to be \"\"inscribed\"\" on the list. The entry on the list is called an \"Inscription\". Until the end of 2004, there were six criteria for cultural heritage sites and four criteria for natural heritage sites. In 2005, a single set of ten criteria replaced the old cultural and natural heritage criteria.", "Finns were interested in freedom rather than dictatorship. While Germany was losing the war, Finland had already progressed into the Soviet Union in order to regain the areas lost in the previous peace. Finland wanted to end the war with the Soviet Union, which resulted in peace. Once again Finland had to give up the areas they had conquered. This time, the peace with the Soviet Union made Finland and Germany enemies. Finns fought the Germans, and Germans retreated to Norway, burning down all of Lapland behind them. This is called the Lapland War. Finland remained independent. After the war, many factories were built in Finland. Many people moved from farms to cities. At that time, big factories manufactured products like paper and steel. More and more people worked in more advanced jobs, like high technology. Also, many people went to universities to get a good education. Finland was one of the first countries where most people had Internet connections and mobile phones. A well-known company that makes mobile phones, Nokia, is from Finland. Finland joined the European Union in 1995. The Finnish currency was changed to the euro in 2002. Finland joined NATO in 2023, after the Russian invasion of Ukraine. Finland has a mixed economy. Free market controls most of production and sales of goods, but public sector is involved in services. In 2013, taxes were 44% of gross national product. This is 4th largest in Europe, after Denmark, France and Belgium. In 2014 services were 70% of the gross national product. The largest company in 2014 was oil refinery Neste Oil. The second largest was Nokia. Two forest industries Stora Enso and UPM-Kymmene, were numbers three and four. Number five was Kesko which sells everyday goods in K-supermarkets. Elections are organized to select 200 members to the Parliament of Finland."], "reference_contexts": ["Finland Finland (Finnish: \"Suomi\") is a country in Northern Europe and is a member state of the European Union. Finland is one of the Nordic countries and is also part of Fennoscandia. Finland is located between the 60th and 70th latitudes North. Its neighbours are Sweden to the west, Norway to the north, Russia to the east and Estonia to the south, beyond the sea called Gulf of Finland. Most of western and southern coast is on the shore of the Baltic Sea. The capital of Finland is Helsinki; the second largest city is Tampere. The official currency of the country is the euro (EUR); before 2002 it was the markka, the Finnish mark (FIM). The president of Finland is Sauli Niinist\u00f6. 5.5 million people live in Finland. Finnish and Swedish both are the official languages of Finland; the most spoken languages is Finnish, mother tongue of about 90% of the population. Swedish is spoken by the Swedish speaking minority of Finland, called the Finnish Swedes, who make up 5% of the total population. Finland became independent of Russia on 6 December 1917. The most important cities and towns in Finland are Helsinki, Espoo, Tampere, Vantaa, Turku, Oulu, Lahti, Kuopio, Jyv\u00e4skyl\u00e4 and Pori. Finland is a highly industrialised First World country. The most important Finnish industrial products are paper, and steel products such as machines and electronics. Nokia (the mobile company) is originally a company of Finland, named after a small town called Nokia. Finland has been top of the list of least corrupt countries on the Corruption Perceptions Index more times than any other country. The people of Finland are called Finns. Most Finns speak Finnish as their mother tongue. About six percent of Finns have the Swedish language as their mother tongue. They live mostly in the western part of Finland and on \u00c5land (Finnish Ahvenanmaa) Finns also study mandatory English and Swedish in school. Most Finns work either in services (that is: shops, banks, offices or businesses) or in factories. Finns often like saunas and nature. Many Finnish families have summer cottages, small houses where they go to relax on their summer holidays. The most important festivals that Finnish people celebrate are Midsummer and Christmas. The most popular sports in Finland are ice hockey, skiing, track and field and association football (soccer). Finns have also won events in swimming, motor sports and gymnastics. There is a group of a few thousand S\u00e1mis (also called Lapps) in the most northern part of Finland, called Lapland. Most of the Samis live in Norway and Sweden. Many Sami people farm reindeers. Originally, Samis were hunter-gatherers. In the past the Sami were nomads, but nowadays they live in regular houses. Minority groups in Finland include Swedish\u2013speakers (5.3 per cent), Russian-speakers (1.4 per cent), Estonians (0.9 per cent), Roma (0.2 per cent, and S\u00e1mi (0.1 per cent). There is a also small number of Jews. Very few people in Finland are from other countries. In 2016 about 4% of residents were born in another country. Most of Finland is covered by pine forest. The swan, which was considered holy long ago, is the national bird of Finland. Wood is the most important natural resource of Finland. It is estimated that up to one-third of all wood resources of the European Union are in Finland. The national animal of Finland is the brown bear. The largest animal is the elk, a type of moose, which is a member of the deer family. There are hundreds of rivers and thousands of fresh water lakes. Fishing is a popular sport. It is estimated there are almost 180,000 lakes in Finland. Many islands in the Baltic Sea belong to Finland, too. Thousands of islands are part of the \u00c5land archipelago. Tourists from all over the world come to see the fells and the northern lights in Lapland. The highest mountain of Finland is Halti, which is 1328 meters high. The largest lake is Saimaa, 4,400 square kilometres. The longest river of Finland is Tornionjoki. The largest river (by watershed) is Kemijoki, 552 kilometres long. The weather in Finland varies widely by season. Summer usually lasts from May to early September, and temperatures can reach up to +30 \u00b0C. Autumns are dark and rainy. Winter snow usually begins to fall in Helsinki in early December (in Lapland it can fall as early as October) and in the winter the temperature can drop to -40 \u00b0C. Highest temperature recorded in Finland is +37,2 \u00b0C and lowest temperature is -51,5 \u00b0C. Winter usually lasts to mid-March, when the snow melts in Helsinki (in Lapland the snow usually doesn't melt until early May), and Spring lasts till late May. Spring can be erratic, and the weather can change from frost to sunshine within a matter of days. The famed Northern Lights are common in Lapland. People first came to Finland 10,000 years ago. That was just after an ice age, after a glacier that covered the ground had receded. Some think the first people in Finland already spoke a language similar to the Finnish language that is spoken today. It is known that an early form of the Finnish language was spoken in Finland in the Iron Age. (The Iron Age in Finland was 2,500\u2013800 years ago). The first residents in Finland hunted animals, as \"hunter-gatherers\". Some people started to farm crops about 5,200 years ago. Farming slowly became more and more popular and became the major way of life until the modern age. The ancient Finns were pagans. The most important god of the Finnish pantheon was Ukko. He was a god of sky and thunder, much like Odin, another Scandinavian god-king. These powers were common among the pagan god kings in pantheons ranging from the Finnish Ukko, to the Scandinavian/Germanic/Saxon Odin, all the way east to Zeus of the Greeks and Jupiter of the Romans. Around a thousand years ago, when most of Europe was adopting Christianity, Finland also began following Christianity. During the Reformation of Christianity in"], "response": "A Cultural Heritage Researcher studying Finland should consider the following key historical and cultural aspects:\n\n1. **Independence and Political History**: Finland became independent from Russia on December 6, 1917. It has a history of being part of Sweden and later Russia before gaining autonomy and eventually independence [File: wiki_00.txt, Section: Finland].\n\n2. **Language and Ethnic Groups**: Finnish and Swedish are the official languages, with Finnish being the mother tongue of about 90% of the population. There is a Swedish-speaking minority known as the Finnish Swedes [File: wiki_00.txt, Section: Finland].\n\n3. **Religious History**: Finland transitioned from paganism to Christianity around a thousand years ago. During the Reformation in the 16th century, most Finns became Protestants, although some pagan practices, like bear worship, persisted [File: wiki_00.txt, Section: Finland].\n\n4. **Cultural Practices**: Saunas and nature are significant aspects of Finnish culture. Many families own summer cottages for relaxation. Important festivals include Midsummer and Christmas [File: wiki_00.txt, Section: Finland].\n\n5. **S\u00e1mi People**: The S\u00e1mi, an indigenous group, reside in the northern part of Finland, known as Lapland. They have a unique culture and history, traditionally being hunter-gatherers and now often involved in reindeer farming [File: wiki_00.txt, Section: Finland].\n\n6. **Industrial and Economic Development**: Post-war industrialization led to urbanization and the growth of industries like paper and steel. Finland is known for technological advancements, with companies like Nokia originating there [File: wiki_00.txt, Section: Finland].\n\nThese aspects provide a foundation for understanding Finland's rich cultural heritage and historical development.", "reference": "A Cultural Heritage Researcher should consider several key historical and cultural aspects of Finland, including its geographical location in Northern Europe, bordered by Sweden, Norway, Russia, and Estonia. The country became independent from Russia on December 6, 1917, and has a population of approximately 5.5 million people, with Finnish and Swedish as the official languages. The Finnish people, known as Finns, predominantly speak Finnish, with a small percentage speaking Swedish. Finland is known for its rich natural resources, including vast pine forests and numerous lakes, with an estimated 180,000 lakes in the country. The cultural practices of the Finns, such as their love for saunas, nature, and summer cottages, as well as their important festivals like Midsummer and Christmas, are also significant. Additionally, the historical presence of the S\u00e1mi people in Lapland, their traditional practices, and the transition from paganism to Christianity around a thousand years ago are crucial elements in understanding Finland's cultural narrative."}
{"user_input": "What role did Russia play in Finland's history during the 19th century?", "retrieved_contexts": ["However, Finland did not have its own army. During the 1905 Russian Revolution, in the Grand Duchy of Finland: the Social Democrats organised the general strike of 1905 (). The Red Guards were formed. On , Russian artillerymen and military engineers rose to rebellion in the fortress of Sveaborg (later called Suomenlinna), Helsinki. The Finnish Red Guards supported the Sveaborg Rebellion with a general strike, but the mutiny was quelled by loyal troops and ships of the Baltic Fleet within 60 hours. On 6 December 1917, Finland became independent, which meant that it no longer was a part of Russia. There was a communist revolution in Russia and after 1922 Russia was a part of the Soviet Union. There were communists in Finland too, who tried to create a revolution in Finland This attempt at revolution caused the Finnish civil war. The communists lost the civil war, and Finland did not change its old capitalist system Stalin, who was the leader of the Soviet Union, did not like having a capitalist country as its neighbour. Stalin wanted Finland to become a communist state and be a part of the Soviet Union. The leaders of Finland refused: they wanted to stay independent. The Soviet Union sent many troops across the eastern border of Finland to try to make Finland join them, which resulted in the Winter War. The Soviet Union eventually won, and took most of Karelia and other parts of Finland. Adolf Hitler was the dictator of Germany, and he wanted to invade the Soviet Union. Finland wanted to retrieve the areas that it had lost, so they joined the German invasion, which started with Operation Barbarossa in 1941. The Finnish part of the Second World War is called the Continuation War in Finland. However, Finland was not a fascist or an antisemitic country. Finns were interested in freedom rather than dictatorship.", "People first came to Finland 10,000 years ago. That was just after an ice age, after a glacier that covered the ground had receded. Some think the first people in Finland already spoke a language similar to the Finnish language that is spoken today. It is known that an early form of the Finnish language was spoken in Finland in the Iron Age. (The Iron Age in Finland was 2,500\u2013800 years ago). The first residents in Finland hunted animals, as \"hunter-gatherers\". Some people started to farm crops about 5,200 years ago. Farming slowly became more and more popular and became the major way of life until the modern age. The ancient Finns were pagans. The most important god of the Finnish pantheon was Ukko. He was a god of sky and thunder, much like Odin, another Scandinavian god-king. These powers were common among the pagan god kings in pantheons ranging from the Finnish Ukko, to the Scandinavian/Germanic/Saxon Odin, all the way east to Zeus of the Greeks and Jupiter of the Romans. Around a thousand years ago, when most of Europe was adopting Christianity, Finland also began following Christianity. During the Reformation of Christianity in the 16th century, most Finns became Protestants. Some pagan practices still remain amongst the now Christian Finns, such as bear worship. From the Middle Ages Finland was a part of Sweden. Then, in the year 1809, Russia took Finland from Sweden. Finland was a part of Russia, but after a short period of time it became autonomous. The Finns essentially controlled Finland, though the Tsar was in control officially. Finns could create their own laws and had their own currency, (called the \"markka\"), their own stamps and own customs. However, Finland did not have its own army.", "Finns were interested in freedom rather than dictatorship. While Germany was losing the war, Finland had already progressed into the Soviet Union in order to regain the areas lost in the previous peace. Finland wanted to end the war with the Soviet Union, which resulted in peace. Once again Finland had to give up the areas they had conquered. This time, the peace with the Soviet Union made Finland and Germany enemies. Finns fought the Germans, and Germans retreated to Norway, burning down all of Lapland behind them. This is called the Lapland War. Finland remained independent. After the war, many factories were built in Finland. Many people moved from farms to cities. At that time, big factories manufactured products like paper and steel. More and more people worked in more advanced jobs, like high technology. Also, many people went to universities to get a good education. Finland was one of the first countries where most people had Internet connections and mobile phones. A well-known company that makes mobile phones, Nokia, is from Finland. Finland joined the European Union in 1995. The Finnish currency was changed to the euro in 2002. Finland joined NATO in 2023, after the Russian invasion of Ukraine. Finland has a mixed economy. Free market controls most of production and sales of goods, but public sector is involved in services. In 2013, taxes were 44% of gross national product. This is 4th largest in Europe, after Denmark, France and Belgium. In 2014 services were 70% of the gross national product. The largest company in 2014 was oil refinery Neste Oil. The second largest was Nokia. Two forest industries Stora Enso and UPM-Kymmene, were numbers three and four. Number five was Kesko which sells everyday goods in K-supermarkets. Elections are organized to select 200 members to the Parliament of Finland.", "Finland\n\nFinland (Finnish: \"Suomi\") is a country in Northern Europe and is a member state of the European Union. Finland is one of the Nordic countries and is also part of Fennoscandia. Finland is located between the 60th and 70th latitudes North. Its neighbours are Sweden to the west, Norway to the north, Russia to the east and Estonia to the south, beyond the sea called Gulf of Finland. Most of western and southern coast is on the shore of the Baltic Sea. The capital of Finland is Helsinki; the second largest city is Tampere. The official currency of the country is the euro (EUR); before 2002 it was the markka, the Finnish mark (FIM). The president of Finland is Sauli Niinist\u00f6. 5.5 million people live in Finland. Finnish and Swedish both are the official languages of Finland; the most spoken languages is Finnish, mother tongue of about 90% of the population. Swedish is spoken by the Swedish speaking minority of Finland, called the Finnish Swedes, who make up 5% of the total population. Finland became independent of Russia on 6 December 1917. The most important cities and towns in Finland are Helsinki, Espoo, Tampere, Vantaa, Turku, Oulu, Lahti, Kuopio, Jyv\u00e4skyl\u00e4 and Pori. Finland is a highly industrialised First World country. The most important Finnish industrial products are paper, and steel products such as machines and electronics. Nokia (the mobile company) is originally a company of Finland, named after a small town called Nokia. Finland has been top of the list of least corrupt countries on the Corruption Perceptions Index more times than any other country. The people of Finland are called Finns. Most Finns speak Finnish as their mother tongue.", "This resulted in wars with its neighboring counties. In 1894-1895, Japan and China had a war. Another war took place with Russia in 1904-1905. Japan became a world power after these wars. Russian influence continued to grow inside China. By the beginning of the 20th century, Russian influence was increasing in China. Japan and the United Kingdom used to get economic and other benefits from their relationship with China. Japan and the United Kingdom did not like Russia\u2019s growing influence in China. Japan and the United Kingdom formed a military alliance, called the Anglo-Japanese Alliance, on January 30th 1902. Russia was not happy at this type of agreement between Japan and the United Kingdom. Russia tried to form a similar military alliance with Germany and France. On March 6th 1902, Russia formed a military alliance with France but not Germany. The Russo-Japanese War began between Japan and Russia. Japan won the Russo-Japanese War. The United States mediated the peace negotiations between Japan and Russia. Japan got a number of concessions. In 1910, Japan invaded and annexed Korea. Chinese bandits called Honghuzi fought against Japan or Russia in the Russo-Japanese war. In 1914, the First World War broke out. Japan also entered the war. It attacked several places (of East Asia), which were colonies of Germany. After the war ended in 1919, Japan developed very fast. It became one of the major powers of Asia. Japanese in Canada were interned as potential fifth columnists. Japanese in Australia were also interned as potential fifth columnists. Latin American countries like Peru also expelled their Japanese residents to the US to be interned during the war. Mexico also interned Japanese. A huge proportion of Japanese Brazilians were pro Axis and some engaged in terrorist activities to sabotage Allied war efforts."], "reference_contexts": ["the 16th century, most Finns became Protestants. Some pagan practices still remain amongst the now Christian Finns, such as bear worship. From the Middle Ages Finland was a part of Sweden. Then, in the year 1809, Russia took Finland from Sweden. Finland was a part of Russia, but after a short period of time it became autonomous. The Finns essentially controlled Finland, though the Tsar was in control officially. Finns could create their own laws and had their own currency, (called the \"markka\"), their own stamps and own customs. However, Finland did not have its own army. During the 1905 Russian Revolution, in the Grand Duchy of Finland: the Social Democrats organised the general strike of 1905 (). The Red Guards were formed. On , Russian artillerymen and military engineers rose to rebellion in the fortress of Sveaborg (later called Suomenlinna), Helsinki. The Finnish Red Guards supported the Sveaborg Rebellion with a general strike, but the mutiny was quelled by loyal troops and ships of the Baltic Fleet within 60 hours. On 6 December 1917, Finland became independent, which meant that it no longer was a part of Russia. There was a communist revolution in Russia and after 1922 Russia was a part of the Soviet Union. There were communists in Finland too, who tried to create a revolution in Finland This attempt at revolution caused the Finnish civil war. The communists lost the civil war, and Finland did not change its old capitalist system Stalin, who was the leader of the Soviet Union, did not like having a capitalist country as its neighbour. Stalin wanted Finland to become a communist state and be a part of the Soviet Union. The leaders of Finland refused: they wanted to stay independent. The Soviet Union sent many troops across the eastern border of Finland to try to make Finland join them, which resulted in the Winter War. The Soviet Union eventually won, and took most of Karelia and other parts of Finland. Adolf Hitler was the dictator of Germany, and he wanted to invade the Soviet Union. Finland wanted to retrieve the areas that it had lost, so they joined the German invasion, which started with Operation Barbarossa in 1941. The Finnish part of the Second World War is called the Continuation War in Finland. However, Finland was not a fascist or an antisemitic country. Finns were interested in freedom rather than dictatorship. While Germany was losing the war, Finland had already progressed into the Soviet Union in order to regain the areas lost in the previous peace. Finland wanted to end the war with the Soviet Union, which resulted in peace. Once again Finland had to give up the areas they had conquered. This time, the peace with the Soviet Union made Finland and Germany enemies. Finns fought the Germans, and Germans retreated to Norway, burning down all of Lapland behind them. This is called the Lapland War. Finland remained independent. After the war, many factories were built in Finland. Many people moved from farms to cities. At that time, big factories manufactured products like paper and steel. More and more people worked in more advanced jobs, like high technology. Also, many people went to universities to get a good education. Finland was one of the first countries where most people had Internet connections and mobile phones. A well-known company that makes mobile phones, Nokia, is from Finland. Finland joined the European Union in 1995. The Finnish currency was changed to the euro in 2002. Finland joined NATO in 2023, after the Russian invasion of Ukraine. Finland has a mixed economy. Free market controls most of production and sales of goods, but public sector is involved in services. In 2013, taxes were 44% of gross national product. This is 4th largest in Europe, after Denmark, France and Belgium. In 2014 services were 70% of the gross national product. The largest company in 2014 was oil refinery Neste Oil. The second largest was Nokia. Two forest industries Stora Enso and UPM-Kymmene, were numbers three and four. Number five was Kesko which sells everyday goods in K-supermarkets. Elections are organized to select 200 members to the Parliament of Finland. Also selected are the president of Finland, members of town and city councils and Finnish members to the European Parliament. The elections are secret and direct. People vote directly for the person they want to be elected. In presidential elections votes are only cast for a person, not for a political party. All the other elections are proportional. The system is a combination of voting for individuals and parties. The right to vote is universal and equal. In general elections everybody has one vote. If If is a word to describe a statement where one thing depends on something else. For example: If \u2014 is a poem written by Rudyard Kipling. It appeared in the \"Brother Square Toes\" chapter of Kipling's book \"Rewards and Fairies\". In a 1995 BBC opinion poll, it was voted Britain's favourite poem. It is arguably Kipling's most famous poem."], "response": "During the 19th century, Finland was taken from Sweden by Russia in 1809. Finland became a part of Russia but was granted autonomy. The Finns essentially controlled Finland, creating their own laws, currency (the \"markka\"), stamps, and customs, although the Tsar of Russia was officially in control. However, Finland did not have its own army during this period [File: wiki_00.txt, Section: Finland].", "reference": "In the year 1809, Russia took Finland from Sweden. Finland was a part of Russia, but after a short period of time, it became autonomous. The Finns essentially controlled Finland, though the Tsar was in control officially. Finns could create their own laws and had their own currency, called the 'markka', their own stamps, and own customs."}
{"user_input": "What is the significance of the month April in relation to the Julian calendar and what are some of its characteristics?", "retrieved_contexts": ["April\n\nApril (Apr.) is the fourth month of the year in the Julian and Gregorian calendars, and comes between March and May. It is one of four months to have 30 days. April always begins on the same day of the week as July, and additionally, January in leap years. April always ends on the same day of the week as December. April comes between March and May, making it the fourth month of the year. It also comes first in the year out of the four months that have 30 days, as June, September and November are later in the year. April begins on the same day of the week as July every year and on the same day of the week as January in leap years. April ends on the same day of the week as December every year, as each other's last days are exactly 35 weeks (245 days) apart. In common years, April starts on the same day of the week as October of the previous year, and in leap years, May of the previous year. In common years, April finishes on the same day of the week as July of the previous year, and in leap years, February and October of the previous year. In common years immediately after other common years, April starts on the same day of the week as January of the previous year, and in leap years and years immediately after that, April finishes on the same day of the week as January of the previous year. In years immediately before common years, April starts on the same day of the week as September and December of the following year, and in years immediately before leap years, June of the following year. In years immediately before common years, April finishes on the same day of the week as September of the following year, and in years immediately before leap years, March and June of the following year.", "In years immediately before common years, April finishes on the same day of the week as September of the following year, and in years immediately before leap years, March and June of the following year. April is a spring month in the Northern Hemisphere and an autumn/fall month in the Southern Hemisphere. In each hemisphere, it is the seasonal equivalent of October in the other. It is unclear as to where April got its name. A common theory is that it comes from the Latin word \"aperire\", meaning \"to open\", referring to flowers opening in spring. Another theory is that the name could come from Aphrodite, the Greek goddess of love. It was originally the second month in the old Roman Calendar, before the start of the new year was put to January 1. Quite a few festivals are held in this month. In many Southeast Asian cultures, new year is celebrated in this month (including Songkran). In Western Christianity, Easter can be celebrated on a Sunday between March 22 and April 25. In Orthodox Christianity, it can fall between April 4 and May 8. At the end of the month, Central and Northern European cultures celebrate Walpurgis Night on April 30, marking the transition from winter into summer. Poets use \"April\" to mean the end of winter. For example: \"April showers bring May flowers.\"", "January\n\nJanuary (Jan.) is the first month of the year in the Julian and Gregorian calendars, coming between December (of the previous year) and February (of the current year). It has 31 days. January begins on the same day of the week as October in common years, and April and July in leap years. January ends on the same day of the week as February and October in common years, and July in leap years. January is named for Janus, the Roman god of doors and gates. January and February were put on the calendar after all the other months. This is because in the original Roman calendar, winter did not have months. Although March was originally the first month, January became the new first month because that was when people chose the new consuls (Roman leaders). The month has 31 days. January is a winter month in the Northern Hemisphere and a summer month in the Southern Hemisphere. In each hemisphere, it is the seasonal equivalent of July in the other. Perihelion, the point in its orbit where the Earth is closest to the Sun, also occurs in this month, between January 2 and January 5. January is the only month of the year that always has a \"twin\" - a month that both begins and ends on the same day of the week as it does. In a common year, this is October, and in a leap year, July. January begins on the same day of the week as October in common years and on the same day of the week as April and July in leap years. January ends on the same day of the week as February and October in common years and on the same day of the week as July in leap years.", "May\n\nMay is the fifth month of the year in the Julian and Gregorian calendars, coming between April and June. It has 31 days. The month of May might have been named for the Roman goddess Maia, or more likely the Roman goddess of fertility Bona Dea, whose festival was held in May. May never begins or ends on the same day of the week as any other month. May's flower is the Lily of the Valley. Its birthstone is the emerald. The meaning of the emerald is success in love. May comes between April and June and is the fifth month of the year in the Gregorian calendar. It is one of the seven months to have 31 days. In the older Roman calendar, May was the third month of the year. It is a spring month in the Northern Hemisphere and an autumn month in the Southern Hemisphere. In each hemisphere, it is the seasonal equivalent of November in the other. May is likely to have been named after the Roman goddess Maia, though there is a theory that May might have its name from the Latin \"Maiores\", meaning \"Seniors\". The same theory suggests that June would then be named from \"Iuniores\", meaning \"Juniors\". No other month of any year either begins or ends on the same day of the week as May; this month is the only one that has both of these properties. In common years, May starts on the same day of the week as August of the previous year, and in leap years, March and November of the previous year. In common years, May finishes on the same day of the week as August and November of the previous year, and in leap years, March and June of the previous year. In leap years and years immediately after that, May starts on the same day of the week as February of the previous year.", "June\n\nJune (Jun.) is the sixth month of the year in the Julian and Gregorian calendars, coming between May and July. It has 30 days. June is named for the Roman goddess Juno, the wife of Jupiter. June never begins on the same day of the week as any other month, but always ends on the same day of the week as March. June comes between May and July and is the sixth month of the year in the Gregorian calendar. It is one of four months to have 30 days. No other month of any year begins on the same day of the week as June; this month and May are the only two months with this property. June ends on the same day of the week as March every year, as each other's last days are 13 weeks (91 days) apart.In common years, June starts on the same day of the week as September and December of the previous year, and in leap years, April and July of the previous year. In common years, June finishes on the same day of the week as September of the previous year, and in leap years, April and December of the previous year. Every year, June starts on the same day of the week as February of the following year, as each other's first days are exactly 35 weeks (245 days) apart. In years immediately before common years, June starts on the same day of the week as March and November of the following year, and in years immediately before leap years, August of the following year. In years immediately before common years, June finishes on the same day of the week as August and November of the following year, and in years immediately before leap years, May of the following year."], "reference_contexts": ["April April (Apr.) is the fourth month of the year in the Julian and Gregorian calendars, and comes between March and May. It is one of four months to have 30 days. April always begins on the same day of the week as July, and additionally, January in leap years. April always ends on the same day of the week as December. April comes between March and May, making it the fourth month of the year. It also comes first in the year out of the four months that have 30 days, as June, September and November are later in the year. April begins on the same day of the week as July every year and on the same day of the week as January in leap years. April ends on the same day of the week as December every year, as each other's last days are exactly 35 weeks (245 days) apart. In common years, April starts on the same day of the week as October of the previous year, and in leap years, May of the previous year. In common years, April finishes on the same day of the week as July of the previous year, and in leap years, February and October of the previous year. In common years immediately after other common years, April starts on the same day of the week as January of the previous year, and in leap years and years immediately after that, April finishes on the same day of the week as January of the previous year. In years immediately before common years, April starts on the same day of the week as September and December of the following year, and in years immediately before leap years, June of the following year. In years immediately before common years, April finishes on the same day of the week as September of the following year, and in years immediately before leap years, March and June of the following year. April is a spring month in the Northern Hemisphere and an autumn/fall month in the Southern Hemisphere. In each hemisphere, it is the seasonal equivalent of October in the other. It is unclear as to where April got its name. A common theory is that it comes from the Latin word \"aperire\", meaning \"to open\", referring to flowers opening in spring. Another theory is that the name could come from Aphrodite, the Greek goddess of love. It was originally the second month in the old Roman Calendar, before the start of the new year was put to January 1. Quite a few festivals are held in this month. In many Southeast Asian cultures, new year is celebrated in this month (including Songkran). In Western Christianity, Easter can be celebrated on a Sunday between March 22 and April 25. In Orthodox Christianity, it can fall between April 4 and May 8. At the end of the month, Central and Northern European cultures celebrate Walpurgis Night on April 30, marking the transition from winter into summer. Poets use \"April\" to mean the end of winter. For example: \"April showers bring May flowers.\""], "response": "April is the fourth month of the year in the Julian and Gregorian calendars. It is one of four months to have 30 days. April begins on the same day of the week as July every year and on the same day of the week as January in leap years. It ends on the same day of the week as December every year. April is a spring month in the Northern Hemisphere and an autumn month in the Southern Hemisphere, being the seasonal equivalent of October in the other hemisphere. The name April might come from the Latin word \"aperire,\" meaning \"to open,\" possibly referring to the opening of flowers in spring. It was originally the second month in the old Roman Calendar before the new year was moved to January 1 [File: wiki_00.txt, Section: April].", "reference": "April is the fourth month of the year in the Julian calendar, coming between March and May. It has 30 days and always begins on the same day of the week as July and January in leap years. April ends on the same day of the week as December. It is a spring month in the Northern Hemisphere and an autumn month in the Southern Hemisphere. The name April may come from the Latin word \"aperire\", meaning \"to open\", or from Aphrodite, the Greek goddess of love. Various festivals are celebrated in April, including the new year in many Southeast Asian cultures and Easter in Western Christianity."}
{"user_input": "What is the significance of death in humans according to the context?", "retrieved_contexts": ["Death\n\nDeath is the end of a life in an organism. All biological and living activity of the living thing stops, including the mind and the senses. The usual signal for death in humans and many other animals is that the heart stops beating and cannot be restarted. This can be caused by many things. All living things have a limited lifespan, and all living things eventually die. Living things that have died are normally described as being dead. Death of humans is often investigated for the cause, in case of crime (such as murder), accident or disease that may continue to kill other humans. About 150,000 people die every day around the world. About two thirds of these people die because of age. In addition to the physical body, some believe humans also have a soul and believe that the soul can continue without a body (afterlife), move into another body (reincarnation), or cease to exist (annihilationism). Religions have different beliefs about this issue. Many cultures have their own customs and rituals to respect the dead. When people talk about things or events that lead to the death of a plant or animal, those things or events are usually described as being deadly, or fatal. In the case of diseases, they are described as \"terminal\". Humans are no different from any other lifeform. Our bodies have an ability for self-repair, but that ability is limited. Finding the cause of death is a medical speciality called pathology. In medicine, death is when the heart stops beating for more than several minutes. There are special times in which people recover even though the heart has stopped for 30 minutes, such as near-drowning in very cold water. If machines are used to help the heart and lungs work, then the moment of death is more difficult to know. Death is commonly a sad or unpleasant thing to people.", "Death is commonly a sad or unpleasant thing to people. It can make people think about their own death. People might miss or be sad for the person who has died. They might also be sad for the family and friends of the person who has died. In any society, human death is surrounded by ritual - a wake or funeral is normal. In some places it was common to eat the dead in a form of ritual cannibalism. But this is no longer common, in part because disease like kuru can be passed this way. Human dead bodies are taboo in most societies and must be handled in special ways - for a combination of religious and hygiene reasons. A human dead body must always be reported in law, to be sure it is disposed of properly. In 2021 the leading cause of death in the United States was heart disease followed by cancer and then COVID-19. Finding the cause of any human death and stopping a similar death from happening to someone else are the main reasons people look into \"human morbidity\" or let dead bodies be cut open and looked at in an autopsy. Some religions do not allow autopsies, because they feel the body is holy. Autopsies are usually required by the state if someone dies and people do not know why. The autopsy helps find out if someone killed the person on purpose, tried to hurt them, or if they died from a sickness. To prepare for their own death, humans can write a last will and testament to be clear about who gets their property and possessions. A person will sometimes also volunteer to be an organ donor. This might mean giving the whole body to medical research. It can also save the lives of others by making organ transplants possible.", "It can also save the lives of others by making organ transplants possible. For a long time, many people have been afraid of death and a lot of people have wondered about what may happen to people after they die. This is one of the largest questions of philosophy and religion. Many people believe there is some form of afterlife. Ancient rulers sometimes did insist not only that their own bodies, and much property, but even their servants and relatives be destroyed at their funeral. Christianity has a special focus on death because of the state killing of Jesus Christ by the Romans. In Islam this is thought to demonstrate the injustice of human systems of dealing out death, and the ability of the best people to overcome it and even forgive it. In Christianity itself it is thought to prove that Jesus himself was really God and so could lose his body and still have the power of resurrection. In Buddhism reincarnation is believed to occur. Reincarnation is an idea taken from Hinduism. Confucianism advises respect for parents and forms of ancestor worship to respect both dead and living ancestors. Every ethical tradition including the medical view of the body has some ritual surrounding death. Often these excuse behaviours that might be hated if they did not have the ritual. For instance, one may say that organ transplant is like cannibalism. Very much of what happens at a human death is ritual. People who wish theirs to be dealt with a certain way, and who wish a particular treatment like cremation of their body, should decide in advance and set up the necessary payments and agreements. This makes it much easier for their family after they die, since there is no longer the ability to clearly communicate the wish. For the same reason, saying goodbye is important. Most of the stress of death seems to come for loved ones who \"did not have a chance to say goodbye\".", "Killing\n\nKilling a living thing is when someone or something ends that life and makes the living thing die. It means causing a death. When a human being kills another human being, it is called murder or homicide, such as manslaughter. Pesticides and herbicides are poisons for killing bad wild small animals or plants, respectively. When a soldier kills another in war, it is called \"combat\". When the state kills a convict sentenced to capital punishment, it is called execution. When someone kills a powerful person it is called assassination. When a person who wants to die kills themself it is suicide, or euthanasia if killed by another. When people kill other people to eat them, it is called cannibalism.", "Funeral\n\nA funeral is a ceremony that is held because someone has died. A funeral is a gathering of friends and family of the dead person. They will mourn the dead person, meaning that they will feel and show sadness that the person has died, and also say thanks for the life the person had. A funeral is usually held with the dead body present but hidden in a coffin, but there are also open casket funerals. During the funeral, or soon after it, the dead body will be buried, cremated (burned) or made to disappear in some other way. A memorial service or celebration of life is a funeral in which the dead body is not present. Funerals are held in all human cultures. Religion is an important part of funeral customs in most countries. At many funerals, they say a prayer for the dead so that his or her soul may rest in peace and have a good time in the afterlife. There are other reasons why funerals are held. Many of them are to do with helping the dead person's friends and family (the mourners): Modern funerals have greatly changed over time. Present day funeral or memorial services may often be more like a thanksgiving for the life of the dead person, rather than just thinking about the sadness of death. A funeral ceremony can be held at a church, a temple, a public building for holding funerals or in many other places. In North America, it is common for there to be a \"visitation\" (also called a \"viewing\" or a \"wake\") a few days before the funeral. This is where people are invited to see the dead body. In Madagascar, people have a ritual called famadihana or \u201cthe turning of the bones\u201d in English. Once every five or seven years, family members exhume the remains of their ancestors.", "Rigor mortis\n\nRigor mortis, also called postmortem rigidity, happens after a person or animal dies. It's a sign that the body is no longer alive. During rigor mortis, the body becomes stiff and hard to move. This happens because some chemicals in the muscles change after death, especially calcium. In humans, rigor mortis can start as soon as four hours after death. But it doesn't last forever. After a few hours, the stiffness starts to go away. Usually, rigor mortis lasts no more than eight hour when the body is at room temperature. Some people think rigor mortis is permanent, but it's not true. The stiffness gradually goes away as time goes on after death. When a living organism dies, it stops using oxygen to produce energy. This leads to a decrease in a molecule called adenosine triphosphate (ATP), which helps muscles relax. Without oxygen, the body tries to make ATP using a different method called anaerobic glycolysis. But when the body runs out of a substance called glycogen, ATP levels drop, and the muscles become stiff in a condition called rigor mortis. During rigor mortis, the muscles can't relax because certain structures in the muscles can't separate. After death, calcium enters the fluid inside cells, called cytosol. This happens because certain parts of the cells break down. Calcium causes the formation of structures called actin-myosin cross-bridges, which are important for muscle movement. In rigor mortis, the myosin heads in the muscles keep binding to actin proteins using a molecule called adenosine diphosphate (ADP). The muscles can't relax until enzymes break down this binding.", "Freud believed that humans were driven by two conflicting central desires: the life drive which is called \"Eros\" (survival, propagation, hunger, thirst, and sex) and the death drive (Thanatos). Freud recognized the death drive only in his later years and developed his theory of it in \"Beyond the Pleasure Principle\". Freud acknowledged the tendency for the unconscious to repeat unpleasurable experiences in order to desensitize, or deaden, the body. This compulsion to repeat unpleasurable experiences explains why traumatic nightmares occur in dreams, as nightmares seem to contradict Freud's earlier conception of dreams purely as a site of pleasure, fantasy, and desire. On the one hand, the life drives promote survival by avoiding extreme unpleasure and any threat to life. On the other hand, the death drive functions simultaneously toward extreme pleasure, which leads to death. Freud addressed the conceptual dualities of pleasure and unpleasure, as well as sex/life and death, in his discussions on masochism and sadomasochism. The tension between life drive and death drive represented a revolution in his manner of thinking. There are four main charges against the orthodox view of Freud. They are: Anthony Clare, psychiatrist and broadcaster, described Freud as a \"ruthless and devious charlatan\", and that \"many of the foundations stones of psychoanalysis are phoney\".", "Miscarriage\n\nA miscarriage is the natural death of an embryo or fetus in the womb, before it is old enough to live on its own, outside the mother. The medical words for a miscarriage are spontaneous abortion. (\"Spontaneous\" means something that a person did not expect to happen. An \"abortion\" is when a pregnancy ends early, before birth.) Among women who know they are pregnant, about 15-20% have miscarriages. (This means that up to 1 in every 5 women who know they are pregnant miscarries.) It is the most common complication (serious problem) that happens in early pregnancy in humans. In the United States, if a fetus dies after it is 20 weeks old, its death is no longer called a miscarriage. Its death is called a \"stillbirth\", a \"fetal demise\", or a \"fetal death\". (\"Demise\" means \"death.\") Different countries have different ways of defining the difference between a miscarriage and a fetal death. For example: Nobody knows all of the reasons why a woman may miscarry. However, some common causes include: The most common causes of miscarriage change depending on what trimester the mother is in. (Each trimester lasts about three months.) Most miscarriages happen during the first trimester. Some studies say that two-thirds (two out of three) to three-quarters (three out of four) of all miscarriages happen during this trimester. About 30% to 40% (3 to 4 in every 10) of all fertilized eggs miscarry, often before a woman knows she is pregnant. In more than half of embryos miscarried in the first 13 weeks of pregnancy, the embryo has chromosomes that are not normal.", "Immortality\n\nImmortality or eternal life is the idea of something which is alive that will stay alive forever. The opposite of immortality is mortality, which means a living thing can die. Right now, only a small number of living things are known to be immortal. These are mainly simple, lower forms of life like bacteria. Stories about immortal people or animals are popular in fiction and mythology, but not yet possible due to the decline of health as the years pass. Many religions say people have an immortal soul with an afterlife. This is not the same as the idea of a physical body that doesn't age. Religious ideas of immortality are of two kinds. One idea is that the soul can exist apart from the dead physical body. Some religions teach that the soul cannot die but will live forever in an \"afterlife\". Usually, this afterlife includes punishment or reward for the good or evil that the person did. Hinduism and Buddhism teach that the soul will go into a new body as a baby. This is called re-incarnation. Religions such as Christianity, Islam and Judaism believe that the body of dead persons will be made to live again for a final judgement. This is called resurrection of the body. Some who believe in this think that the soul is asleep while waiting for the resurrection, while others believe it exists in a conscious condition in a heaven or hell. Jesus told a story of two men. A rich man went to hell when he died, and the poor man went to heaven. The rich man wanted to return to earth to warn his brothers about hell but was told it was impossible. Some people have long used magic and science to look for a way to live forever. Others feel that death is what defines all living things, and as a natural part of life, should not be taken away.", "Most of the stress of death seems to come for loved ones who \"did not have a chance to say goodbye\". Maybe it is to relieve this stress that rituals are created, and to bring together those that knew someone so that the personal experience a person can no longer communicate for themselves, can be exchanged by others. Some ritual, such as seances, claim to allow people to speak to the dead. This is not claimed to be very reliable, both by scientists and even by those who do them very often. Aside from wills, goodbyes, organ donations and funerals, there is important personal experience to decide to pass on, or not, when someone knows they may soon die. Palliative care focuses on basic decisions people make when they are very close to the end of their lives, and it ensures someone is always available to talk to them. It is a replacement for heroic medical intervention that may keep them physically alive but with no quality of life. Human psychology must prepare for death if it is anything other than a quick surprise: Elizabeth Kubler-Ross wrote that there were several stages in dying, of which denial was the first, and acceptance was the last. Recording one's life is often something people with acceptance will do to leave a memoir or a full autobiography: Because events leave living memory, and may only be part of oral tradition, there are projects to record everything that people remember about World War I and the Shoah. The first of these was to record everything remembered about the U.S. Civil War. This discipline has changed history since we have so many more first person accounts of the times, and made social history much more standard. There are other terms for death.", "Resurrection\n\nResurrection means bringing someone back to life after they have died. The idea of resurrection is found in writings of ancient polytheistic religions in the Middle East. Some Egyptian and Canaanite writings tell of gods being resurrected, such as Osiris and Baal. In Greek mythology, many men and women were given eternal life by being resurrected from the dead. In their stories, some who came back to life as gods were Alcmene, Castor, Heracles, and Melicertes. But the Greek philosophers at that time did not believe in a physical rebirth. Christians believe that Jesus Christ was resurrected. They also believe in resurrection for all people after they die. This is based on the Gospels and on Saint Paul's writings in the New Testament. The resurrection of Jesus is the Christian belief that he returned to life by a miracle. He died by crucifixion on Friday and rose from his tomb to new life on Sunday morning. This belief is celebrated at Easter. The resurrection of Jesus Christ is written about by the evangelists in the New Testament. They are the writers of the four Gospels in the New Testament. Christians believe the resurrection is a central part of the Christian faith. Jesus died on the cross to save mankind. When he was resurrected, Jesus defeated death. He is alive forever and sitting at God's right hand on a throne. This gives Christians the hope of a new life after death. This is because his resurrection mirrors the future for all Christians after they die. With Jesus Christ and with humans, the Bible shows that the resurrected body is changed from the original. This is because the human body, while alive, is weak and frail. But, the resurrected person lives for ever. All four Gospels tell about Jesus being raised from the dead.", "Afterlife\n\nThe afterlife is what some people believe happens after death. Different religions teach different things about the afterlife. Some religions believe in reincarnation (to come back to life as a different person or even animal). These religions include Buddhism and Hinduism. Hinduism specifically believes that at death the soul leaves the physical body but does not die. It lives in an astral body in an astral plane. Here the soul continues until it is born again in another physical body as a baby. Salvation (called Moksha) in these religions is a release from this endless cycle of re-births. Most people in the world believe you go to another place after you die, such as heaven or hell. Christianity, Judaism, Islam and Jainism are religions that believe in this. For example, those that follow Christianity believe that if you accept the Christ (Jesus of Nazareth, the son of the Virgin Mary) as your saviour, you will spend eternity in heaven after death; if you do not accept him, you will be separated from him after death. Many other religions believe in an afterlife of some kind. Ancient Egyptians believed in an `afterlife`. They put things into the graves of important people. These were to be used in the next life. The Vikings had some similar beliefs. Others (like African animists) believe that some people change into spirits called ghosts. There are also those who do not believe that there is an afterlife, and that you simply cease to exist once you die. Atheists believe there is no God and no afterlife. The Sadducees were a sect of Judaism in the time of Jesus. They believed there was no spirit in man. So, after death there was no more life. .", "Jejunum\n\nThe jejunum is a section of the small intestine between the duodenum and the ileum. It is between 1 and 2 meters long.The term \"jejunum\" derives from the Latin \"jejunus,\" which means \"empty of food,\" \"meager,\" or \"hungry.\" The ancient Greeks noticed at death that this part of the intestine was always empty of food. Hence, the name the jejunum. The Latin \"jejunus\" also gave rise to \"jejune\" means lacking in nutritive value and devoid of substance, significance or interest, that is dull. A jejune argument is one that is empty (like the jejunum) and totally devoid of interest. Famous quote...\"Have You Ever Been Punched in The Jejunum?\" Ileum The ileum is the last section of the small intestine. It is between 2 and 4 meters long in humans."], "reference_contexts": ["Death Death is the end of a life in an organism. All biological and living activity of the living thing stops, including the mind and the senses. The usual signal for death in humans and many other animals is that the heart stops beating and cannot be restarted. This can be caused by many things. All living things have a limited lifespan, and all living things eventually die. Living things that have died are normally described as being dead. Death of humans is often investigated for the cause, in case of crime (such as murder), accident or disease that may continue to kill other humans. About 150,000 people die every day around the world. About two thirds of these people die because of age. In addition to the physical body, some believe humans also have a soul and believe that the soul can continue without a body (afterlife), move into another body (reincarnation), or cease to exist (annihilationism). Religions have different beliefs about this issue. Many cultures have their own customs and rituals to respect the dead. When people talk about things or events that lead to the death of a plant or animal, those things or events are usually described as being deadly, or fatal. In the case of diseases, they are described as \"terminal\". Humans are no different from any other lifeform. Our bodies have an ability for self-repair, but that ability is limited. Finding the cause of death is a medical speciality called pathology. In medicine, death is when the heart stops beating for more than several minutes. There are special times in which people recover even though the heart has stopped for 30 minutes, such as near-drowning in very cold water. If machines are used to help the heart and lungs work, then the moment of death is more difficult to know. Death is commonly a sad or unpleasant thing to people. It can make people think about their own death. People might miss or be sad for the person who has died. They might also be sad for the family and friends of the person who has died. In any society, human death is surrounded by ritual - a wake or funeral is normal. In some places it was common to eat the dead in a form of ritual cannibalism. But this is no longer common, in part because disease like kuru can be passed this way. Human dead bodies are taboo in most societies and must be handled in special ways - for a combination of religious and hygiene reasons. A human dead body must always be reported in law, to be sure it is disposed of properly. In 2021 the leading cause of death in the United States was heart disease followed by cancer and then COVID-19. Finding the cause of any human death and stopping a similar death from happening to someone else are the main reasons people look into \"human morbidity\" or let dead bodies be cut open and looked at in an autopsy. Some religions do not allow autopsies, because they feel the body is holy. Autopsies are usually required by the state if someone dies and people do not know why. The autopsy helps find out if someone killed the person on purpose, tried to hurt them, or if they died from a sickness. To prepare for their own death, humans can write a last will and testament to be clear about who gets their property and possessions. A person will sometimes also volunteer to be an organ donor. This might mean giving the whole body to medical research. It can also save the lives of others by making organ transplants possible. For a long time, many people have been afraid of death and a lot of people have wondered about what may happen to people after they die. This is one of the largest questions of philosophy and religion. Many people believe there is some form of afterlife. Ancient rulers sometimes did insist not only that their own bodies, and much property, but even their servants and relatives be destroyed at their funeral. Christianity has a special focus on death because of the state killing of Jesus Christ by the Romans. In Islam this is thought to demonstrate the injustice of human systems of dealing out death, and the ability of the best people to overcome it and even forgive it. In Christianity itself it is thought to prove that Jesus himself was really God and so could lose his body and still have the power of resurrection. In Buddhism reincarnation is believed to occur. Reincarnation is an idea taken from Hinduism. Confucianism advises respect for parents and forms of ancestor worship to respect both dead and living ancestors. Every ethical tradition including the medical view of the body has some ritual surrounding death. Often these excuse behaviours that might be hated if they did not have the ritual. For instance, one may say that organ transplant is like cannibalism. Very much of what happens at a human death is ritual. People who wish theirs to be dealt with a certain way, and who wish a particular treatment like cremation of their body, should decide in advance and set up the necessary payments and agreements. This makes it much easier for their family after they die, since there is no longer the ability to clearly communicate the wish. For the same reason, saying goodbye is important. Most of the stress of death seems to come for loved ones who \"did not have a chance to say goodbye\". Maybe it is to relieve this stress that rituals are created, and to bring together those that knew someone so that the personal experience a person can no longer communicate for themselves, can be exchanged by others. Some ritual, such as seances, claim to allow people to speak to the dead. This is not claimed to be very reliable, both by scientists and even by those who do them very often."], "response": "Death in humans is significant for several reasons. It marks the end of life, where all biological and living activities cease, including the mind and senses. Death is often surrounded by rituals and customs to respect the deceased, such as funerals, which help the living mourn and say goodbye. The cause of death is frequently investigated to prevent similar occurrences, and autopsies may be performed to determine the cause. Additionally, death prompts philosophical and religious considerations about the afterlife, reincarnation, or annihilationism. Preparing for death, such as writing a will or becoming an organ donor, is also significant as it helps manage the deceased's affairs and can save lives through organ transplants [File: wiki_00.txt, Section: Death].", "reference": "Death in humans is significant as it marks the end of life, where all biological activity ceases, including the mind and senses. It is often investigated to determine the cause, especially in cases of crime, accidents, or diseases. Death is surrounded by rituals and customs, reflecting its emotional impact on society. Additionally, beliefs about the afterlife and the handling of dead bodies vary across cultures and religions, highlighting the complex relationship humans have with death."}
{"user_input": "What Latin word means essence?", "retrieved_contexts": ["Substance\n\nSubstance is the material, or matter, of which something is made. Substances are physical things that can be seen, touched, or measured. They are made up of one or more elemental parts. Iron and aluminium, which are pure, water and air, which are mixtures; are all examples of substances. The main problem of a clear definition of what the substance is that if, for example, to consider not just the universe (cosmos), being and non-being, and in general all, the question arises, what is the constant basic principle (attribute) is the basis of the substance, which generally consists of all (that is, matter, mind, senses, space, soul, and so on). The Latin word \"substantia\" - a translation of the Greek word for the essence (\"ousia\"), and in Latin to describe the essence of using the word \"essentia\". In ancient philosophy substance is treated as a substrate, the first principle of all things (for example, \"water\" of Thales, the \"fire\" of Heraclitus). In modern times, the concept of substance is treated and spread widely. The first view is connected with an ontological understanding of substance as ultimate bases being (Francis Bacon, Benedict Spinoza, Gottfried Wilhelm Leibniz). Central category of metaphysics in philosophy substance is identified as with God and with nature and determined as the cause of itself (Latin, \"causa sui\"). The main characteristics (attributes) of a substance from Benedict Spinoza are thinking and stretch. By analogy with the philosophy of Benedict Spinoza substance considered in the light of the concept of Ren\u00e9 Descartes and Leibniz.", "Lamella\n\nLamella is a Latin word meaning \"layer\", or something which is like a \"plate\". It can mean:", "This means the light will never be able to reach us here on Earth, so we will never be able to see these parts of the universe. We call the part of the universe we can see the observable universe. The word \"universe\" comes from the Old French word \"univers\", which comes from the Latin word \"universum\". The Latin word was used by Cicero and later Latin authors in many of the same senses as the modern English word is used. A different theory is an early Greek model of the universe. In that model, all matter was in rotating spheres centered on the Earth; according to Aristotle, the rotation of the outermost sphere was responsible for the motion and change of everything within. It was natural for the Greeks to assume that the Earth was stationary and that the heavens rotated about the Earth, because careful astronomical and physical measurements are needed to prove otherwise. The most common term for \"universe\" among the ancient Greek philosophers from Pythagoras onwards was \"\u03c4\u03bf \u03c0\u03b1\u03bd\" (The All), defined as all matter (\"\u03c4\u03bf \u03bf\u03bb\u03bf\u03bd\") and all space (\"\u03c4\u03bf \u03ba\u03b5\u03bd\u03bf\u03bd\"). The broadest word meaning of the Universe is found in \"De divisione naturae\" by the medieval philosopher Johannes Scotus Eriugena, who defined it as simply everything: everything that exists and everything that does not exist. Usually the universe is thought to be everything that exists, has existed, and will exist. This definition says that the universe is made of two elements: space and time, together known as space-time or the vacuum; and matter and different forms of energy and momentum occupying space-time. The two kinds of elements behave according to physical laws, in which we describe how the elements interact.", "Latin\n\nLatin is an Italic language that was used in Ancient Rome. Short Latin texts have been found from about the 5th century BC and longer texts from about the 3rd century BC. Classical Latin was used in the 1st century BC and was the official language of the Roman Empire. It was widely used in the western part of the Mediterranean. The Romance languages developed from its spoken informal version, called Vulgar Latin. Latin was very important to Christianity for many centuries. It is still spoken today during some religious activities. It is an official language in the Vatican, where the Pope leads the Roman Catholic Church. People in the Vatican sometimes speak to one another in Latin if they have different first languages). The Mass of the Catholic Church is often done entirely in Latin. It is called is the Mass of the Roman Rite (Extraordinary Form). Latin is called a dead language because no one speaks it as a first language anymore. However, it is not an extinct language because it is still used in daily life by some people. In fact, many people still study it in school. Latin is still useful because it shows how society works. Latin makes it easier to learn the Romance languages. People still read Latin classics such as the poems of Virgil, the memoirs of Caesar and the speeches of Cicero. Also, Latin is widely used as an international auxiliary language, notably in the Catholic Church and by biologists when they describe and name new species. Some terms used in medicine to name parts of the body (such as bones), and names of some diseases, are also written in Latin. There are three types of Latin: Classical Latin, Vulgar Latin and Ecclesiastical Latin. Classical Latin was used by the educated Romans and is still studied around the world. Vulgar Latin was the more common spoken variety used by the common Romans and was learned by the peoples conquered by them.", "Focus\n\nFocus is a Latin word for hearth. In English it means many things.", "Another way to put it is that we are always making choices even if we don't realize it. Existentialists believe that our human 'essence' or 'nature' (way of being in the world) is simply our 'existence' (being in the world). More simply put, the 'essence' of a human, or what makes a human a 'human', is not due to nature or uncontrollable circumstances; rather, human essence is really just what we choose to make it. This means that the only nature we as humans have is the nature we make for ourselves. As a result of this, existentialists think that the actions or choices that a person makes are very important. They believe that every person has to decide for themselves what is right and wrong, and what is good and bad. People who believe in existentialism ask questions like \u2019what is it like to be a human (a person) in the world?\u2019 and \u2019how can we understand human freedom (what it means for a person to be free)?\u2019 Existentialism is often connected with negative emotions, such as anxiety (worrying), dread (a very strong fear), and mortality (awareness of our own death). Some existentialists, like Sartre and Heidegger, think that thinking about these emotions helps people to choose the way that they want to live their lives. Existentialism is sometimes confused with nihilism. It is different from nihilism, but there is a similarity. Nihilists believe that human life \"does not\" have a meaning (or a purpose) at all; existentialism says that people must choose their own purpose. Many of the main sources for existentialism were written in other languages and only later translated, mostly after the 1950s.", "Terminus\n\nTerminus is a Latin word that literally means \"Boundary stone\" but can refer to:", "Aqua\n\nAqua is the Latin word for water. It is sometimes as a prefix (such as aquaculture). It can also mean:", "Ecclesia (Church)\n\nEcclesia (or Ekklesia) in Christian theology means both: a particular body of faithful people, and the whole body of the faithful. Latin \"ecclesia\", from Greek \"ekklesia,\" where the word is a compound of two segments: \"ek\", a preposition meaning \"out of\", and a verb, \"kaleo\", signifying \"to call\" - together, literally, \"to call out\". That usage soon disappeared and was replaced with \"assembly, congregation, council\", or \"convocation\". If one speaks of the whole body of Christian faithful, then there are included not only the members of the Church who are alive on earth but all who were members of the church before. Some churches therefore describe the Church as being composed of the \"Church Militant\" (Christians on Earth) and the \"Church Triumphant\" (Christians in Heaven). In Catholic theology, there is also the \"Church Suffering\" (Christians still in purgatory). The Christian family, the most basic unit of Church life, is sometimes called the domestic Church. Finally, 'The Church' may sometimes be used, especially in Catholic theology, to speak of those who exercise the office of teaching and ruling the faithful, the \"Ecclesia Docens\", or again (more rarely) the governed as distinguished from their pastors, the \"Ecclesia Discens\".", "Emission\n\nEmission is a word that originally comes from Latin. Originally it means something that is sent out. Several things can be sent out:", "Lucifer\n\nLucifer is another name for \"Satan\". This is because people interpret a passage in the Book of Isaiah of the Bible in a certain way. Lucifer is Latin. It is made of two parts, \"lux-lucis\" (light) and \"ferre\" (to bring). There are two mentions of \"Lucifer\" in the Latin Vulgate. is used to refer to the morning star, the planet Venus that appears at dawn: once in to translate the Greek word \"\u03a6\u03c9\u03c3\u03c6\u03cc\u03c1\u03bf\u03c2\" (Phosphoros), which has exactly the same literal meaning of \"Light-Bringer\" that \"Lucifer\" has in Latin; and once in to translate \"\u05d4\u05d9\u05dc\u05dc\" (H\u00eal\u0113l), which also means \"Morning Star\". \"Lucifer\" is the Latin name for the \"Morning Star\", both in prose and poetry, as seen in works by Marcus Terentius Varro (116\u201327 BC), Cicero (106-43 BC) and other early Latin writers Cicero wrote: And Pliny the Elder: Poets also used the word \"Lucifer\". Ovid has at least eleven mentions of the Morning Star in his poetry. Virgil wrote: And Statius: Lucifer is the epitome of evil in the Christian religion. Lucifer is believed by some to be Satan's name when he was still an angel, but it is Latin for 'light bringer' and not originally in the Bible. The word \"Lucifer\" was also used in Latin to mean the \"morningstar\", the planet Venus, and this word was used in the Latin version of Isaiah 14, where the Hebrew version was speaking to a king of Babylonia.", "Flux (disambiguation)\n\nFlux comes from Latin and means \"flow\"; it may mean:", "Viridian\n\nViridian is a teal-green color with a hue toward green. The name comes from the Latin word \"viridis\" which means \"green\".", "Heterotroph\n\nA heterotroph (Greek \"heteros\" = another and \"trophe\" = nutrition) is an organism that requires organic substrates to get its carbon for growth and development. A heterotroph is known as a consumer in the food chain. Consumers are organisms that cannot make their own food supply. They use the food that producers make, or they eat other organisms. Animals are consumers. To stay alive, consumers must get food from other organisms. There are three types of consumers:Herbivores, Carnivores, and Omnivores. Consumers that only eat plants are called herbivores. The word herbivore comes from the Latin words \"herba\", which means \"grass or herb,\" and \"vorare\", which means \"to eat.\" A giraffe is an example of a herbivorous consumer. Consumers that only eat animals are called carnivores. The word comes from the Latin \"carnis\", which means \"flesh\", and \"vorare\", which means \"to eat.\" A tiger is an example of a carnivorous consumer. Consumers that eat both plants and animals are called omnivores. The word comes from the Latin \"omnis\", which means \"all\" and \"vorare\". Humans are a good example of an omnivorous consumer.", "Etymology\n\nEtymology is the study of the origin and meaning of words and names. It tells us how words have changed over time, and what other languages they came from. For example, the etymology of the word \"etymology\" is from the Greek words \u1f14\u03c4\u03c5\u03bc\u03bf\u03bd (\"\u00e9tymon\", \"true meaning\", from \"etymos\" \"true\") and \u03bb\u03cc\u03b3\u03bf\u03c2 (\"l\u00f3gos\", \"word\" or \"study\").", "Monitor\n\nThe word monitor is a Latin word for \"warner\" or \"suggester\". The many uses of the word are listed below."], "reference_contexts": ["Substance Substance is the material, or matter, of which something is made. Substances are physical things that can be seen, touched, or measured. They are made up of one or more elemental parts. Iron and aluminium, which are pure, water and air, which are mixtures; are all examples of substances. The main problem of a clear definition of what the substance is that if, for example, to consider not just the universe (cosmos), being and non-being, and in general all, the question arises, what is the constant basic principle (attribute) is the basis of the substance, which generally consists of all (that is, matter, mind, senses, space, soul, and so on). The Latin word \"substantia\" - a translation of the Greek word for the essence (\"ousia\"), and in Latin to describe the essence of using the word \"essentia\". In ancient philosophy substance is treated as a substrate, the first principle of all things (for example, \"water\" of Thales, the \"fire\" of Heraclitus). In modern times, the concept of substance is treated and spread widely. The first view is connected with an ontological understanding of substance as ultimate bases being (Francis Bacon, Benedict Spinoza, Gottfried Wilhelm Leibniz). Central category of metaphysics in philosophy substance is identified as with God and with nature and determined as the cause of itself (Latin, \"causa sui\"). The main characteristics (attributes) of a substance from Benedict Spinoza are thinking and stretch. By analogy with the philosophy of Benedict Spinoza substance considered in the light of the concept of Ren\u00e9 Descartes and Leibniz. The first substance is a unity of subject and object, and the second - the same atoms are simple beings who lose their stretch, but receive attribute aspirations (French, \"appetitio\"n) and multiplicity. Thanks Leibniz substance begins to associate with matter. The second point of view on the substance - an epistemological understanding of the concept, its capabilities and the need for scientific knowledge (John Locke, David Hume). Immanuel Kant believed that the law under which any change in the substance of events and the number of stored it in nature remains the same, can be attributed to the \"analogies of experience.\" Georg Wilhelm Friedrich Hegel defined substance as the integrity of changing, transient side of things, as a \"major step in the development of the will.\" For Arthur Schopenhauer substance - matter for David Hume - a fiction, the coexistence properties. State In politics, a state is the government of a country which has control over a geographic area or territory. States have three main features: There are different forms of government a state may have, for example a republic or a monarchy. Sometimes states form their own countries. In its origin the United States had different kinds of states, but they agreed to join together. Most states also have armed forces, civil service, law and police. Government institutions in a country are commonly referred to as \"the state\". The definition above is very broad. It is based on ideas by Georg Jellinek (1851-1911). Other people had other ideas: Because of the different definitions, there's no universally accepted definition of state. The one given at the start of the article is now part of international law. The earliest states could not be just human settlements. They had to be more than tribes. An example is New Guinea, which has many small tribes, but no larger organisations. Amazonia in the 18th century was also like this, with many small tribes. They are not states. To be a state, tribes have to be bounded together, for example, by a monarch. They may also be bonded by their language, and by living in the same region. An example of monarchy is early Egypt under the Pharaohs. Similar military-based states included the Babylonian Empire and the huge Roman Empire and early China. Some early states were based on cities. Some Ancient Greek city-states had democracy in a limited form. Other states had inheritance of kingship or even challenges and fighting to decide leadership. Early city states had a feature that modern society cannot match. Every man got to see and know the leading citizens. \"Man\" because most city-states limited the vote to male heads of families. One reason was that the adult men would do the fighting if the group were attacked. When the military-based state, the Roman Empire, fell, lots of little states were made and each was also military-based and controlled by a king. These states did not often work together and war raged. However, once people within the state itself started fighting (what's called a Civil war), the kings had to make peace and start parliaments. Modern states soon started in the late 15th century. The main states in Europe were: These states all tried to improve their politics and economy. They became more and more like the states today. They formed proper boundaries for their lands and worked with the powers in the state, such as the Church and the nobility. They made armies, tax systems and embassies to make them more powerful and stable."], "response": "The Latin word for essence is \"essentia\" [File: wiki_01.txt, Section: Substance].", "reference": "The Latin word \"substantia\" is a translation of the Greek word for the essence, which is \"ousia\"."}
{"user_input": "What role does the Sun play in supporting life on Earth?", "retrieved_contexts": ["The Sun is the most important source of energy for life on Earth. Without the Sun, there would be no vegetation on Earth: every plant needs light to live and grow. Everything on Earth would freeze over without the Sun. The Sun gives the Earth heat as well as light. Plants make oxygen by photosynthesis. All humans and animals breathe oxygen. The Earth's position in the Solar System is just right for the development of life on Earth. The Sun is a G-type main-sequence star. It has about 99.86% of the mass of the Solar System. The Sun has an absolute magnitude of +4.83. It is brighter than about 85% of the stars in the Milky Way galaxy. The Sun is a Population I star, i.e it a metal-rich fairly young star. The Sun is the brightest object in the Earth's sky. It has an apparent magnitude of \u221226.74. It takes 8 minutes and 19 seconds for light to travel from the Sun's surface to Earth's surface. Scientists think that the Sun started from a very large cloud of dust and small bits of ice about 4.567 billion years ago. At the center of that huge cloud, gravity caused the material to build up into a ball. Once this got big enough, the huge pressure inside started a fusion reaction. The energy this released caused that ball to heat and shine. At its very center, hydrogen atoms collide together at great temperature and pressure and fuse to form atoms of helium. This process is called nuclear fusion. It was proposed by Hans Bethe just before World War II. The Sun and everything that orbits it is in the Milky Way galaxy. The Sun orbits around the centre of the Milky Way. It takes along everything in the Solar System. The Sun moves at 820,000\u00a0km an hour.", "Sun\n\nThe Sun, also known as Sol, is a star at the center of the solar system. It is a white star that gives off different types of energy such as infrared energy (heat), ultraviolet light, radio waves and light. It also gives off a stream of particles, which reaches Earth as \"solar wind\". The source of all this energy is nuclear fusion. Nuclear fusion is the reaction in the star which turns hydrogen into helium and makes huge amounts of energy. It is a nearly perfect ball of hot plasma. The Sun looks yellow to a person standing on the Earth, but it is actually white. It looks yellow from the ground because the Earth's atmosphere scatters sunlight, causing shorter blue and green wavelengths to disperse, making the Sun's remaining visible light appear more yellow. The Sun is a star like many others in our Milky Way galaxy. The Sun is a type of star called a G-type main-sequence star based on its spectral class. The Sun has existed for a little over 4.5 billion years. The Sun is about a hundred times as wide as the Earth. It has a mass of . This is 333,000 times the mass of the Earth. 1.3 million Earths can fit inside the Sun. The Sun fuses about 600 million tons of hydrogen into helium every second. The Sun is the main source of energy for the Earth. This energy is made deep inside the Sun in a process called nuclear fusion. Four hydrogen atoms are fused together to make one helium atom. Some of the leftover matter turns into energy. This is the same way energy is released in a hydrogen bomb. It can take between 10,000 and 170,000 years for the energy in the core of the Sun to escape. The Sun is the most important source of energy for life on Earth.", "Earth\n\nEarth is the third planet from the Sun in the Solar System. It is the only planet known to have life on it. The Earth formed about 4.6 billion years ago. It is one of four rocky planets on the inner side of the Solar System. The other three are Mercury, Venus, and Mars. The large mass of the Sun keeps the Earth in orbit through the force of gravity. Earth also turns around in space, so that different parts face the Sun at different times. Earth goes around the Sun once (one year) for every 365 times it turns around (one day). Earth is the only planet in the Solar System that has a large amount of liquid water on its surface. About 71% of the surface of Earth is covered by liquid or frozen water. Because of this, people sometimes call it the blue planet. Because of its water, Earth is home to millions of species of plants and animals which need water to survive. The things that live on Earth have changed its surface greatly. For example, early cyanobacteria changed the air and gave it oxygen. The living part of Earth's surface is called the \"biosphere\". Earth is one of the eight planets in the Solar System. There are also thousands of small bodies which move around the Sun. The Solar System is moving through the Orion Arm of the Milky Way galaxy, and will be for about the next 10,000 years. Earth is about away from the Sun (this distance is called an \"astronomical unit\" or au. It moves on its orbit at an average speed of about . Earth turns around about 365 times in the time it takes for Earth to go all the way around the Sun. To make up this extra bit of a day every year, an additional day is used every four years. This is called a \"leap year\".", "Atmosphere of Earth\n\nThe Earth's atmosphere is the layer of gasses around the Earth. It is held in place by Earth's gravity. It is today made up mainly of nitrogen (78.1%). It also has plentiful oxygen (20.9%) and small amounts of argon (0.9%), carbon dioxide (~ 0.035%), water vapor, and other gases. The atmosphere protects life on Earth by absorbing (taking) ultraviolet rays from the Sun. It makes our days cooler and our nights warmer. Solid particulates, including ash, dust, volcanic ash, etc. are small parts of atmosphere. They are important in making clouds and fog. The atmosphere does not end at a specific place. The higher above the Earth, the thinner the atmosphere. There is no clear border between the atmosphere and outer space, though the K\u00e1rm\u00e1n line is sometimes treated as a border. Even higher, for some purposes the edge of the magnetosphere is treated as a border. 75% of the atmosphere is within of the Earth's surface. The most important thing to remember about the Earth and other planets is that \"they do not come from the Sun\". They or their materials were picked up by the Sun's gravitation as it moved through space. The Sun is just composed of hydrogen, with a little bit of helium. Nothing else. The material which makes up planets and their satellites is almost entirely heavier elements whose origin was in earlier supernovae explosions. The planets do give off small quantities of hydrogen and helium: this comes from the decay of larger radioactive molecules whose origin is also ancient supernovae. Originally, the Earth's atmosphere had almost no free oxygen. Some parts of the atmosphere are hot or cold, depending on height.", "This released a lot of oxygen, which was first taken up by iron in solution. After a long time, enough oxygen got into the atmosphere or air, making Earth's surface suitable for aerobic life (see Great Oxygenation Event). This oxygen also formed the ozone layer which protects life from ultraviolet radiation from the Sun. Complex life on the surface of the land did not exist before the ozone layer. Earth's land and climate has been very different in the past. About 3 to 3.5 billion years ago almost all land was in one place. This is called a supercontinent. The earliest known supercontinent was called Vaalbara. Much later, there many times the Earth was covered in ice sheets. (For example, the Cryogenian). This is called the Snowball Earth theory. Earth is rocky. It is the largest of the rocky planets moving around the Sun by mass and by size. It is much smaller than the gas giants such as Jupiter. Overall, Earth is made of iron (32.1%), oxygen (30.1%), silicon (15.1%), magnesium (13.9%), sulfur (2.9%), nickel (1.8%), calcium (1.5%), and aluminium (1.4%). The 1.2% left over is made of many different kinds of other chemicals. Some rare metals (not just gold and platinum) are very valuable. Rare earth metals are often used in electronic phones and computers. The structure of Earth changes from the inside to the outside. The center of Earth (Earth's core) is mostly iron (88.8%), nickel (5.8%), sulfur (4.5%), and less than 1% other elements.", "It is the easiest to observe in detail. Observing the Sun can help us understand how other stars work and are formed. Changes in the Sun can affect the weather and climate on Earth. A stream of charged particles called the Solar wind is constantly sent off from the Sun. The Solar wind hitting the Earth's magnetic field causes the northern lights.", "Sunlight\n\nSunlight is the light and energy that comes from the Sun. When this energy reaches the earth's surface, it is called insolation. What we experience as sunlight is really solar radiation. It is the radiation and heat from the Sun in the form of electromagnetic waves. The atmosphere affects the amount of solar radiation received. When solar radiation travels through the atmosphere, some of it is absorbed by the atmosphere (16%). Some of it is scattered to space (6%). Some of it is reflected by clouds (28%). About 47% of it reaches the Earth's surface. Without sunlight, there could not be life on the Earth. Plants need sunlight for the process of photosynthesis. During photosynthesis the plants use the energy of the sunlight, water, and carbon dioxide, to create glucose (sugar). The glucose can later be used by the plant for energy or animals eat the plant and the glucose in it. Plants need sunlight to grow green. Without enough sunlight but with enough water, the plant grows very tall very quickly, but looks yellow and dehydrated, although when touched, the leaves are very moist. Solar radiation can be both good and bad for a person's health. When in the light, the human body uses the ultraviolet part of sunlight to make its own Vitamin D. Without sunscreen too much ultraviolet light can cause sunburn and skin cancer. Sun angle makes difference in seasons on Earth as well as in the length of day and night. A high angle makes the tropics hot, and a low angle makes the arctic cold. Different bodies of the Solar System receive sunlight of different intensities. The table compares the amount of light received by each planet on the Solar System follows:", "Photosynthesis\n\nPhotosynthesis is how plants and some microorganisms make carbohydrates. It is an endothermic (takes in heat) chemical process which uses sunlight to turn carbon dioxide into sugars. The sugars are used by the cell as energy, and to build other kinds of molecules. Fundamentally, photosynthesis converts light energy into chemical energy. Photosynthesis is vital for life on Earth. Before photosynthesis, Earth had no free oxygen in its atmosphere. Green plants build themselves using photosynthesis. Algae, protists and some bacteria also use it. Some exceptions are organisms that directly get their energy from chemical reactions; these organisms are called chemoautotrophs. Photosynthesis is not an accident. It happens because its building blocks occur naturally in space, and get included when planets form. We have no idea as to how common or rare this process is. We do know that higher elements are formed in supernovae, and that is the origin of all elements higher than helium. The higher elements found in Halley's Comet have been analysed. Before photosynthesis, the Earth's atmosphere had almost no oxygen. Even without oxygen, some simple life-forms could have existed. But the key event for life as we know it was the Great Oxygenation Event. Photosynthesis can happen in different ways, but there are some parts that are common. Photosynthesis occurs in the chloroplasts in leaves (or other green tissues). They contain chlorophyll, the green pigment that absorbs light energy. In leaves, palisade cells have chloroplasts to capture light. Oxygen is produced as a result of photosynthesis and released into the atmosphere through respiration."], "reference_contexts": ["Star A star is a very large ball of bright, glowing, hot matter in space. That matter is called plasma. Stars are held together by gravity. They emit light because they are very hot. The Sun is an example of a star. It is at the center of the solar system. The amount of material in a star (its mass) is so huge that a nuclear reaction called nuclear fusion goes on inside it. This reaction changes hydrogen to helium and gives off heat. The light and heat created by nuclear fusion makes stars very hot. It also makes bigger chemical elements. In the Sun (but not all stars) the change which takes place is the production of helium, with small amounts of heavier elements. Stars have a lot of hydrogen. Fusion makes a lot of energy. The energy produced by stars moves (radiates) away from them. Much of the energy leaves as light, and the rest leaves as other kinds of electromagnetic radiation. When a star like the Sun gets old, it will expand in size and become a red giant star. That will happen in about 5 billion years. The star nearest to Earth is the Sun. The energy from the Sun supports almost all life on Earth by providing light for plants. Plants turn the light into energy in a process called photosynthesis. The energy from the Sun also causes weather and humidity on Earth. We can see other stars in the night sky when the Sun goes down. Like the Sun, they are made mostly of hydrogen and a little bit of helium plus other elements. Astronomers compare those other stars to the Sun. Their mass is measured in solar masses (M\u0298). A solar mass is the mass of the Sun. A small star may be about 0.2 M\u0298, a medium one may be about the Sun's mass (1 M\u0298), and a large star may be about 10 M\u0298. The Earth and other planets move around (\"orbit\") the Sun. The Sun and all things that orbit it are called the Solar System. Many other stars have planets orbiting them, and those planets are called exoplanets. Our Sun would look like a star in the sky to someone on an exoplanet, but you would not see the Earth from one because it would be too far away. Proxima Centauri is the closest star to the Sun. It is 39.9 trillion kilometres, equal to 4.2 light years, away. This means that light from Proxima Centauri takes 4.2 years to reach Earth. Astronomers think there is a very large number of stars in the Universe. The observable Universe contains more than 2 trillion (10) galaxies and, overall, as many as an estimated stars (more stars than all the grains of sand on planet Earth). That is, 1,000,000,000,000,000,000,000,000 stars, which is many times more than the few hundred billion stars in our galaxy, the Milky Way. Most stars are very old. They are usually thought to be between 1 billion and 10 billion years old. The oldest stars are 13.7 billion years old. That is as old as the Universe. Some young stars are only a few million years old. Stars are different sizes. The smallest stars are neutron stars, which are actually dead stars. They are no bigger than a human city. A neutron star has a large amount of mass in a very small space. A neutron star has a mass of at least 1.4 M\u0298. Hypergiant stars are the largest stars in the Universe. They have a diameter up to 1,600 times bigger than the Sun's. If the Sun was a hypergiant star, it would reach out to as far as Jupiter. The star Betelgeuse is a red supergiant star about 640 times the Sun's diameter. Although these stars are very large, they also have low density. Some stars look brighter than other stars. This difference is measured in terms of apparent magnitude. There are two reasons why stars have different apparent magnitude. If a star is very close to us, it will appear much brighter. This is just like a candle. A candle that is close to us appears brighter. The other reason a star can appear brighter is that it is hotter than another cooler star. Stars give off light but also give off a solar wind and neutrinos. These are very small particles of matter. Stars are made of mass and mass makes gravity. Gravity makes planets orbit stars. This is why the Earth orbits the Sun. The gravity of two stars can make them go around each other. Stars that orbit each other are called binary stars. Scientists think there are many binary stars. There are even groups of three or more stars that orbit each other. Proxima Centauri is a small star that orbits other stars. Stars are not spread evenly across all of space. Instead, they are grouped into galaxies. A galaxy contains hundreds of billions of stars. Stars have been important to people all over the world for all of history. Stars have also been part of religious practices. Long ago, people believed that stars could never die. Astronomers organized stars into groups called constellations. They used the constellations to help them see the motion of the planets and to guess the position of the Sun. The motion of the Sun and other stars was used to make calendars. The calendars were used by farmers to decide when to plant crops and when to harvest them. Stars are made in nebulae. These are areas that have more gas than normal space. The gas in a nebula is pulled together by gravity. The Orion nebula is an example of a place where gas is coming together to form stars. Stars spend most of their lives combining (fusing) hydrogen with hydrogen to make energy. When hydrogen is fused it makes helium and it makes a lot of energy. To fuse hydrogen into helium it must be very hot and the pressure must"], "response": "The Sun is the most important source of energy for life on Earth. It provides the heat and light necessary for plants to perform photosynthesis, which produces oxygen that humans and animals breathe. Without the Sun, Earth would freeze over, and there would be no vegetation [File: wiki_20.txt, Section: Sun]. Additionally, sunlight is crucial for the process of photosynthesis, where plants convert carbon dioxide into sugars, providing energy and building materials for themselves and, indirectly, for other life forms [File: wiki_02.txt, Section: Photosynthesis].", "reference": "The energy from the Sun supports almost all life on Earth by providing light for plants. Plants turn the light into energy in a process called photosynthesis. The energy from the Sun also causes weather and humidity on Earth."}
{"user_input": "What are the key characteristics of Institutionalism in the context of state governance?", "retrieved_contexts": ["The main ones are Pluralism, Marxism and Institutionalism. Pluralism has been very popular in the United States. It shows the state as a neutral place for settling arguments between other states. Pluralism allows each group of people to tell the state what to do. This type of state is called a polyarchy. Also in a pluralist state, politics, the military and the economy are all united and work together. This means that all power in the state is 'diffused' across the people who live there. Marxism is an ideology advocating for the rights of workers and labourers of society. It was started by Karl Marx and Friedrich Engels. Marxism rejects the idea that a state is there to protect business interest, and is definitely not a neutral place for settling arguments. The main job of a Marxist state is to protect the labour and financial situation of the working classes. With such reforms, a Marxist state focuses on collectivising resources and creating a planned economy to ensure the well-being of the workers. Both Marxist and Pluralist states have to react to the activities of groups of people in the state itself. Institutionalist states do not see themselves as 'instruments' to be controlled, they are more just geographical areas. In this area, the people just form groups themselves. An institutionalist state can be made up of both Marxist and Pluralist people, both which have the power to control themselves and not influence the other parties of the state. Anarchism is when a group of people have complete freedom and do not believe in having a state at all. Anarchists are a lot like Marxists, but they believe (opposite to Marxists) that a country can work without without a state forcing people to do anything. Law and order are not necessary.", "State\n\nIn politics, a state is the government of a country which has control over a geographic area or territory. States have three main features: There are different forms of government a state may have, for example a republic or a monarchy. Sometimes states form their own countries. In its origin the United States had different kinds of states, but they agreed to join together. Most states also have armed forces, civil service, law and police. Government institutions in a country are commonly referred to as \"the state\". The definition above is very broad. It is based on ideas by Georg Jellinek (1851-1911). Other people had other ideas: Because of the different definitions, there's no universally accepted definition of state. The one given at the start of the article is now part of international law. The earliest states could not be just human settlements. They had to be more than tribes. An example is New Guinea, which has many small tribes, but no larger organisations. Amazonia in the 18th century was also like this, with many small tribes. They are not states. To be a state, tribes have to be bounded together, for example, by a monarch. They may also be bonded by their language, and by living in the same region. An example of monarchy is early Egypt under the Pharaohs. Similar military-based states included the Babylonian Empire and the huge Roman Empire and early China. Some early states were based on cities. Some Ancient Greek city-states had democracy in a limited form. Other states had inheritance of kingship or even challenges and fighting to decide leadership. Early city states had a feature that modern society cannot match. Every man got to see and know the leading citizens. \"Man\" because most city-states limited the vote to male heads of families.", "Governance\n\nGovernance is the term for the way a group of people such as a country do things. Many groups create a government to decide how things are to be done. Governance is different from politics. Politics deals with people with different ideas working together to create an agreement about what to do, and governance is doing what politics decided needed to be done.Governance is also how government decision making affects people in that nation.", "Sustainability\n\nSustainability means that a process or state can be maintained at a certain level for as long as is wanted. One definition of sustainability is the one created by the Brundtland Commission, led by the former Norwegian Prime Minister Gro Harlem Brundtland. The Commission defined sustainable development as development that \"meets the needs of the present without compromising the ability of future generations to meet their own needs.\" Sustainability relates to the connection of economic, social, institutional and environmental aspects of human society, as well as the non-human environment. Some overarching principles of sustainability include minimalism, efficiency, resilience and self-sufficiency. Sustainability is one of the four Core Concepts behind the 2007 Universal Forum of Cultures."], "reference_contexts": ["Types of state can be separated into two categories: democracy and dictatorship. However, just because a group of states are all democratic does not mean that they follow the same rules. Iran, Pakistan, France, Germany and the United States of America are all states. Each of them sees itself as a democracy. Each of them however has a different idea of what \"democracy\" really means. Different states of the same 'category' can also function differently. For example, two democratic states may be quite different if one has a well-trained police or army while the other does not. Therefore, the word 'state' only tells us what type of government that state follows (democratic or dictatorship) and does not tell us about the country itself. There are lots of sub-types of state branching off from democracy and dictatorship. The main ones are Pluralism, Marxism and Institutionalism. Pluralism has been very popular in the United States. It shows the state as a neutral place for settling arguments between other states. Pluralism allows each group of people to tell the state what to do. This type of state is called a polyarchy. Also in a pluralist state, politics, the military and the economy are all united and work together. This means that all power in the state is 'diffused' across the people who live there. Marxism is an ideology advocating for the rights of workers and labourers of society. It was started by Karl Marx and Friedrich Engels. Marxism rejects the idea that a state is there to protect business interest, and is definitely not a neutral place for settling arguments. The main job of a Marxist state is to protect the labour and financial situation of the working classes. With such reforms, a Marxist state focuses on collectivising resources and creating a planned economy to ensure the well-being of the workers. Both Marxist and Pluralist states have to react to the activities of groups of people in the state itself. Institutionalist states do not see themselves as 'instruments' to be controlled, they are more just geographical areas. In this area, the people just form groups themselves. An institutionalist state can be made up of both Marxist and Pluralist people, both which have the power to control themselves and not influence the other parties of the state. Anarchism is when a group of people have complete freedom and do not believe in having a state at all. Anarchists are a lot like Marxists, but they believe (opposite to Marxists) that a country can work without without a state forcing people to do anything. Law and order are not necessary. Anarchists (such as Bakunin and Kropotkin in the 19th century), often want a form of Marxism but ignoring some of their rules. They want workers to manage themselves and simply get paid for what they do, rather than getting paid in wages."], "response": "Institutionalism in the context of state governance is characterized by the view that the state is not an 'instrument' to be controlled but rather a geographical area where people form groups themselves. In an institutionalist state, both Marxist and Pluralist individuals can coexist, each having the power to control themselves without influencing other parties within the state [File: wiki_01.txt, Section: State].", "reference": "Institutionalist states do not see themselves as 'instruments' to be controlled; rather, they are viewed as geographical areas where people form groups independently. An institutionalist state can encompass both Marxist and Pluralist individuals, allowing them to exercise control over themselves without influencing other parties within the state."}
{"user_input": "How will the Sun evolve over the next 5 billion years, and what will happen to the Earth during this process?", "retrieved_contexts": ["Astrophysicists think that in about 5 billion years, the Sun will be a red giant. Our Sun will be so large it will \"eat\" the Earth. After our Sun stops using hydrogen to make energy, it will use helium in its very hot core. It will be hotter than when it was fusing hydrogen. Heavy stars will also make elements heavier than helium. As a star makes heavier and heavier elements, it makes less and less energy. Iron is a heavy element made in heavy stars. Our star is an average star. Average stars will push away their outer gases. The gas it pushes away makes a cloud called a planetary nebula. The core part of the star will remain. It will be a ball as big as the Earth and called a white dwarf. It will fade into a black dwarf over a very long time. Later in large stars (~ 10 M\u0298), heavier elements are made by fusion. Finally the star makes a supernova explosion. Most things happen in the universe so slowly we do not notice. But supernova explosions happen in only 100 seconds. When a supernova explodes its flash is as bright as a 100 billion stars. The dying star is so bright it can be seen during the day. Supernova means \"new star\" because people used to think it was the beginning of a new star. Today we know that a supernova is the death of an old star. The gas of the star is pushed away by the explosion. It forms a giant cloud of gas called a planetary nebula. The crab nebula is a good example. All that remains is a neutron star. If the star was very heavy (~ 25 M\u0298), the star will make a black hole. Gravity in a black hole is extremely strong. It is so strong that even light cannot escape from a black hole.", "Eventually, the Sun will shrink into a white dwarf. Then, over several hundred billion or even a trillion years, the Sun would fade into a black dwarf. Google's 3D model of the sun.", "A solar eclipse appears when the moon is between the Earth and Sun. The last total solar eclipse occurred on December 26, 2019, and was visible from Saudi Arabia, India, Sumatra and Borneo, with a partial eclipse visible in Australia and much of Asia. A lunar eclipse happens when the moon passes through the shadow of the Earth which can only occur during a full moon. The number of lunar eclipses in a single year can range from 0 to 3. Partial eclipses slightly outnumber total eclipses by 7 to 6. Astrophysicists say our Sun is a G-type main-sequence star in the middle of its life. In about billion years, increased solar energy will boil away the Earth's atmosphere and oceans. In a few more billion years, they think the Sun will get bigger and become a red giant star. The Sun would be up to 250 times its current size, as big as and swallow up the Earth. Earth's fate is still unknown. In the long term, the Earth's future depends on the Sun, and the Sun is going to be fairly stable for the next 5 billion years. Calculations suggest that the Earth might move to a wider orbit. This is because about 30% of the Sun's mass will blow away in the solar wind. However, in the very long term the Earth will probably be destroyed as the Sun increases in size. Stars like the Sun become red giants at a later stage. The Sun will expand beyond the orbits of Mercury, Venus, and probably Earth. In any event, the ocean and air would have vanished before the Sun gets to that stage. After the Sun reaches a point where it can no longer get bigger, it will lose its layers and form a planetary nebula. Eventually, the Sun will shrink into a white dwarf.", "Earth\n\nEarth is the third planet from the Sun in the Solar System. It is the only planet known to have life on it. The Earth formed about 4.6 billion years ago. It is one of four rocky planets on the inner side of the Solar System. The other three are Mercury, Venus, and Mars. The large mass of the Sun keeps the Earth in orbit through the force of gravity. Earth also turns around in space, so that different parts face the Sun at different times. Earth goes around the Sun once (one year) for every 365 times it turns around (one day). Earth is the only planet in the Solar System that has a large amount of liquid water on its surface. About 71% of the surface of Earth is covered by liquid or frozen water. Because of this, people sometimes call it the blue planet. Because of its water, Earth is home to millions of species of plants and animals which need water to survive. The things that live on Earth have changed its surface greatly. For example, early cyanobacteria changed the air and gave it oxygen. The living part of Earth's surface is called the \"biosphere\". Earth is one of the eight planets in the Solar System. There are also thousands of small bodies which move around the Sun. The Solar System is moving through the Orion Arm of the Milky Way galaxy, and will be for about the next 10,000 years. Earth is about away from the Sun (this distance is called an \"astronomical unit\" or au. It moves on its orbit at an average speed of about . Earth turns around about 365 times in the time it takes for Earth to go all the way around the Sun. To make up this extra bit of a day every year, an additional day is used every four years. This is called a \"leap year\".", "The Sun is the most important source of energy for life on Earth. Without the Sun, there would be no vegetation on Earth: every plant needs light to live and grow. Everything on Earth would freeze over without the Sun. The Sun gives the Earth heat as well as light. Plants make oxygen by photosynthesis. All humans and animals breathe oxygen. The Earth's position in the Solar System is just right for the development of life on Earth. The Sun is a G-type main-sequence star. It has about 99.86% of the mass of the Solar System. The Sun has an absolute magnitude of +4.83. It is brighter than about 85% of the stars in the Milky Way galaxy. The Sun is a Population I star, i.e it a metal-rich fairly young star. The Sun is the brightest object in the Earth's sky. It has an apparent magnitude of \u221226.74. It takes 8 minutes and 19 seconds for light to travel from the Sun's surface to Earth's surface. Scientists think that the Sun started from a very large cloud of dust and small bits of ice about 4.567 billion years ago. At the center of that huge cloud, gravity caused the material to build up into a ball. Once this got big enough, the huge pressure inside started a fusion reaction. The energy this released caused that ball to heat and shine. At its very center, hydrogen atoms collide together at great temperature and pressure and fuse to form atoms of helium. This process is called nuclear fusion. It was proposed by Hans Bethe just before World War II. The Sun and everything that orbits it is in the Milky Way galaxy. The Sun orbits around the centre of the Milky Way. It takes along everything in the Solar System. The Sun moves at 820,000\u00a0km an hour.", "Sun\n\nThe Sun, also known as Sol, is a star at the center of the solar system. It is a white star that gives off different types of energy such as infrared energy (heat), ultraviolet light, radio waves and light. It also gives off a stream of particles, which reaches Earth as \"solar wind\". The source of all this energy is nuclear fusion. Nuclear fusion is the reaction in the star which turns hydrogen into helium and makes huge amounts of energy. It is a nearly perfect ball of hot plasma. The Sun looks yellow to a person standing on the Earth, but it is actually white. It looks yellow from the ground because the Earth's atmosphere scatters sunlight, causing shorter blue and green wavelengths to disperse, making the Sun's remaining visible light appear more yellow. The Sun is a star like many others in our Milky Way galaxy. The Sun is a type of star called a G-type main-sequence star based on its spectral class. The Sun has existed for a little over 4.5 billion years. The Sun is about a hundred times as wide as the Earth. It has a mass of . This is 333,000 times the mass of the Earth. 1.3 million Earths can fit inside the Sun. The Sun fuses about 600 million tons of hydrogen into helium every second. The Sun is the main source of energy for the Earth. This energy is made deep inside the Sun in a process called nuclear fusion. Four hydrogen atoms are fused together to make one helium atom. Some of the leftover matter turns into energy. This is the same way energy is released in a hydrogen bomb. It can take between 10,000 and 170,000 years for the energy in the core of the Sun to escape. The Sun is the most important source of energy for life on Earth."], "reference_contexts": ["be very high. Fusion happens at the center of stars, called \"the core\". The smallest stars are called red dwarfs. Red dwarfs fuse their hydrogen slowly and live for more than 100 billion years, so they live longer than any other star. At the end of their lives, they become dimmer and dimmer. Red dwarfs do not explode. When very heavy stars die, they explode. This explosion is called a supernova. When a supernova happens in a nebula, the explosion pushes the gas in the nebula together. This makes the gas in the nebula very dense (thick). Gravity and exploding stars both help to bring the gas together to make new stars in nebulas. Most stars use up the hydrogen at their core. When they do, their core becomes smaller and hotter. It becomes so hot that it pushes away the outer part of the star. The outer part expands and it makes a red giant star. Astrophysicists think that in about 5 billion years, the Sun will be a red giant. Our Sun will be so large it will \"eat\" the Earth. After our Sun stops using hydrogen to make energy, it will use helium in its very hot core. It will be hotter than when it was fusing hydrogen. Heavy stars will also make elements heavier than helium. As a star makes heavier and heavier elements, it makes less and less energy. Iron is a heavy element made in heavy stars. Our star is an average star. Average stars will push away their outer gases. The gas it pushes away makes a cloud called a planetary nebula. The core part of the star will remain. It will be a ball as big as the Earth and called a white dwarf. It will fade into a black dwarf over a very long time. Later in large stars (~ 10 M\u0298), heavier elements are made by fusion. Finally the star makes a supernova explosion. Most things happen in the universe so slowly we do not notice. But supernova explosions happen in only 100 seconds. When a supernova explodes its flash is as bright as a 100 billion stars. The dying star is so bright it can be seen during the day. Supernova means \"new star\" because people used to think it was the beginning of a new star. Today we know that a supernova is the death of an old star. The gas of the star is pushed away by the explosion. It forms a giant cloud of gas called a planetary nebula. The crab nebula is a good example. All that remains is a neutron star. If the star was very heavy (~ 25 M\u0298), the star will make a black hole. Gravity in a black hole is extremely strong. It is so strong that even light cannot escape from a black hole. The heaviest elements are made in the explosion of a supernova. After billions of years of floating in space, the gas and dust come together to make new stars and new planets. Much of the gas and dust in space comes from supernovae. Our Sun, the Earth, and all living things are made from star dust. Astronomers have known for centuries that stars have different colors. When looking at an electromagnetic spectrum, ultraviolet waves are the shortest, and infrared are the longest. The visible spectrum has wavelengths between these two extremes. Modern instruments can measure very precisely the color of a star. This allows astronomers to determine that star's temperature, because a hotter star's black-body radiation has shorter wavelengths. The hottest stars are blue and azure, then white, then yellow, and the coolest are red. Knowing the color and absolute magnitude, astronomers can place the star on the Hertzsprung-Russell diagram, and estimate its habitable zone and other facts about it. For example, our Sun is yellow-white, and the Earth is the perfect distance away for life. If our Sun was a hotter, blue star, however, Earth would have to be much farther away or else it would be too hot to have water and sustain life."], "response": "Over the next 5 billion years, the Sun will undergo significant changes. It will eventually become a red giant, expanding up to 250 times its current size, potentially swallowing the Earth. As the Sun increases in size, it will boil away the Earth's atmosphere and oceans. In the long term, the Earth's fate is uncertain, but it is likely to be destroyed as the Sun expands. After reaching its maximum size, the Sun will lose its outer layers, forming a planetary nebula, and eventually shrink into a white dwarf. Over several hundred billion or even a trillion years, the Sun will fade into a black dwarf [File: wiki_01.txt, Section: Star] [File: wiki_20.txt, Section: Sun].", "reference": "In about 5 billion years, the Sun is expected to evolve into a red giant star. During this phase, it will expand significantly, becoming so large that it will 'eat' the Earth. After the Sun exhausts its hydrogen for energy, it will begin to use helium in its very hot core, which will be hotter than when it was fusing hydrogen. Eventually, the outer gases of the Sun will be pushed away, forming a cloud known as a planetary nebula, while the core will remain as a white dwarf, which will fade into a black dwarf over an extended period."}
{"user_input": "What significant events in the life of Jesus are described in the New Testament?", "retrieved_contexts": ["Scholars of the historical Jesus think that New Testament accounts of Jesus' resurrection were stories that were invented by the apostolic-era Christian community. Some describe the Ascension as a convenient way to disagree with ongoing appearance claims in the Christian community.", "However, there is no physical or archeological evidence for Jesus, and all the sources we have are documentary. The sources for the historical Jesus are mainly Christian writings, such as the gospels and the letters of the apostles. All sources that mention Jesus were written after his death. The New Testament represents sources from the wide variety of writings in the first centuries AD that are related to Jesus. The authenticity and reliability of these sources have been questioned by many scholars, and few events mentioned in the gospels are universally accepted. Strauss' \"Life of Jesus\" was the book which raised all these issues to the surface. In its 451 pages Strauss argued that:", "New Testament\n\nThe New Testament is part of the Christian Bible, and the most important religious writing of Christianity. It tells the story of Jesus Christ, his followers, and the beginnings of Christianity. It was written in Koine Greek. The New Testament is made up of different parts. In total, there are 27 texts in the New Testament. The Eastern Orthodox Church, the Roman Catholic Church and the Protestant Churches have the same texts, but their arrangement varies; the Syriac Churches and the Ethiopian Churches have different versions. The Syriac Churches do not put Peter 2, John 2 and 3, Jude and the Revelations in the New Testament. The Ethiopian Churches do not have a common canon. Four of the Books of the New Testament are the Gospels. Most of the others are Epistles. Each of the Gospels tells the story of Jesus Christ, or the young Messiah, who Christians believe is the \"Son of God who is born to save the world from sin\". Each of the Gospels tell this same story, with a little more or less detail from the other. The other books tell about the history of the church and explain the Christian faith through letters written to persons and groups that have believed in Jesus The traditional author is listed after each entry. Pauline epistles, the 13 or 14 letters believed to be written by Saint Paul the Apostle. They are named for the person or group to which they were sent. General epistles are other letters which are named for the person traditionally believed to have written them.", "Some are history, telling the stories of the Jews, Jesus, or Jesus' followers. Some are collections of wise sayings. Some are God's commands to his people, which he expects them to obey. Some are songs of praise to God. Some are books of \"prophecy\", messages from God that he gave through chosen people called prophets. Different groups of Christians do not agree which texts should be included in the Bible. Christian Bibles range from the 66 books of the Protestant canon to 81 books in the Ethiopian Orthodox Bible. The oldest surviving Christian Bible is the Codex Sinaiticus, a Greek manuscript from the fourth century AD. The oldest complete Hebrew manuscripts date from the Middle Ages. For a long time the texts were passed on by word of mouth from generation to generation. The Bible was written long ago in Aramaic, Hebrew, and Greek. Translations were made later into Latin and some other languages. Now there are translations in English and many other languages. The books of the Hebrew Bible\u2014what Christians call the Old Testament\u2014were not all written at the same time. It took hundreds of years (about 1200 years). The process of putting it all together began around 400\u00a0B.C. The books of the New Testament, which was originally written in Greek, began to be collected together in about 100 A.D. It tells about events that happened between 4 B.C. and 70 A.D. These events included the birth, life, death and resurrection of Jesus. It also tells how his followers went around spreading his message. It ends with a description of how the world will end when Jesus returns to earth. Most of the writers of the New Testament were apostles of Jesus. These were people who said they had seen Jesus alive after his crucifixion.", "These books tell about God's disappointment with the ancient Hebrews and His promise to bring them back to friendship with Him. The prophets also foretell a great surprise God was planning for the world-He was going to send His very own Son, the Messiah (the \"Anointed One\"), the Saviour, to save us from our sins. You can read about this Messiah in the New Testament. In the Old Testament, Tanakh was mostly written in Hebrew; a few parts were written in Aramaic. This part of the Bible is considered to be holy by Jews as well as Christians. There are also a few books of the Old Testament's time called Deuterocanonical by those Churches that accept them as part of the Bible, and Apocrypha by those that do not. The second part is called the New Testament. The main part of this book is the story of the life of Jesus Christ. The four different versions of this story in the New Testament are called the Gospels. After the Gospels, there is also the story of what happened to the Church after Jesus's death and resurrection. Part of this is told through letters by early Christian leaders, especially Saint Paul. The final book of the Bible tells about a vision that St. John, one of the disciples of Jesus, had. In the vision John saw what would happen at the end of the world. This included judgement for evil and happiness for the people who had followed Jesus. One of the most quoted verses in the Bible is : \"For God so loved the world that He gave His one and only Son, that whoever believes in Him shall not perish <nowiki>[die]</nowiki> but have eternal life.\" People have different ideas about the Bible. Christians believe it is God's Word to people."], "reference_contexts": ["Bible The Bible, also known as the Holy Bible, is a group of religious texts of Judaism and Christianity, it contains both the Old Testament and The New Testament. The word Bible comes from the Greek word \u03c4\u1f70 (\"bibl\u00eda\") which means \"books\" in English, because it is many books in one book. It includes laws, stories, prayers, songs, and wise words. A number of texts are both in the Hebrew Bible, used by Jews, and this Christian one. The Bible is the best-selling book in the entire world. In considering the source and inspiration for the Bible one must see what the Bible says of itself. Several verses of scripture define the source, intent, and Author. 2 Peter 1:21 says this - \"No prophecy was ever made by the act of human will, but men moved by the Holy Spirit spoke from God.\" Isaiah 55:11 tells us that His is a word of power - \"So shall My word be that goes forth from My mouth; It shall not return to Me void, But it shall accomplish what I please, And it shall prosper in the thing for which I sent it.\" Hebrews 4:12 says this - \"For the word of God is alive and active. Sharper than any double-edged sword, it penetrates even to dividing soul and spirit, joints and marrow; it judges the thoughts and attitudes of the heart.\" When talking about the Bible, a \"book\" is used to speak about a number of texts. All the texts that make a \"book\" are believed to belong together. Most of the time, people believe they were written or collected by the same person. The Bible contains different kinds of such books. Some are history, telling the stories of the Jews, Jesus, or Jesus' followers. Some are collections of wise sayings. Some are God's commands to his people, which he expects them to obey. Some are songs of praise to God. Some are books of \"prophecy\", messages from God that he gave through chosen people called prophets. Different groups of Christians do not agree which texts should be included in the Bible. Christian Bibles range from the 66 books of the Protestant canon to 81 books in the Ethiopian Orthodox Bible. The oldest surviving Christian Bible is the Codex Sinaiticus, a Greek manuscript from the fourth century AD. The oldest complete Hebrew manuscripts date from the Middle Ages. For a long time the texts were passed on by word of mouth from generation to generation. The Bible was written long ago in Aramaic, Hebrew, and Greek. Translations were made later into Latin and some other languages. Now there are translations in English and many other languages. The books of the Hebrew Bible\u2014what Christians call the Old Testament\u2014were not all written at the same time. It took hundreds of years (about 1200 years). The process of putting it all together began around 400 B.C. The books of the New Testament, which was originally written in Greek, began to be collected together in about 100 A.D. It tells about events that happened between 4 B.C. and 70 A.D. These events included the birth, life, death and resurrection of Jesus. It also tells how his followers went around spreading his message. It ends with a description of how the world will end when Jesus returns to earth. Most of the writers of the New Testament were apostles of Jesus. These were people who said they had seen Jesus alive after his crucifixion. A translation is when a scribe takes the source in one language and writes it in another language. Most texts of the Bible were written in Ancient Greek or in Aramaic or Hebrew. The first to provide a translation into Latin was Jerome, in the 5th century. He started what is known as the Vulgate today. Wufila translated the Bible into the Gothic language. In the early Middle Ages, people such as Petrus Valdes, and Jan Hus provided translations. The New Testament was first translated into English in 1382 by John Wycliffe, and his associates translated the Old Testament. The translation was made from the Vulgate Latin bible. Wycliffe did this so that people could see for themselves what the Bible said. The translation was completed in 1382. There were some later editions by other people to the Wycliffe bible, as it is called. It was translated into Middle English, the language of his day. Wycliffe did not have Church permission to do this, but he was protected by John of Gaunt, one of the most powerful men in the kingdom. After both Wycliffe and his protector were dead, the Church declared Wycliffe a heretic in 1415, and banned his writings. The Council of Constance decreed Wycliffe's works should be burned and his remains exhumed (dug up). Why was the Church so opposed? The translations challenged the Church's authority over the people. In church, explaining the Bible was the priest's work. Whatever he said could not be challenged. Once the ordinary people could read the Bible, they might have other opinions. The next step in translation was done in 1525 by William Tyndale. His translation was into Early Modern English, which we can just about understand today. Tyndale also did it without Church permission. His was the first translation to be printed, and several thousand copies were made. He had no protector, and his fate was terrible. He fled to Europe, but the agents of Thomas More (Chancellor of England at the time) eventually found him. Both Tyndale and his printer were executed by burning at the stake. Another well known translation is the 1611 King James translation (commonly known as the Authorized King James Version of the Bible). Some texts were written by historians who tried to show what Ancient Israel was like. Other texts are poems about God and his work. And others were used to make laws. Followers of Judaism and Christianity consider the Bible sacred but they do not all agree about what belongs in the Bible."], "response": "The New Testament describes several significant events in the life of Jesus, including his birth, life, death, and resurrection. It also tells how his followers spread his message after his resurrection [File: wiki_01.txt, Section: Bible]. Each of the Gospels in the New Testament tells the story of Jesus Christ, who Christians believe is the \"Son of God\" born to save the world from sin [File: wiki_07.txt, Section: New Testament].", "reference": "The New Testament describes significant events in the life of Jesus, including his birth, life, death, and resurrection. It also details how his followers spread his message and concludes with a description of how the world will end when Jesus returns to earth."}
{"user_input": "What is the significance of the Messiah in the Bible?", "retrieved_contexts": ["Messiah\n\nMessiah or the Anointed One is the figure promised by God to the Jews for the salvation of the world. Other people in real life or fiction are called messianic if they have the qualities of a messiah, or people think they will bring about a better world. Christianity, which began in Israel with Jewish followers of Jesus (), holds that the Messiah foretold by the Jewish Scriptures is Jesus, and that in fulfillment of prophecy Jesus died for the sins of the world, rose from the dead and lives today, seated at the right hand of God until His return. Most Jews do not hold these beliefs; those who do are sometimes called Messianic Jews. Some Messianic Jews and other Christians see the fact that a majority of Jews do not hold these beliefs as a fulfillment of prophecy. (see Epistle to the Romans chapter 10) Muslims believe that Jesus was the son of Mary, that he was a mighty prophet of God and that he was the Messiah (though, in Islam, the Messiah has a different role than he does in Christianity or Judaism). They believe that he will come again one day in his Second Coming to fight besides the Mahdi against the \"Dajjal\" (\"false messiah\").", "Christ (title)\n\nIn Christianity, the Christ (; ) is a title for the savior and redeemer who would bring salvation to the Jewish people and mankind. Christ is the Greek translation of the Hebrew title \"Messiah\" (; anointed one), the figure promised by God to the Jewish people and mankind for the salvation of the world. Christians believe that Jesus of Nazareth is the Jewish Messiah called Christ of the Christian Old Testament and fulfilled the messianic prophecies of Christian tradition. \"Christ\", used by Christians both as a name and as a title, is synonymous with Jesus.", "These books tell about God's disappointment with the ancient Hebrews and His promise to bring them back to friendship with Him. The prophets also foretell a great surprise God was planning for the world-He was going to send His very own Son, the Messiah (the \"Anointed One\"), the Saviour, to save us from our sins. You can read about this Messiah in the New Testament. In the Old Testament, Tanakh was mostly written in Hebrew; a few parts were written in Aramaic. This part of the Bible is considered to be holy by Jews as well as Christians. There are also a few books of the Old Testament's time called Deuterocanonical by those Churches that accept them as part of the Bible, and Apocrypha by those that do not. The second part is called the New Testament. The main part of this book is the story of the life of Jesus Christ. The four different versions of this story in the New Testament are called the Gospels. After the Gospels, there is also the story of what happened to the Church after Jesus's death and resurrection. Part of this is told through letters by early Christian leaders, especially Saint Paul. The final book of the Bible tells about a vision that St. John, one of the disciples of Jesus, had. In the vision John saw what would happen at the end of the world. This included judgement for evil and happiness for the people who had followed Jesus. One of the most quoted verses in the Bible is : \"For God so loved the world that He gave His one and only Son, that whoever believes in Him shall not perish <nowiki>[die]</nowiki> but have eternal life.\" People have different ideas about the Bible. Christians believe it is God's Word to people.", "Antichrist\n\nIn Christian beliefs, the Antichrist or Anti-christ (\"anti\" means opposite; \"christ\" means messiah) is used to speak about a person or image that implies evil, and more than one person. It is also said that antichrist is the devil himself. The Biblical Book of Revelation refers to two \"Beasts\". One of them is often identified as the Antichrist, the counter-messiah of the devil.", "Mahdi\n\nThe Mahdi or Mehdi ('the rightly-guided one') is Islam's messiah or savior. It is said that he and the Prophet Jesus will change the world for the better, bringing God in all hearts, before Yaum al-Qiyamah (\"Day of the Resurrection\"). In particular, the Sudanese tribal leader Muhammed Ahmed proclaimed himself as the Mahdi, appointed by Allah to free his country. He defeated the forces of the Khedive of Egypt and the British, only to die suddenly six months later.", "Isaiah\n\nIsaiah was a prophet of God in Judaism, Islam, Christianity and Bah\u00e1'\u00ed. He lived from about 740 to 681 BC. The name \"Isaiah\" means \"the Lord is salvation\" in the Hebrew language. Isaiah is also the name of a book in the Old Testament of the Bible, which tells the story of the Israelites in Isaiah's time. According to Christianity, Isaiah predicted in this book, the birth and then death of Jesus, hundreds of years before it actually happened. Judaism does not agree with that interpretation. Isaiah was known to be the Shakespeare of the Bible due to his good education and the quality of the passages he wrote. He was cut in half by King Manasseh which led to his gruesome death. Most of Isaiah's Bible passages begin with 'God's message to'.", "It is a source of conflict between Lebanon, Syria, Jordan, Israel and Palestine. In the Hebrew Bible, the Jordan is referred to as the source of fertility to a large plain (\"Kikkar ha-Yarden\"), called \"the garden of God\" (Genesis 13:10). There is no regular description of the Jordan in the Bible. The New Testament states that John the Baptist baptized Jesus in the Jordan (Matt. 3:13). The Jordan is a frequent symbol in folk, gospel, and spiritual music, or in poetic or literary works. Because the Israelites made a difficult journey from slavery in Egypt to freedom in \"The Promised Land\", the Jordan can be a symbol of freedom. The actual crossing is the final step of the journey, which is then complete. Also, the Jordan can mean death itself, with the crossing from life into Paradise or Heaven.", "Bible\n\nThe Bible, also known as the Holy Bible, is a group of religious texts of Judaism and Christianity, it contains both the Old Testament and The New Testament. The word Bible comes from the Greek word \u03c4\u1f70 (\"bibl\u00eda\") which means \"books\" in English, because it is many books in one book. It includes laws, stories, prayers, songs, and wise words. A number of texts are both in the Hebrew Bible, used by Jews, and this Christian one. The Bible is the best-selling book in the entire world. In considering the source and inspiration for the Bible one must see what the Bible says of itself. Several verses of scripture define the source, intent, and Author. 2 Peter 1:21 says this - \"No prophecy was ever made by the act of human will, but men moved by the Holy Spirit spoke from God.\" Isaiah 55:11 tells us that His is a word of power - \"So shall My word be that goes forth from My mouth; It shall not return to Me void, But it shall accomplish what I please, And it shall prosper in the thing for which I sent it.\" Hebrews 4:12 says this - \"For the word of God is alive and active. Sharper than any double-edged sword, it penetrates even to dividing soul and spirit, joints and marrow; it judges the thoughts and attitudes of the heart.\" When talking about the Bible, a \"book\" is used to speak about a number of texts. All the texts that make a \"book\" are believed to belong together. Most of the time, people believe they were written or collected by the same person. The Bible contains different kinds of such books. Some are history, telling the stories of the Jews, Jesus, or Jesus' followers.", "Christmas\n\nChristmas (which means \u201cThe Mass of Christ\u201d) is a Christian holiday that celebrates the birth of Jesus Christ, who Christians believe is the Son of God. Christmas is also a cultural holiday for many non-Christians all over the world. It is usually celebrated in the month of December, with the main day being Christmas Day on December 25. Christmas Day is celebrated on the 25th of December. It is an important day, mainly for Christians, along with Easter (which celebrates the death and resurrection of Jesus). The season of Advent begins on a Sunday about four weeks before Christmas. During Advent, people prepare for Christmas. The Christmas season (called Christmastide) ends 6 January, also called the Twelfth Day of Christmas. On this day, Christians celebrate \u2018\u2019Epiphany\u2018\u2019. Many Christians also attend Church on Christmas Day. Christmas celebrates the birth of Jesus. There are four different Gospels in the Bible which talk about Jesus\u2019 birth. The Gospel of Luke gives details about Jesus\u2019 birth. The Gospel of Matthew tells another part of the story. The Gospel of John says that Jesus came from God to bring his \u201cWord\u201d (his message) to all people. Christians believe these Gospels are based on fact. The Gospels say that many years before Jesus\u2019 birth, prophets had told a promise to the Jewish people that God would send them a Messiah, or holy teacher. Christians believe that the promised Messiah was Jesus. His mother was a young woman called Mary, who was engaged, but not yet married to a carpenter called Joseph. Joseph found out that Mary was pregnant and was upset. He was wondering what he should do, when an angel came from God to tell him that the baby was the Holy One. The angel said that he must \u2018\u2019name the baby\u2019\u2019.", "Joseph (Hebrew Bible)\n\nIn the Bible, Joseph was a son of Jacob. Joseph's brothers hated him, because he was their father's favorite son, and his father gave him a coat with many colours. Joseph had dreams about his brothers bowing to him. One day they decided to kill him but changed their minds. According to Genesis they sold him as a slave. In Islamic tradition they threw him in a large well that had only a little salt water but when he drank it, by the will of God, it was very sweet. A passing caravan found him and took him as a slave to Egypt. Joseph became the slave of the chief of the Pharaoh's guards but was put in prison, where he interpreted the dreams of other prisoners. The Pharaoh heard of his power and asked for interpretations of his own dreams. Joseph became the Pharaoh's prime minister. This caused the Israelites to leave Canaan and live in Egypt.", "Now, it is up to people to recognize him and believe him\". On 18 November 1997, after appearing in court before Justice Rasheed A. Razvi of Sindh High Court Hyderabad Circuit, Shahi said, \"The only justification to be Hazrat Imam Mehdi is the mark on [one's] back which can prove his existence.\" Of the groups following Shahi, Messiah Foundation International claims that Shahi is the awaited Mehdi, Messiah, and Kalki Avatar while \"Anjuman Serfaroshan-e-Islam\" did not. According to MFI's website, Shahi is the Awaited Messiah, but they deny the notion that Shahi is another form of Jesus and claim that Jesus has also returned to support the Mehdi. Gohar Shahi has authored a number of books, including one based on Sufi poetry known as \"Tary\u0101q-e-Qalb\", roughly translating to the \"'Cure of Hearts'\". One of his most prominent books is \"Deen-e-Ilahi\" (\"The Religion of God\"), which is banned in Pakistan. Works by Gohar Shahi include: On May 17th, 2012, Messiah Foundation International republished \"The Religion of God\" with Hay House. As of July 1st, 2012, it was #5 on the publisher's Best Seller's List. Messiah Foundation International considers Shahi to be the author of the \"Goharian Philosophy of Divine Love\", a set of principles upon which the organisation is founded. Shahi has also authored a monthly magazine, \"Hatif-e-Mehdi\", which is banned in Pakistan for allegedly containing material offensive to the religious feelings of Muslims there.", "Gospel\n\nGospel originally meant the Christian message (\"the gospel\"), but in the 2nd century it came to be used also for the books in which the message was set out. The word gospel came from the Old English word \"g\u014ddspel\", which literally means \"good news\", since it narrates Jesus Christ's life and teaching to invite anyone to believe that he was born to save the world from sin and make humans truly know God as a Father. It includes the Death and Resurrection of Jesus. The Gospel was originally spoken, not written. Eventually gospel came to mean an ancient book about Jesus, especially one of the four books collected by the Church in the Bible. These books are the first part of the New Testament of the Bible, and are put in a group of this order: the Gospel of Matthew, the Gospel of Mark, the Gospel of Luke and the Gospel of John. \"Injil\" (Arabic: \u0625\u0646\u062c\u064a\u0644) is the Arabic name for the Gospel of Jesus (Isa). The Injil is mentioned many times in the Qur'an. In Islam, Jesus is believed to be the second-to-last prophet and messenger of God (Allah) and the Messiah. Muslims believe that God revealed the Injil to Jesus, while also declaring the truth of the previous revelations: the Tawrat (the Torah) and the Zabur (the Psalms).", "Prophecy\n\nA prophecy is a claim of what the future will be like, which is not based on any ordinary source of information. Prophecies are found in most religions. Not all people believe in prophecy. People that do think they come from God or a god. They are often hard to understand and need interpretation. Very often, they concern one very specific event. People who make prophecies are called prophets. In Ancient Greece, people who made prophecies were called oracles, most notably the Oracle of Delphi. Since then, people like Nostradamus have made prophecies. To prophesy is to make a prophecy. The two words are spelled differently and pronounced differently. \"Prophesy\" is a verb, and \"prophecy\" is a noun. There are many prophecies in the Bible. Some of these warn of punishments to come. There are two kinds of Bible prophecies. Some are conditional, that is, they include the possibility that the punishment can be avoided based on the hearers changing their ways. An example of this is found in the Book of Jonah. Other prophecies are unconditional. That means that the event will happen no matter what the hearers do to avoid it. There are also Bible prophecies that tell of future blessings. Blessings are good things that happen because of God's mercy and forgiveness. Some prophecies contain both punishment and blessings. Jesus made prophecies like this, warning people to believe in Him and live right, to get the blessing instead of the punishment. While some of the prophecies in the bible about future events are hard to understand, the moral warnings from Jesus are not hard to understand.", "Christians believe it is God's Word to people. The Jews believe that only the Old Testament is from God. Protestants and Catholics believe that the Old and New Testaments are God's Word. Catholics also believe that the books called Apocrypha or Deuterocanonical are part of the Bible. Sometimes different denominations disagree over exactly what the Bible means. According to Islam, the Injil itself is to be followed but it is believed to have been corrupted with time. The Qur'an is believed to be the successor. Atheists do not believe that gods exist, so the Bible is only an ancient book. Deists believe in God, but they believe that the Bible was written by people, so they don't see it as important.", "Solomon\n\nSolomon is a figure from Abrahamic religions. He was a King of Israel, the son of King David. His name means \"Peace\". He is written about in the Qur'an, the Bible (2 Samuel) and other scriptures. He is said to be the author of several Old Testament books. He wrote Ecclesiastes, Song of Songs and much of Proverbs. He is famous for building the First Temple, having lots of wisdom, being very rich, and having many wives. Because of his wives, his kingdom became divided right after his death. His wives worshipped idols of gods because many of them were not of Jewish lineage. <br>", "Riaz Ahmed Gohar Shahi\n\nRiaz Ahmed Gohar Shahi (; born 25 November 1941) is a spiritual leader and founder of the spiritual movements \"RAGS International\" (now known as Messiah Foundation International) and \"Anjuman Serfaroshan-e-Islam\". He is the author of many Urdu books on spirituality. The most popular of his books is \"Deen-e-Ilahi\" \"The Religion of God\" (2000) which has recently been republished by Hay House and translated into English, Arabic, Thai, Persian, Hindi and other languages by Messiah Foundation International. RAGS International was renamed to Messiah Foundation International in 2000. MFI claims that Shahi is the Mehdi, Messiah, and Kalki Avatar. Shahi was born on 25 November 1941, in the village of Dhok Gohar Shah in the district of Rawalpindi in British India. He is a fifth generation descendant of the Sufi Baba Gohar Ali Shah. At the age of twenty, when he was the owner of F.Q. Steel Industries, Shahi began to search for spirituality. Eventually he became disillusioned in this search and returned to work. Shahi then married and had three children. In 1975, he went to Sehwan Sharif for self-mortification. He spent a period of three years in the mountains of Sehwan Sharif and the forest of Laal Bagh in self-purification. Shahi became popular as a Sufi preacher in Pakistan during the later 1970s. He formed \"RAGS International\" and \"Anjuman Serfaroshan-e-Islam\" in 1980. Of the two organisations, RAGS International is still active as Messiah Foundation International whereas Anjuman Serfaroshan-e-Islam was reported to have been dissolved and banned in Pakistan in 2011."], "reference_contexts": ["What is considered part of the Bible changed with history. Different denominations include certain parts or leave out other parts. There is not one single version of the Bible; both the content of the books and their order may change. Languages do not match. When a translation is done, the translator has to decide between translation word for word, or capturing the sense of the text. When he decides to capture the sense, he will choose other words in the target language. This is called paraphrasing. Today there are dozens of versions of the Bible. Some are translations and some are paraphrases. A paraphrased version is where people take a translation and put it in their own words. As the Bible has been translated into modern languages, it is also possible that there are different translations of the same texts. The Bible is the best selling book of all time. 2.5 billion to more than 6 billion copies of the Bible have been sold to date. A complete version of the Bible exists in 471 languages. Parts have been translated in 2225 languages. Most Bibles can be found in the British Museum in London. The Christian Bible is a collection of 66 books. The first 39 books are the Old Testament. It is the first part of the God's story of salvation. \"Salvation\" is God's long work of saving us from our sins. \"Sin\" is what happened when people decided to live their own way instead of God's way in the world that God created. That was when God began His great work of saving us from our sins. To prepare the way, God had to destroy the whole world by a great flood, except for the family of Noah. Then God raised up a new people for Himself. They were the ancient Hebrews. God promised the Hebrews they would bring His salvation to the whole world. The first five books of the Old Testament are mostly the story of how God chose the ancient Hebrews and taught them his laws. Following these are the twelve books that tell the history of the Hebrews. The next five are books of poetry and wisdom. One of these five books, the \"Psalms\", is a book of songs showing mainly how God wants to be worshiped. The last seventeen books of the Old Testament were written by Hebrew prophets. These books tell about God's disappointment with the ancient Hebrews and His promise to bring them back to friendship with Him. The prophets also foretell a great surprise God was planning for the world-He was going to send His very own Son, the Messiah (the \"Anointed One\"), the Saviour, to save us from our sins. You can read about this Messiah in the New Testament. In the Old Testament, Tanakh was mostly written in Hebrew; a few parts were written in Aramaic. This part of the Bible is considered to be holy by Jews as well as Christians. There are also a few books of the Old Testament's time called Deuterocanonical by those Churches that accept them as part of the Bible, and Apocrypha by those that do not. The second part is called the New Testament. The main part of this book is the story of the life of Jesus Christ. The four different versions of this story in the New Testament are called the Gospels. After the Gospels, there is also the story of what happened to the Church after Jesus's death and resurrection. Part of this is told through letters by early Christian leaders, especially Saint Paul. The final book of the Bible tells about a vision that St. John, one of the disciples of Jesus, had. In the vision John saw what would happen at the end of the world. This included judgement for evil and happiness for the people who had followed Jesus. One of the most quoted verses in the Bible is : \"For God so loved the world that He gave His one and only Son, that whoever believes in Him shall not perish <nowiki>[die]</nowiki> but have eternal life.\" People have different ideas about the Bible. Christians believe it is God's Word to people. The Jews believe that only the Old Testament is from God. Protestants and Catholics believe that the Old and New Testaments are God's Word. Catholics also believe that the books called Apocrypha or Deuterocanonical are part of the Bible. Sometimes different denominations disagree over exactly what the Bible means. According to Islam, the Injil itself is to be followed but it is believed to have been corrupted with time. The Qur'an is believed to be the successor. Atheists do not believe that gods exist, so the Bible is only an ancient book. Deists believe in God, but they believe that the Bible was written by people, so they don't see it as important. Pi formula_1 () () is a mathematical constant that is the ratio of a circle's circumference to its diameter. This produces a number, and that number is always the same. However, the number is rather strange. The number starts as 3.141592653589793 and continues without end. Numbers like this are called irrational numbers. The diameter is the largest chord which can be fitted inside a circle. It passes through the center of the circle. The distance around a circle is known as the circumference. Even though the diameter and circumference are different for different circles, the number formula_1 remains constant: its value never changes. This is because the relationship between the circumference and diameter is always the same. formula_1 is defined as the ratio of a circle's circumference formula_4 to its diameter formula_5: formula_1 is often written as . It is also an irrational number, meaning it cannot be written as a fraction formula_8, where formula_9 and formula_10 are integers (whole numbers). This basically means that the digits of formula_1 that are to the right of the decimal go forever\u2014without repeating in a pattern, and that it is impossible to write"], "response": "The Messiah, or the Anointed One, is a significant figure in the Bible, promised by God for the salvation of the world. In Christianity, the Messiah is believed to be Jesus Christ, who fulfills the messianic prophecies of the Old Testament. Christians believe that Jesus died for the sins of the world, rose from the dead, and lives today, fulfilling the role of the Messiah as foretold in the scriptures [File: wiki_05.txt, Section: Messiah; File: wiki_07.txt, Section: Christ (title)]. The Bible, particularly the New Testament, tells the story of Jesus Christ's life, death, and resurrection, emphasizing his role as the Savior and Messiah [File: wiki_01.txt, Section: Bible].", "reference": "The Messiah, referred to as the 'Anointed One' and the Saviour, is significant in the Bible as the one God promised to send to save humanity from their sins. This promise is foretold by the Hebrew prophets in the Old Testament and is fulfilled in the New Testament with the life of Jesus Christ."}
{"user_input": "What role does the Avesta play in the context of miracles as described in various religious texts?", "retrieved_contexts": ["Avesta\n\nAvesta is the holy book of Zoroastrianism. It is written in the Avestan language, an Iranian language. The Avesta has also been translated into other languages including Farsi and English. The oldest portion, the Ghathas, are the religious songs composed by Zoroaster himself. Other parts of Avesta are named Yasna, Yashts, Visperad, Vendidad and Khordeh Avesta. There are two other religious texts in Zoroastrianism which are named Denkard and Ardaviraf Namak.", "Miracle\n\nA miracle is an amazing, beneficial event that goes (or at least seems to go) against natural laws. Some people say that a miracle is always an act brought about by God or other supernatural force (such as an angel). Others say that there can always be another explanation for it. And thirdly, some say the event is myth and never actually even happened in the first place. In the Bible a miracle is an act by God, where God's presence is shown. They can be an act that affects one person, or a gigantic disturbance of nature that changes the world. Here are seven types that can be found. These are just some of the many miracles in the Bible. Other religious books, like the Quran, Mahabharata and the Avesta, contains many references to this definition of miracle. An example of a miracle in the Quran is when Muhammad splits the moon into halves.", "One of the books of the Iranian peoples is called the Avesta. It is not really one book, but a collection of many books, but together they are called the Avesta. The Avesta is the holy book of Zoroastrianism. The language of the Avesta is very similar to the language of the RigVeda. The Avesta also has asuras and devas. But in Iran they are written as \"ahura\" and \"daeva\". The old part of the Avesta is almost as old as the RigVeda. In this old part of the Avesta the ahuras and the daevas are almost like they are in the RigVeda. In both books they are groups of supernatural beings. But they are very different in character. Some time after the RigVeda was written, stories were told about the asuras and devas that made them not friends any more. A similar thing also happened in the Avesta. Only that the two groups had been switched: The Asuras became demons in regions where North Indian languages were spoken, and the Daevas became demons in regions where Iranian languages were spoken. It is not known for sure why this happened. It was a very, very long time ago. One possible reason why the Asuras became demons in India is this: Some time after the RigVeda was written Indians started to think that \"asura\" means \"a-sura\", which means \"not a hero\". So, maybe that way the \"asura\"s got a bad name. One possible reason why the Daevas became demons in Iran is this: At about the same time as the Indians were writing the last part of the RigVeda, a very thoughtful man named Zoroaster appeared in Iran."], "reference_contexts": ["Miracle A miracle is an amazing, beneficial event that goes (or at least seems to go) against natural laws. Some people say that a miracle is always an act brought about by God or other supernatural force (such as an angel). Others say that there can always be another explanation for it. And thirdly, some say the event is myth and never actually even happened in the first place. In the Bible a miracle is an act by God, where God's presence is shown. They can be an act that affects one person, or a gigantic disturbance of nature that changes the world. Here are seven types that can be found. These are just some of the many miracles in the Bible. Other religious books, like the Quran, Mahabharata and the Avesta, contains many references to this definition of miracle. An example of a miracle in the Quran is when Muhammad splits the moon into halves. Zebra Zebras are mammals of the family \"Equidae\". Zebras are African horses. They are in the same genus as the common horse, \"Equus caballus\", and donkeys. Zebras are known for having many black and white stripes. There are three main species of zebra, Grevy's Zebra, the Plains Zebra, and the Mountain Zebra. All zebras have very short fur because they live in hot areas. Their fur has black and white stripes. The main part of the body has mostly vertical stripes, and the legs have horizontal stripes. They also have a dark line directly down their spine. Each of the different zebra species has different types of stripes. Each zebra has a unique pattern. Despite many attempts, we do not really know what the advantage is of having those characteristic stripes. There are different species and sub-species of zebra, and they all have stripes, so scientists think it must be important. Zebras are social animals that spend time in herds, they graze together and sometimes even groom each other. They can have babies (foals) when they are about five years old and can have one every year. Zebras mainly eat grass. They always live near water and are an endangered species. Zebras live in Africa, south of the Sahara desert."], "response": "The Avesta, the holy book of Zoroastrianism, contains references to the definition of miracles, similar to other religious texts like the Quran and the Mahabharata. In these texts, a miracle is often seen as an act brought about by God or a supernatural force, and the Avesta includes many references to this concept of miracles [File: wiki_01.txt, Section: Miracle].", "reference": "The Avesta, like other religious books such as the Bible and the Quran, contains many references to the definition of miracles, which are described as amazing, beneficial events that seem to go against natural laws and are often attributed to a divine or supernatural force."}
{"user_input": "What is the impact of Greek works on Western Europe?", "retrieved_contexts": ["Western world\n\nWestern world has meant various things at various times. In the earliest history of Europe, it referred to Ancient Greece and the Aegean. During the Roman Empire, it meant the Western Roman Empire (covering the area from Croatia to Britain). At other times, it has meant Western Europe or Europe or Christendom. During and after the Cold War, it sometimes meant the democratic countries or those allied with the various NATO powers. In this day and age, it often refers to the places that have a European cultural heritage, called Western civilization. This European heritage itself is a combination of Judeo-Christian ethic, classical Greco-Roman thinking and the cultural practices of the \"barbarian\" peoples of Northern Europe. Under the strictest definition, it would be the United States, Canada, Western Europe, Australia, and New Zealand. At its widest medieval definition, it includes the following 36 countries:", "Greek language\n\nThe Greek language is an Indo-European language. It is the official language of Greece (Hellas) and Cyprus. It was first spoken in Greece and was also once spoken along the coast of Asia Minor (now a part of Turkey) and in southern Italy. It also used to be widely used in Western Asia and Northern Africa. In Greek, the language is called \"\u0395\u03bb\u03bb\u03b7\u03bd\u03b9\u03ba\u03ac\" (\"ellinik\u00e1\"). Greeks write their language using the Greek alphabet. The Latin alphabet, which used to write English and many other languages, came indirectly from the Greek alphabet by the Etruscan alphabet. Many other alphabets around the world also came from the Greek alphabet. Greek has an unbroken history of being a written language for over 3,000 years. Thats is longer than any other Indo-European language spoken today. Its history is often divided into three parts, Ancient Greek, Medieval Greek, and Modern Greek. Medieval Greek is also called Byzzantine Greek because it was spoken in the Byzantine Empire. Over 13 million people in the world speak Greek as of 2021, mostly live in Greece (almost 11 million) and Cyprus (over 1 million). There are also people in other countries around the world who speak the language, largely because people left Greece and Cyprus and emigrated to other countries. The United States and Australia have a large Greek diaspora.", "Western Europe\n\nWestern Europe is a geographic region of Europe. This term does not have an exact definition. Some definitions include countries like Spain and the United Kingdom, while some don't. Its use has changed over time. During the Middle Ages, the European parts of the Western World included those countries following Catholicism or Protestantism. During the Cold War, \"Western Europe\" was a geographic and socio-political concept. It meant the democratic European countries of the First World, which are also vaguely defined. It was and still is distinguished from Eastern Europe by differences of economics, politics, and religion. At its widest medieval definition, it includes the following 23 countries: Many, such as Norway, are also in Northern Europe or in Central Europe or Southern Europe. Today, the term \"Western Europe\" has to do with geography and with economics. The concept is commonly associated with liberal democracy, socialism and also with the European Union, though that also has some countries of Eastern Europe. Most of the countries in the region share Western culture, and many have economic, and political ties with countries in North and South America and Oceania. In addition, Scandinavia (in Northern Europe) is commonly associated with social democracy and remains fairly neutral throughout international disputes. The Iberian Peninsula, the most western part of Europe is similarly closely linked to the Americas. It is a monotonous area with long and irregular coastlines.", "Western civilization\n\nWestern civilization, western culture or the West is made up of European culturally derived societies (most notably in the Classical Roman heritage, Western Christianity (Catholicism and Protestantism), Democracy and Liberalism). This at least includes Western and Central Europe, English speaking North America, Australia and New Zealand. The identities of places such as Latin America, South Africa, Israel, the Philippines and Singapore are disputed due to those countries being a blend of both western and non western cultures. Despite also being geographically located in Europe, Eastern Europe is generally not seen as part of the Western world for geopolitical and cultural reasons. Until the 17th century, Western civilization was also called Christendom meaning the area where the Christian religion is in the majority (a view held by historian Arnold Toynbee). By this definition, most parts of Africa would now also be part of Western civilization since many Africans have been converted to Christianity since the 1950s. Westernization is the transformation of a non western culture to Western standards, with historical examples being the Romanization of \"barbarian\" Europe in the classical period, the Hispanization of South America, Central America and the Philippines in the 1500s, the Anglicization of North America and Australia in the 1700s, the Francization of North and West Africa in the 1800s and the current Americanization of many first world nations such as Singapore and Israel through Hollywood, pop music, and American popular culture. There are many supporters of westernization, and many who oppose it it expanding at the expense of local cultures.", "Ancient Greek\n\nAncient Greek was an Indo-European language spoken in Ancient Greece from about 1500 BC to about 300 BC. Ancient Greek and Latin are very important languages. Although they are no longer spoken, they influenced almost all modern European languages. Greek had many different dialects. Attic Greek was spoken in Athens, the largest city, and the rest of the region of Attica. It was thought to be the purest form of Greek. Later, in the educated Roman world, children were taught Greek as a second language, just as many people now learn English as their second language. Koine Greek was the common language of Greeks. It was Attic Greek mixed with several other dialects. Homer spoke and wrote in an old dialect that was somewhat different from Attic Greek. The \"Iliad\" and the \"Odyssey\" are long poems that tell exciting stories about warfare, travel and the Greek gods. In the 5th century BC, some great plays were written by Aeschylus, Sophocles and Euripides. The Golden Age of Ancient Greece inspired literature that has been read for centuries. Attic Greek was the dialect that was spoken in Athens and the rest of the region of Attica. It was the dialect most similar to later forms of Greek since it was the standard form of the language. It is studied in Ancient Greek courses because it was the most common dialect. All languages change with time, and Greek has changed a great deal over 2500 years. Modern Greek is often said to have started in 1453 AD after Medieval Greek was spoken. Unlike Latin, Ancient Greek did not split into many languages, but it is still considered to be a separate language from Modern Greek. The pronunciation has changed; for instance, beta was pronounced \"b\" in Ancient Greek, but it is pronounced \"v\" and is called \"vita\" in Modern Greek."], "reference_contexts": ["Science Science is what we do to find out about the natural world. Natural sciences include chemistry, biology, geology, astronomy, and physics. Science uses mathematics and logic, which are sometimes called \"formal sciences\". Natural science makes observations and experiments. Science produces accurate facts, scientific laws and theories. 'Science' also refers to the large amount of knowledge that has been found using this process. Research uses the scientific method. Scientific research uses hypotheses based on ideas or earlier knowledge, which can be categorized through different topics. Then those hypotheses are tested by experiments. People who study and research science and try to find out everything about it are called scientists. Scientists study things by looking at them very carefully, by measuring them, and by doing experiments and tests. Scientists try to explain why things act the way they do, and predict what will happen. Today, \"science\" usually refers to a way of pursuing knowledge, not just the knowledge itself. It is mainly about the phenomena of the material world. The Greek works into Western Europe from the 6th to 7th century B.C. revived \"Philosophy\". In the 17th and 18th centuries scientists increasingly sought to formulate knowledge in terms of \"laws of nature\" such as Newton's laws of motion. And during the 19th century, the word \"science\" became more and more associated with the scientific method itself. It was seen as a way to study the natural world, including physics, chemistry, geology and biology. It was also in the 19th century that the term \"scientist\" was created by William Whewell. He meant it to tell the difference between those who looked for knowledge on nature from those who looked for other types of knowledge. The scientific method is the name given to the methods used by scientists to find knowledge. The main features of the scientific method are: A famous example of science in action was the expedition led by Arthur Eddington to Principe Island in Africa in 1919. He went there to record where the stars were around the Sun during a solar eclipse. The observation of where the stars were shown that the apparent star positions close to the Sun were changed. In effect, the light passing the Sun was pulled towards the Sun by gravitation. This confirmed predictions of gravitational lensing made by Albert Einstein in the general theory of relativity, published in 1915. Eddington's observations were considered to be the first solid proof in favour of Einstein's theory. Discoveries in fundamental science can be world-changing. For example: Not everyone completely agrees about how theories should be used or updated. Some philosophers and scientists say that scientific theories are only accepted for the time being. They last as long as they are the best explanation. When theories no longer explain the data, they are removed and replaced. Or, sometimes scientists will make a theory better rather than remove it, or they will keep on using the theory hoping that it will be made better eventually. Science is a way to get knowledge by getting rid of what is not true. Scientists must be very careful to make explanations that fit well with what they observe and measure. They compete to provide better explanations. An explanation might be interesting or pleasing, but if it does not agree with what other scientists really see and measure, they will try to find a better explanation. Before a scientific article is published, other scientists read the article. They decide whether the explanations make sense from the data. This is called peer review. After articles are published, other scientists will also check to see if the same experiments, observations or tests produce the same data again. Peer review and repeating experiments are the only way to be sure the knowledge is correct. Science makes models of nature, models of our universe, and medicine. There are many different sciences with their own names. However it is not right to say \"science says\" any one thing. Science is a process, not just the facts and rules believed at one time."], "response": "Greek works have had a significant impact on Western Europe, particularly through the influence of Ancient Greek language and literature. Ancient Greek, along with Latin, influenced almost all modern European languages. During the educated Roman world, Greek was taught as a second language, similar to how English is learned today. The literature from Ancient Greece, including works by Homer and playwrights like Aeschylus, Sophocles, and Euripides, has been read for centuries and inspired Western literature [File: wiki_10.txt, Section: Ancient Greek].", "reference": "The Greek works into Western Europe from the 6th to 7th century B.C. revived 'Philosophy'."}
{"user_input": "What is Everipedia?", "retrieved_contexts": ["Bristly millipedes lack armor-like skin, and instead have bristles (small spiky hairs) that protect them from insects, like detaching a bristle when it goes through the body of an ant. They can easily be told apart from centipedes because centipedes move faster, have only have one pair of legs per segment, and eat animals instead of just plants, although a very small amount of millipede species are omnivores, feeding on insects, earthworms, or snails. Scientists who study millipedes are called diplopodologists, and the scientific study (like astronomy or biology) of millipedes is known as diplopodology. A millipede species,\" Pneumodesmus newmani,\" was the first animal species to live constantly on land that lived 428 million years ago. Millipedes are the most common in temperate, wet deciduous forests, but are also often found in coniferous forests and high-altitude alpine environments, some species live in deserts, and even fewer in caves. Many live under stones, fallen leaves, and in woodpiles, plus other dark damp locations in forests. Some species of bristly millipedes have been known to live in the common small cracks of tree bark. Millipedes, due to their herbivore (plant-eating) and, with some species, limited omnivore capabilities, do not bite humans, although some of the defensive liquids that they give out might cause minor irritation and burns on human skin. On the eyes, these can be much worse, and direct exposure can lead to very bad problems. They also appear in various folklore, remedies, and traditional usages around the world.", "Monogenea\n\nMonogenea are a type of flatworm. They are parasites which means that they always need another creature to live on. They live on the outside of their host. Some parasites, like tapeworms, live on the inside of a larger creature. Monogenea are especially common on the skin, fins and gills of fish. Less commonly, they can be found in the urinary bladder and rectum of cold-blooded vertebrates. No types of Monogenea infect birds, but one (\"Oculotrema hippopotami\") infects mammals. It is a parasite in the eye of a hippopotamus. Monogenea are usually hermaphrodites. This means that they have both sexes. First they are males, and only later do they become females as well. They have direct life-cycles with no asexual reproduction (unlike the Digenea). In those types of Monogenea that lay eggs, the young ones grow to a larval stage called an \"oncomiracidium\". It is at the \"larva\" stage that they are able to travel from one host creature to another. When they are adults, Monogenea eat the blood, mucus, and epithelial cells of their host creature."], "reference_contexts": ["Wiki A wiki is a type of website that lets anyone create and change its pages. The word is sometimes used in Internet slang to mean Wikipedia. W\"iki\" is short for WikiWikiWeb. \"Wikiwiki\" is a word from the Hawaiian language, meaning \"fast\" or \"speed\". Examples of wikis include Wikipedia, Everipedia, Citizendium, , Conservapedia, Wiktionary and Wikibooks. Every wiki can be changed, or edited, by anyone who has an account on the wiki, or by everyone in the world if the wiki allows it. Some important pages can only be changed by certain users. Wikis are central places where we all can share information, people can add new information, and then people read them. Wikis allow information from all around the world to be collected. On a wiki, people can write pages by collaboration. Pages are watched closely to see whether changes are good or bad. If one person writes something wrong, another can correct it. Other users can also add something new to the page. Because of this, the page gets better when people change it. Administrators can block someone from editing if they vandalize, or for other reasons. Users can also discuss things on wikis. Discussion can help people understand things better and get a chance to tell their views. In Wikipedia the talk pages are for that, but in some wikis, the article and the discussion are in the same page. Wikis can be used for different things; not all wikis follow the same rules for using them. For example, the purpose of Wikipedia is to write articles for an encyclopedia. That is why on Wikipedia, people do not want general discussion that does not help in writing articles. Ward Cunningham started the first wiki in March 1995. Many people liked it, and wrote there, after which they started similar websites such as Wikipedia. MediaWiki is the most used software for wikis and is the software used for Wikipedia and many other Wikis. JSPWiki is one of many others. \"Wiki\" is also sometimes an abbreviation for Wikipedia. Most wikis can be edited by anyone and everyone. Some wikis are even available to people without an account, so sometimes wikis will become a target for vandals to add unwelcome, disruptive or even misleading content. There are many ways to prevent this. Individual pages can be protected to allow only certain users, or only those with an account, to edit them. Administrators can also block users who make repeated Vandal edits after a minimum of a single warning. Vandalism may not be stopped totally, but regular, careful checking can limit the amount of disruptive edits. by a complement. These verbs are called linking verbs or copula. In the following examples, the complement is underlined and the verb is in bold. Verbs can be modified by various modifiers, mainly adverbs. Note that verbs generally do not need modifiers; it's usually a choice. In the following examples, the adverb is underlined and the verb is in bold. Verbs also commonly take a variety of other modifiers including prepositions. Sometimes a verb and another word can have the same shape. In these cases you can usually see the difference by looking at various properties of the words. Sometimes a verb and an adjective can have the same shape. Usually this happens with participles. For example, the present participle \"interesting\" and the adjective \"interesting\" look the same. Verbs are different from adjectives, though, because they cannot be modified by \"very\", \"more\", or \"most\". For example, you can say \"That is very interesting,\" so you know interesting is an adjective here. But you cannot say \"My teacher is very interesting me in math\" because in this sentence \"interesting\" is a verb. On the other hand, if you cannot change the 'be' verb to 'seem' or 'become', it is probably a verb. The gerund-particle sometimes looks like a noun. This is especially true when it is used as a subject, as in the following example: The main differences between these verbs and nouns are: modifiers, number, and object/complement Verbs cannot generally be modified by adjectives and nouns cannot generally be modified by adverbs. So, in \"Running regularly is good for you\", \"running\" is a verb because it is modified by \"regularly\", an adverb. Verbs cannot change for number, so if you can make the word plural, it is a noun, not a verb. For example, \"this drawing is nice\" can change to \"these drawings are nice\", so \"drawing\" is a noun. But \"drawing trees is fun\" cannot change to \"drawings trees is fun\", so it is a verb here. Many verbs can take objects or complements, but nouns cannot. So, in \"parking the car is hard\", \"parking\" is a verb because it takes the object \"the car\". But, if you say, \"there's no parking\", parking may be a noun because it does not have an object. Some verbs have become prepositions. Again, usually these share a shape with participles. Here are some examples: The main difference between verbs and prepositions is that verbs have a subject. Even if the subject is not written, you can understand what it is. Prepositions do not have a subject."], "response": "My knowledge base does not provide information for this query.", "reference": "Everipedia is an example of a wiki, which is a type of website that allows anyone to create and change its pages."}
{"user_input": "Yiddish is used in United States?", "retrieved_contexts": ["Yiddish\n\nYiddish is a language used by some Jews. At first, it was a dialect of German that Jews began to use in Europe about 1000 years ago. It was and still is used in the United States, especially in New York City, and other countries that now have Jews. Most Yiddish words come from German, but many words are also from Hebrew and Slavic languages, especially Polish, and some from French, Hungarian and Latin. Yiddish is written usually by the Hebrew alphabet. In the world, Yiddish is spoken by about 3 million people, mainly Hasidic Jews. In the Netherlands and Sweden, Yiddish is protected by the European Charter for Regional or Minority Languages.", "The perfect is something like the past tense. Mishnaic Hebrew was spoken as well as Judeo-Aramaic at the time of Jesus and at the time of the Bar-Kokhba revolt (2nd century AD) until the Byzantine Empire of Justinian (6th century AD). The Hebrew alphabet has been adapted to write Yiddish, another Jewish language. However, Yiddish is different from Hebrew because Yiddish comes from a mix of German, Hebrew, and other languages. The Hebrew alphabet has 22 letters. Five of them change when they are at the end of a word. Hebrew is read and written from right to left. The first three letters, aleph, beth and gimel, are also used in mathematics in the context of transfinite numbers. The Hebrew alphabet is an \"abjad\" and so only the consonants are written, and readers must supply the vowels. Since that can be difficult, the vowels can be marked as dots called \u201cnikkud\u201d or \u201ctnuah\u201d (plural \u201dnikkud\u201d signs and \u201ctnuot\u201d respectively.) In Modern Hebrew, some letters can denote vowels, which are called \"matres lectionis\" (mothers of the reading) since they greatly help reading. Vav (or Waw) can make the 'oo' sound (/u/ in IPA) like in food. Yodh (or Yud) can make the 'ee' sound (/i/ in IPA) like in feed.", "Jews from the Middle East, the Caucasus, and Central Asia are called Mizrahi Jews. There are also Ethiopian Jews, Indian Jews (Bene Israel) and Chinese Jews (Kaifeng Jews). Many of these groups have moved from one place to another. For example, many Ashkenazi Jews live in the United States, and many Sephardic and Mizrahi Jews live in France. Jews speak the languages of the countries where they live. Hebrew is the language of Judaism because it is the language in which the Bible was written. It is still used for prayers. In Israel, Ivrit, which is the name for the new Hebrew language, is the common language. There are also other Jewish languages such as Yiddish and Ladino which are still spoken and written by some Jews. The Jewish scriptures say that Judaism began with a man named \"Abram\" who lived in the city of Ur, in present-day Iraq. According to the Midrash, Abram strongly believed that the people in Ur were wrong to pray to different gods and statues. He believed that there was really only one god who was not a statue. The Torah tells that God spoke to Abram and told him to leave Ur with his family and move to Canaan, where he started a new religion. God told him that his name would be changed to Abraham. The Midrash also says that angels taught Abraham a new holy language, which Jews believe is the language today known as Hebrew. Hebrew continues to be the language of Judaism. Abraham's grandson Jacob is said to be the one who first had the name of \"Israel\". When the Jews were turned into slaves in Egypt, God told Moses to ask for the 12 tribes of Israel to be freed.", "However, many states of the United States and some other countries use it. In the United States, less violent ways of execution are used than in the past. Here are some ways of executing people:", "American (word)\n\nThe word American is used to mean a person or a thing from the United States or any country in the Americas - North America, Central America, and South America. In English, the most common use of this word is to mean a person or a thing from the United States. Even though the islands in the Caribbean Sea are close to the Americas, people who speak English do not usually use the word \"American\" for people or things from these islands. Due to the ambiguity of the word, some languages avoid using the word to refer to someone and/or thing from the United States and use more specific demonyms instead, such as Spanish \"estadounidense\", Esperanto \"usonano\", Finnish \"yhdysvaltalainen\" and German \"US-Amerikaner\", for example. Yankee is sometimes used within the English language too (though the word historically refers specifically to an inhabitant of New England). \"Usonian\" (from Usonia) is an alternative demonym to \"American\" proposed by architect Frank Lloyd Wright. A Native American is someone who is mostly descended from the people who lived in the Americas before the Europeans arrived. Native Americans are also called First Nations and \"Indians\". There is no language \"American.\" Some important languages used in the Americas are English, French, Portuguese, and Spanish. Some people still use Native American languages. Quechua is the largest."], "reference_contexts": ["Yiddish Yiddish is a language used by some Jews. At first, it was a dialect of German that Jews began to use in Europe about 1000 years ago. It was and still is used in the United States, especially in New York City, and other countries that now have Jews. Most Yiddish words come from German, but many words are also from Hebrew and Slavic languages, especially Polish, and some from French, Hungarian and Latin. Yiddish is written usually by the Hebrew alphabet. In the world, Yiddish is spoken by about 3 million people, mainly Hasidic Jews. In the Netherlands and Sweden, Yiddish is protected by the European Charter for Regional or Minority Languages."], "response": "Yes, Yiddish is used in the United States, especially in New York City [File: wiki_01.txt, Section: Yiddish].", "reference": "Yes, Yiddish is used in the United States, especially in New York City."}
{"user_input": "Wut are the countries in Scandinavia that are not republics?", "retrieved_contexts": ["Nordic countries\n\nNordic countries are a group of countries in Northern Europe. These countries include Denmark, Finland, Iceland, Sweden, Norway, and the territories of Greenland, Svalbard, the \u00c5land Islands and the Faroe Islands. Though often confused as such, Scandinavia is not equivalent to the Nordic countries. Scandinavia is a peninsula while the Nordic countries are recognized states. Sweden and Norway (and a small part of Finland) rest on the Scandinavian peninsula. Scandinavia and Finland together belong to a larger peninsula, Fennoscandia. Finns speak a non-Germanic language. Nordic countries have similar state, law and culture. Historically, Nordic countries have maintained close connections. Nordic countries are primarily socialist democracies and welfare states. Nordic countries have some political co-operation, such as the Nordic council. Cooperation with a larger group, the European Union, makes the Nordic cooperation even smaller. Nordic countries have long, cold winters with warm days in the summer, but only a small part of Northern Norway and approximately half of Iceland is arctic, although Iceland lies below the Arctic Circle except for one small island.", "Republic\n\nA republic is a form of government that has no monarchy and no hereditary aristocracy. It originates from Rome. In 509 BC, the Romans overthrew the Roman Kingdom and established a republic, a government in which citizens elected representatives to rule on their behalf. National sovereignty lies in the authority of the government, not in an emperor or monarch. The word \"republic\" comes from the Latin words res publica, meaning a \"public thing\". For example, the United States and India are republics. However, the United Kingdom and Canada are not republics since they have a monarch (King Charles III in both cases) Countries with a king or other monarch and free elections is called a constitutional monarchy, not republics. A constitutional monarchy resembles a republic because the constitution has been amended to remove power from the monarch and install institutions conforming to a philosophy of republicanism. That includes the United Kingdom and the other Commonwealth realms, the Netherlands, Thailand, and countries in Scandinavia and elsewhere. What makes a republic different is that its laws are made and enforced without royal authority. The head of state in a republic is generally a person who has been chosen by the citizens by direct election or by a group of elected representatives to act as the top representative of the people. In most republics, the head of state is called the president. In some countries, the president is elected and has a lot of political power. In others, the president does not hold much direct power but is important in the legal system for other reasons. Sometimes, state is called a \"republic\" when its head is not called a \"king\". For example, the Roman Empire had an \"emperor\" and the Dutch Republic had a \"stadholder\", but they worked as hereditary monarchs.", "Scandinavia\n\nScandinavia is a group of countries in northern Europe. Scandinavia has Denmark, Norway, and Sweden. Some people also think Finland is part of Scandinavia and that Iceland and the Faroe Islands should count. Most of the time, \"Scandinavia\" is used to mean places where people speak Scandinavian languages, also called North Germanic languages or Nordic. The Scandinavian languages (Swedish, Norwegian, Danish, Icelandic, and Faroese) are very similar to each other, and many Scandinavians understand parts of the other languages because they are alike. Finnish is not part of the North Germanic language group. What people mean when they say \"Scandinavia\" depends on what they think is important at the time. When people talk about about maps, natural land formations and how the economy works, they may say Finland is part of Scandinavia but Iceland is not. When people talk about history and what languages people speak, they say Iceland is part of Scandinavia but Finland is not. The Scandinavian Peninsula is a large peninsula reaching west from northern Europe over the north side of the Baltic Sea. Norway, Sweden and some of Finland are on this peninsula. However, Denmark is considered part of Scandinavia in the ethnic sense more often than Finland is. This is because Danish is a Scandinavian language but Finnish is not. \"Nordic countries\" include Norway, Sweden, Denmark (including the Faroe Islands), Finland, and Iceland. These five countries use the Nordic Council to work together on political and cultural activities. Denmark, Sweden, and Finland are also members of the European Union, but only Finland is part of the eurozone, meaning that it uses the Euro as its money. The other Nordic countries still use their own money, called \"krone\" or \"krona\" (from the word \"crowns\").", "Baltic states\n\nThe Baltic states are three countries in Northern Europe to the east of the Baltic Sea and the south of the Gulf of Finland. They are, from north to south, Estonia, Latvia and Lithuania. The languages that are spoken in these countries are different: while Lithuanians and Latvians speak Baltic languages (Latvian and Lithuanian), Estonians speak an Uralic language (Estonian). By their culture and history, the Baltic countries are close to the Nordic countries. The biggest difference in the history was that the Baltic countries incorporated to the Soviet Union in 1940 (during the Second World War), but not the Nordic countries (with the exception of Karelia, a part of Finland which later joined the Russian SFSR). The three countries would become republics of the Soviet Union as the Estonian SSR, Latvian SSR, and Lithuanian SSR. All three Baltic states had their freedom back in 1991, when the Soviet Union came to an end. However, the states all consider the Soviet occupation to be illegal, which has been supported by the United States, European Union, and United Nations. Today, the Baltic countries are some of the richest and most advanced countries which were part of the Soviet Union. They became members of the European Union and NATO in 2004, joined the Schengen Area in 2007, and became part of the eurozone by 2015. Paganism was the religion of Baltic people before most of them took Christianity during the Middle Ages. Baltic paganism never died out and some people are still pagans.", "The other Nordic countries still use their own money, called \"krone\" or \"krona\" (from the word \"crowns\"). Norway and Iceland, which are not members of the EU, are members of NATO and the European Free Trade Association (EFTA). Only Denmark and Finland are members of both the EU and NATO. Most of the Scandinavian Peninsula has only a few people in it. It has large forests of pine, birch, and spruce trees. The western and northern parts are mountainous. The Scandinavian mountains are some of the oldest in the world. The tallest mountain is Galdh\u00f8piggen in Norway. Denmark (43,098\u00a0km) is the smallest of the Scandinavian countries. It is more densely populated, and most of the land is farmland. Sweden (449,964\u00a0km) is the largest of the Scandinavian countries. It has the most lakes, and the landscape ranges from plains in the south to mountains in the west (along the border with Norway) to tundra in the north. The far north of Scandinavia and Finland is called Lapland, where the S\u00e1mi live. Some of them still herd reindeer, but most Sami live in modern houses and have modern jobs, like other Scandinavians. The most famous group of Scandinavians were the Vikings of the Middle Ages. The Vikings attacked and raided but they were also traders, traveling to Ukraine and starting trade routes to the Middle East. Vikings from Norway were explorers, crossing the North Atlantic in their longships. They came to Iceland and Greenland and built towns and farms there. The Norwegian explorers also came to the east coast of Canada. They built at least one town there, but it did not last into modern times. The Vikings from Denmark came to England, where they affected the history and politics and the English language.", "Denmark is the smallest of the Scandinavian countries. The neighbours are Germany (to the south), Sweden (to the east), Norway (to the north) and the United Kingdom (to the west). The country is surrounded by the sea except for Jutland (\"Jylland\"), the largest part of Denmark. It is connected to Germany by land. To the south-east there is the Baltic Sea, to the west the North Sea, to the north the Skagerrak and to the north-east the Kattegat. The western part of Denmark is the peninsula of Jutland (, pronounced \"yoo\u00b4-land\"), bordering Germany. This is the only part of Denmark that is not an island. The rest of Denmark includes 76 islands people live on, and many tiny islands. The largest islands are Zealand (\"Sj\u00e6lland\"), and Funen (\"Fyn\"). To the east is the island of Bornholm in the Baltic Sea, the only place in Denmark where the bedrock can be seen. The country is quite flat. The highest hill or mountain is M\u00f8lleh\u00f8j, which is 170.86\u00a0metres (560.56\u00a0ft) tall. There are many small hills, lakes, creeks, forests and farmland. Denmark's shore line covers 7,314\u00a0km (4,545\u00a0mi). Nobody in Denmark lives more than 60\u00a0km from the coast. The longest river in Denmark is the Guden\u00e5. The weather in Denmark is quite windy and rainy. In the winter, it does not get very cold; in most years, there are only a few weeks of snow. Every ten years or so, the sea around the islands freezes over, but in most winters, it does not. The climate and topography are not good for winter sports.", "Sweden\n\nSweden () is a Nordic country in the part of Europe called Scandinavia. Its neighbors are Finland and Norway. Sweden is also connected to Denmark in the south by a bridge. It is a developed country. It is famous for its welfare state. People who live in Sweden are called Swedes. The population of Sweden is about 10 million people. Sweden's capital city is Stockholm, which is also Sweden's largest city, with almost one million people. Other large cities are Gothenburg and Malm\u00f6. These cities are all in the southern half of the country, where it is not as cold as in the north. Swedes drink filmj\u00f6lk, it is a traditional fermented milk product from Sweden. It is made by fermenting cow's milk. Gl\u00f6gg, is spiced mulled wine which people drink around Christmas. It normally contains red wine, sugar, orange peel, and spices. Swedes eat yellow pea soup with pork (or pork sausages) along with mustard. Sweden is a constitutional monarchy because it has a king, Carl XVI Gustaf, but he does not have any real power. Sweden is a parliamentary state meaning that the government is elected by the parliament which is appointed by the people. The country is democratically ruled by a government headed by an elected prime minister. Ulf Kristersson was elected Prime Minister in September 2022. He took office in October 2022. Sweden has an official majority language, Swedish (the Swedish word for the language is \"svenska\"). Sweden has five official minority languages: Finnish, Yiddish, Sami, Me\u00e4nkieli, and Romani. Sweden became a member of the European Union (EU) on 1 January 1995. Unlike most countries in the European Union, Sweden is not a member of the Eurozone and has not begun to use the euro as currency.", "Denmark\n\nDenmark (), officially named the Kingdom of Denmark, is a Nordic country in Northern Europe. It is the furthest south of the Scandinavian countries, to the south of Norway and south-west of Sweden (which it is connected to by a bridge). It has a south border with Germany. It borders both the North Sea to the west and the Baltic Sea to the east. Denmark is a developed country with a large welfare state; In 2006 and 2007, surveys ranked Denmark as \"the happiest place in the world,\" based on standards of health, welfare, and education. The origin of the name Denmark () is uncertain. In Old Norse, the country was called Danm\u01ebrk, referring to the Danish March (the marches of the Danes). The capital city of Denmark is Copenhagen, on the island of Zealand. Denmark is a constitutional monarchy (meaning the head of state is a monarch who has few established powers) with a King, Frederik X. Denmark is a parliamentary state, meaning the people appoint a parliament to make decisions for them, and it has a democratic government headed by an elected Prime Minister, who currently is Mette Frederiksen since 2019. Denmark was first united in the 10th century, during the Viking period, by king Harald Bluetooth (), who first converted Denmark to Christianity. The Vikings are well known for invading countries. In the 11th century, the Danish Vikings controlled England (the Danelaw) for a while. In 1397 Denmark, Sweden and Norway became a single country with one queen (this country was called the \"Kalmar Union\") Sweden became a separate country again in 1523. Denmark and Norway (called \"Denmark-Norway)\" stayed united, until 1814. Denmark-Norway controlled many islands in the Atlantic Ocean, including the Faroe Islands, Iceland and Greenland.", "Island country\n\nAn island country (also sometimes called island nation or borderless country) is a country that is made up only of islands. They are not connected by land to any other nation. Each island only belongs to that country, so there are no borders. Examples of borderless countries are Iceland, Japan and Madagascar. Many island nations get money from fishing. There are at least 51 island countries in the world, and there are countries that only consist of an island, such as Iceland or Nauru, an archipelago, such as Federated States of Micronesia or Palau, or form part of a larger island, such as Haiti or the Dominican Republic. This list also includes Australia, though a continent, and the 2 constituyent countries of the Kingdom of Denmark (The Faroe Islands and Greenland) Australia is a continent but an island. The Faroe Islands and Greenland are constituent countries within the Kingdom of Denmark.", "In other republics (such as India, Israel or the Republic of Ireland), to be president is more of an honor or a symbol, and the position has no real power. The real power in such republics is held by the prime minister, who is the head of government. In this kind of republics, the president is only the head of state, and are called parliamentary republics. In some republics (such as France or Russia) both the president as the head of state, and the prime minister as the head of government, run the day-to-day affairs of the state, but often the president has more powers than the prime minister. Such republics are called semi-presidential republics. Most monarchies that have a king or queen as their monarch and head of state, have no president, but very few monarchies, such as the United Arab Emirates has a president who is the head of state, who by custom (but not by law) is always the emir (monarch) of Abu Dhabi, which is \"de facto\" hereditary. The American President is restricted by the written United States Constitution, which was written to make sure that the American executive never became as powerful as in the British system. The British Prime Minister is part of both the Legislature and Executive, whereas the American President is the head of the Executive. The American governmental system shows a clear separation of powers unlike the British system. So despite having a large nuclear arsenal, the American president can not carry out policy and introduce legislation as freely as the British prime minister.", "Danes pay high taxes to fund welfare. In geography, \"Denmark\" is the land in northern Europe, where the Danes live. In the political sense, the \"Kingdom of Denmark\" is the area which the Danish Monarch rules over. The Kingdom of Denmark includes Denmark and also includes the Faroe Islands in the Atlantic Ocean, and Greenland in North America. All three parts of the kingdom have different languages and culture. The Faroe Islands and Greenland are often considered to be separate countries but Denmark holds their sovereignty. Denmark is divided into five regions (Danish: \"regioner\" or \"region\" for one). The regions replaced the former counties (\"amter\") in January 2007. The regions are in charge of hospitals and health care. The regions are then subdivided into municipalities (). There are currently 98 municipalities, but before January 2007 there were 275. The number of municipalities was decreased when it was decided that, to become more efficient, each should have a population of at least 20,000 . The biggest part (90.5%) of Denmark's population of just under 5.4 million is of Danish descent, according to 2009 statistics. Of the rest 8.9% who are immigrants or descendent from recent immigrants, many come from South Asia or the Middle East. There are also small groups of Inuit from Greenland and Faroese. Minorities in Denmark include Turks, Poles, Syrians, Germans, Iraqis, Romanians and people from former Yugoslavia. There are also other Asian and African populations in the country. Small numbers of Roma and Hungarians live in Denmark. There is also a small Jewish population. The Danes speak the national language, Danish, which is very similar to the other Scandinavian languages. Swedish and Norwegian are so close to Danish that most Danes understand them.", "Norway\n\nNorway is a country in the north of Europe. It is the western part of the Scandinavian peninsula. The mainland of Norway is surrounded by the North Sea and Atlantic Ocean on the west side, and borders Russia, Finland, and Sweden to the east. The southern coast touches the Oslofjord, Skagerrak, and the North Sea. The Monarchy of Norway has been independent since 1814. Its head of state is a king - Harald the 5th (as of 2022). The national day is May 17, which celebrates Norway's constitution of 1814. The parliament is called \"Stortinget\" and its members are elected by the people every 4 years. About 5 million people live in Norway. The capital is the city of Oslo. Norwegian is the national language. There are two official written versions of Norwegian called \"Bokm\u00e5l\" and \"Nynorsk\". The Northern Sami language is spoken by around 90% of those who speak one of Norway's 3 Sami languages. Northern Sami is also an official language in a number of municipalities. The battle of Hafrsfjord (872 A.D.) resulted in small kingdoms becoming one larger kingdom, ruled by Harald Fairhair. After the king's death, again there were smaller kingdoms, inside Norway. Stockfish (or fish that has been freeze-dried, outside in cold weather) has been traded and exported; this happened as early as either the 9th century, 10th century, or 11th century until 1066. Other sources say that the exporting was happening as early as the 12th century; stockfish is one of the country's oldest [type of] things to be sold for export. In 1349 half of the Norwegian people died, getting sick from the bubonic plague (or Black Death).", "Some presidents are both the head of state and head of government, such as the President of the United States. In other countries, such as the Republic of Ireland, the President has a ceremonial role while the Prime Minister is the leader of the government. In France, the President and Prime Minister both share executive powers. A president could also be the title of the head of a large business, company or organization. Many republics have direct elections by citizens to elect a president. But some other republics do not. The President of the United States is elected by the electoral college. Some other republics choose a president this way. In some other republics, the parliament elects a president. Countries that have a monarch as leader, are called monarchies. Some countries have neither a president or a monarch as leader, such as the Vatican City which is ruled by a religious leader called a Pope. Companies also have presidents. They are elected by the people who own part of the company. In some companies, the people who are workers for the company elect (vote for) their company president. The president of a country is not the same thing as a prime minister. A prime minister is part of a parliament, but a president is not. In some countries, (such as the United States or France), the president has more power and responsibility than anyone else. Such a president is often called the nation's chief executive. As chief executive, the president must take an active role in all phases of government. The republics where the president is both the head of state and head of government (and there is no prime minister) are called a presidential republics. In other republics (such as India, Israel or the Republic of Ireland), to be president is more of an honor or a symbol, and the position has no real power."], "reference_contexts": ["Republic A republic is a form of government that has no monarchy and no hereditary aristocracy. It originates from Rome. In 509 BC, the Romans overthrew the Roman Kingdom and established a republic, a government in which citizens elected representatives to rule on their behalf. National sovereignty lies in the authority of the government, not in an emperor or monarch. The word \"republic\" comes from the Latin words res publica, meaning a \"public thing\". For example, the United States and India are republics. However, the United Kingdom and Canada are not republics since they have a monarch (King Charles III in both cases) Countries with a king or other monarch and free elections is called a constitutional monarchy, not republics. A constitutional monarchy resembles a republic because the constitution has been amended to remove power from the monarch and install institutions conforming to a philosophy of republicanism. That includes the United Kingdom and the other Commonwealth realms, the Netherlands, Thailand, and countries in Scandinavia and elsewhere. What makes a republic different is that its laws are made and enforced without royal authority. The head of state in a republic is generally a person who has been chosen by the citizens by direct election or by a group of elected representatives to act as the top representative of the people. In most republics, the head of state is called the president. In some countries, the president is elected and has a lot of political power. In others, the president does not hold much direct power but is important in the legal system for other reasons. Sometimes, state is called a \"republic\" when its head is not called a \"king\". For example, the Roman Empire had an \"emperor\" and the Dutch Republic had a \"stadholder\", but they worked as hereditary monarchs. Licchavi, in India, was an aristocratic state in the 6th and 5th centuries BCE and is nowadays sometimes called the first republic. The earliest republics that were much imitated later were Greek cities, for example democracy in Athens. The biggest difference from the other city-states was that people chose their leaders by voting or by lottery. Several Italian city-states during the Renaissance were ruled by a small group of aristocrats, and were called republics. Bridge A bridge is a structure to cross an open space or gap. Bridges are mostly made for crossing rivers, valleys, or roads. Nowadays most big bridges are made to carry vehicles but people have also walked across bridges for thousands of years. Bridges called highway overpasses carry a road over another road. Military bridges are portable, so that they may be easily moved to where they are needed. This makes them much more complex than most civilian bridges. The first man-made bridges were probably made from cut wood or stones. Some stone bridges have lasted thousands of years. In recent centuries large bridges are made mostly of steel. They do not last as long. Many bridges are in a state of disrepair. There are five major structural types of bridges:"], "response": "The countries in Scandinavia that are not republics are Denmark, Norway, and Sweden. These countries are constitutional monarchies, meaning they have a monarch as the head of state but also have democratic systems of government [File: wiki_03.txt, Section: Republic].", "reference": "Countries in Scandinavia that are not republics include those with a king or other monarch and free elections, which are classified as constitutional monarchies."}
{"user_input": "What is significant about Christchurch in New Zealand?", "retrieved_contexts": ["Christchurch\n\nChristchurch is the largest city in the South Island of New Zealand and the third largest urban area in the country. Christchurch is located on the South Island\u2019s east coast. The population is approximately 376,700 (2010). The name \u2018Christchurch\u2019 was decided upon at the first meeting of the Canterbury Association (made up of settlers of the surrounding province of Canterbury) on March 27, 1848. The city\u2019s name came from the Christ Church, Oxford College and was suggested by John Robert Godley, who attended the college. Earlier, the name of the town was Christ Church. On July 31, 1856, Christchurch became a city by Royal Charter and is officially the oldest established city in New Zealand. Original settlers of the Christchurch region were Moa Hunters. These settlers hunted the moa out of existence by about the year 1500. The hunters cleared large areas of Mata\u012b and T\u014dtara forests by fire, changing the landscape. The M\u0101ori people (Ng\u0101ti M\u0101moe and later Ng\u0101i Tahu) arrived in Canterbury between 1500 and 1700. The Moa Hunters were either killed or adopted by tribes. On February 16, 1770, Captain James Cook was the first European to see the Canterbury peninsula from his ship the Endeavour. Thinking it was an island, he named it Banks Island after the ship\u2019s botanist, Joseph Banks. It was not until around 1815 when European sailors from the sealing ship, Governor Bligh, landed and set foot on Banks Peninsula. During the 1820s the local M\u0101ori population fell due to fighting between different groups of Ng\u0101i Tahu and raids by the Ng\u0101ti Toa chief Te Rauparaha from 1830 to 1832. The impact of European diseases, especially measles and influenza only increased the death toll of the M\u0101ori people. The M\u0101ori tribes fought each other to near disappearance in the Christchurch region.", "The most common wind is a northeasterly sea breeze, but the city is famous for Nor'westers, hot dry, dusty winds which blow across the plains. Burnside High School is in Christchurch. Largest school in New Zealand with 2,506 students enrolled. Cashmere High School at Rose Street is the second largest co-educational secondary school. Recently, Papanui High School has grown rapidly and is almost the same size. Then there is Riccarton High School that was one of the first state schools in the country to adopt a strong values base \u2013 the Riccarton Way. There are several single-sex schools as follows: Shirley Boys\u2019 High School, Christchurch Boys\u2019 High School, Avonside Girls\u2019 High School and Christchurch Girls\u2019 High School. Christchurch is also well known for several very traditional schools of the English public school type as follows: St. Thomas of Canterbury College, St. Margaret\u2019s College, Christ\u2019s College, St. Bede\u2019s College, Mariam College, St. Andrew\u2019s College, Villa Maria College and Rangi Ruru Girls\u2019 School. There are also less conventional schools such as Unlimited Paenga Tawhiti and Hagley Community College. Tertiary educational institutes include:", "This water comes from the Southern Alps via aquifers. A two-hour drive by car includes the many highlights from Christchurch International Airport. One can enjoy skiing, golf, bungee jumping, white-water rafting, mountain biking, windsurfing, whale watching and a variety of other activities including the winery garden circulation. Christchurch has earned the pet name of \u201cthe garden city\u201d with the southern island. Central city The Cathedral Square is located right in the center of the city. The city center was damaged by the earthquake of February, 2011. The area around this square, within the 'four avenues' of Christchurch, was the central business district of the city. There were a number of residential areas within the central city including Inner City East, Inner City West, Avon Loop, Moa Neighbourhood and Victoria. Cathedral Square is located at the crossing of two famous, major central streets, Colombo Street and Worcester Street, both of which are currently cordoned off as you approach the square. Attractions such as the Wizard of New Zealand, Ian Brackenbury Channell, and evangelist Ray Comfort were hosted at the Cathedral Square until the earthquake in February, 2011. They also held market days, free standing food and coffee carts, an aquarium, pubs, restaurants and the city's chief tourist information centre. The City Mall was refurbished in 2008 & 09 before the earthquake of February 2011. The mall had specially designed seating, flower and garden boxes, more trees, paving, and an extension to the central city tram route. Now all that lies there is The Bridge of Remembrance commemorating war dead stands at the western end of the mall. \"A City for People Action Plan\u201d was released in 2010 by the Christchurch City Council.", "The M\u0101ori tribes fought each other to near disappearance in the Christchurch region. European pilgrims began settling the area in the 1800s. In 1839, the New Zealand Company was established in London. In current history, people started immigrating from Europe to New Zealand during this time. In May 1840, Major Thomas Bunbury arrived on a ship, the HMS Herald, to collect signatures from the Ng\u0101i Tahu chiefs for the Treaty of Waitangi. The Treaty had been signed by many North Island chiefs in the Bay of Islands earlier in the year on 6 February, 1840. During Bunbury\u2019s visit, only two of the Ng\u0101i Tahu chiefs signed it. After this treaty was signed, the colony became in direct control of the UK. The settlement by the British began in 1850. Christchurch was born by a royal warrant of the British King as the oldest city in New Zealand on July 31, 1856. A building of Neo-Gothic architecture was designed and constructed by Benjamin Mount Fort in the city center. The suburb of Hei Hei was subdivided for poultry farming after WWI for returning serviceman, but the venture failed due to the poor soil conditions. In 1947, New Zealand's a major fire occurred at Ballantyne's Department Store in the inner city. 41 people died in a blaze which razed the rambling collection of buildings. Mass shootings occurred at two mosques on 15 March 2019. Christchurch is in Canterbury. It is the largest city in the South Island. The Pacific Ocean lines its east coast and south coast. The Southern Alps act as a border on the west coast. The Waimakariri River creates a natural northern border. The purest and cleanest water can be found in Christchurch. This water comes from the Southern Alps via aquifers.", "\"A City for People Action Plan\u201d was released in 2010 by the Christchurch City Council. This program of work is planned through the year 2022 to improve public spaces within the central city to entice more inner city residents and visitors. To increase the comfort of pedestrians, a plan was put into action to reduce the impact of motorized private vehicles. The renowned Danish design firm, Gehl Architects prepared this report. Wellington architect Ian Athfield has since been selected to re-plan and help rebuild since the February, 2011 Christchurch earthquake. The main mode of public transportation in the city is by bus. The bus system operates throughout the city. Also, there is a free shuttle bus going around the city center. A railroad station exists southwest, around 4\u00a0km from the inner-city, but it is not for citizens. It is used for freight and sightseeing exclusively. Agriculture is the main industry that is carried out over the Canterbury plains. The main crops grown are wheat, barley, various strains of clover and other grasses for seed exporting. Besides growing these crops, it also created various processing and distribution businesses in Christchurch. In recent years, agriculture has expanded to the wine industry and olive production and processing. Deer farming has led to new processing using antlers for Asian medicine and aphrodisiacs. Also, dairy farming and raising stock are also carried out on the flourishing Canterbury plains. Other industries include manufacturing, real estate and wholesale business. In more recent years, sightseeing and tourism have become prosperous, led by tourists from Europe, Asia, and North America. Christchurch has moderate rainfall year-round. It has warm summers and cool winters. The most common wind is a northeasterly sea breeze, but the city is famous for Nor'westers, hot dry, dusty winds which blow across the plains.", "The North Island is smaller than the South Island, but most people (more than 3 million) live there. This might be because the North Island is usually warmer, and has more big cities. About half of the people in New Zealand are religious. As of the 2018 census, 48.2% had no religion. The main religion in New Zealand is Christianity. Just over 2 million New Zealanders are Christian. The second most common religion is Hinduism, with 2.6%. Most New Zealanders live in urban areas, with the other 27% living in small towns or farming communities. Wellington is the capital of New Zealand. Auckland is the largest city, with around 1 million people. Other cities in the North Island include Hamilton, Tauranga, Napier/Hastings, New Plymouth, Whanganui, and Palmerston North. South Island cities include Christchurch, Dunedin, Nelson, Invercargill and Timaru. New Zealand sits at the boundary between the Australian and Pacific continental plates. When these two plates bumped into each other ('collided'), the Pacific plate moved under the Australian plate, north of the South Island. As a result, there has been lots of volcanic activity. South of the South Island, the Australian plate moves under the Pacific plate instead. The plates slide past each other in the South Island, where they have pushed up the Southern Alps. Because of these two colliding plates, New Zealand often has earthquakes. One of the best known is the 2010-2011 group of earthquakes that hit the Christchurch area. The diagram shows that the North Island is on the Australian plate, but most of the South Island is on the Pacific plate. New Zealand is still geologically active, and will remain so as long as the islands are sitting above the plate boundary.", "Both of these cities are on the North Island. The largest city on the South Island is Christchurch. The official languages are English, M\u0101ori and New Zealand sign language. English has never been granted official language status in the NZ laws, but it is used as a default official language due to its wide usage. In 2010, a newspaper in NZ said that New Zealand was the 8th happiest country in the world. In the M\u0101ori language, the country is called Aotearoa, which means \"Land of the Long White Cloud\". \"Ao\" means \u201ccloud\u201d, \"tea\" means \u201cwhite\u201d, and \"roa\" means \u201clong\u201d. The name \"New Zealand\" comes from \u201cZeeland\u201d (which translates to \"Sealand\") in Dutch, after the islands were seen by Dutch explorer Abel Tasman. Zeeland is a province of the Netherlands. New Zealand is a constitutional monarchy and parliamentary democracy. The head of state is Charles III. The Prime Minister is Chris Hipkins, leader of the Labour Party. New Zealand has made itself a \"Nuclear Free Zone\": They do not use nuclear power and do not allow nuclear weapons or nuclear powered vessels in their territory. Elections are held every 3 years. As of the 2018 census, 4,699,755 people lived in New Zealand. Most of them have European ancestors. The indigenous people of New Zealand, the M\u0101ori, have a population of 775,836, or 16.5%. The people of New Zealand often call themselves Kiwis. This name is derived from the kiwi, a flightless native bird that is considered the country's national bird. The North Island is smaller than the South Island, but most people (more than 3 million) live there.", "Christchurch, Dorset\n\nChristchurch is a town in Dorset, England. It is next to Bournemouth. Christchurch is twinned with:", "Auckland\n\nAuckland is the largest city in New Zealand. About 2 million people live in the . For a short time in New Zealand's history it was the capital city. Now Wellington is the capital city. Auckland is in the north of the North Island. It is on two harbours: the Manukau and Waitemata harbours. It is known as the \"City of Sails\" because there are many sailing boats in the city. The Hauraki Gulf has many different islands and provides safe anchorage and good sailing that is recognised around the world. It has a temperate oceanic climate (\"Cfb\" in the K\u00f6ppen climate classification). Auckland is built on a series of dormant volcanos. The youngest and largest of these is called Rangitoto. Rangitoto is an island just a few kilometres from the city centre. It has many pohutukawas, native trees also known as the New Zealand Christmas tree because of their brilliant red flowers which bloom in December. In 2010, Len Brown became the 1st Mayor of Auckland. In 2016, he was replaced by Phil Goff. According to the NIWA, Auckland has a subtropical climate, with warm, humid summers and mild, rainy winters. Under K\u00f6ppen's climate classification, the city has an oceanic climate (\"Cfb\"). It is the warmest main centre of New Zealand and is also one of the sunniest, with an average of over 2000 sunshine hours per annum. The average daily maximum temperature is in February and in July. The absolute maximum recorded temperature is , while the absolute minimum is . High levels of rainfall occur almost year\u2013round with an average of per year spread over 136 rain days, but is most frequent in Winter. Snowfall in Auckland is extremely rare; recorded instances include 27 July 1939 and 15 August 2011, although without any accumulation.", "Zealand\n\nZealand (Danish: \"Sj\u00e6lland\") is an island in the eastern part of Denmark. It is just west of Sweden and a strait called the \u00d8resund lies between the two. It has an area of 7,031 km\u00b2 and is the largest island in the country. About 2,268,000 people were living in Zealand as of 2016. Most of these people live in and around Copenhagen, the capital of Denmark, which is on the eastern shore of Zealand. A number of bridges and tunnels link Zealand to other parts of Denmark. They include:", "Bic Runga\n\nBic Runga (born January 13, 1976) is a singer from New Zealand. She was born in Christchurch. She has sold lots of albums in New Zealand. The names of her albums are:"], "reference_contexts": ["New Zealand New Zealand (known as in the M\u0101ori language) is an island country in Oceania. It is a sovereign state in the south-western part of the Pacific Ocean. It is made up of two large islands (the North Island and the South Island) and many smaller islands. These islands are located to the southeast of Australia. New Zealand was one of the last places in the world that humans discovered, because it is a long way away from most of the world. During its time without humans, New Zealand was a great place for an unusual range of plants and animals to develop. The current capital city of the country is Wellington, and the largest city is Auckland. Both of these cities are on the North Island. The largest city on the South Island is Christchurch. The official languages are English, M\u0101ori and New Zealand sign language. English has never been granted official language status in the NZ laws, but it is used as a default official language due to its wide usage. In 2010, a newspaper in NZ said that New Zealand was the 8th happiest country in the world. In the M\u0101ori language, the country is called Aotearoa, which means \"Land of the Long White Cloud\". \"Ao\" means \u201ccloud\u201d, \"tea\" means \u201cwhite\u201d, and \"roa\" means \u201clong\u201d. The name \"New Zealand\" comes from \u201cZeeland\u201d (which translates to \"Sealand\") in Dutch, after the islands were seen by Dutch explorer Abel Tasman. Zeeland is a province of the Netherlands. New Zealand is a constitutional monarchy and parliamentary democracy. The head of state is Charles III. The Prime Minister is Chris Hipkins, leader of the Labour Party. New Zealand has made itself a \"Nuclear Free Zone\": They do not use nuclear power and do not allow nuclear weapons or nuclear powered vessels in their territory. Elections are held every 3 years. As of the 2018 census, 4,699,755 people lived in New Zealand. Most of them have European ancestors. The indigenous people of New Zealand, the M\u0101ori, have a population of 775,836, or 16.5%. The people of New Zealand often call themselves Kiwis. This name is derived from the kiwi, a flightless native bird that is considered the country's national bird. The North Island is smaller than the South Island, but most people (more than 3 million) live there. This might be because the North Island is usually warmer, and has more big cities. About half of the people in New Zealand are religious. As of the 2018 census, 48.2% had no religion. The main religion in New Zealand is Christianity. Just over 2 million New Zealanders are Christian. The second most common religion is Hinduism, with 2.6%. Most New Zealanders live in urban areas, with the other 27% living in small towns or farming communities. Wellington is the capital of New Zealand. Auckland is the largest city, with around 1 million people. Other cities in the North Island include Hamilton, Tauranga, Napier/Hastings, New Plymouth, Whanganui, and Palmerston North. South Island cities include Christchurch, Dunedin, Nelson, Invercargill and Timaru. New Zealand sits at the boundary between the Australian and Pacific continental plates. When these two plates bumped into each other ('collided'), the Pacific plate moved under the Australian plate, north of the South Island. As a result, there has been lots of volcanic activity. South of the South Island, the Australian plate moves under the Pacific plate instead. The plates slide past each other in the South Island, where they have pushed up the Southern Alps. Because of these two colliding plates, New Zealand often has earthquakes. One of the best known is the 2010-2011 group of earthquakes that hit the Christchurch area. The diagram shows that the North Island is on the Australian plate, but most of the South Island is on the Pacific plate. New Zealand is still geologically active, and will remain so as long as the islands are sitting above the plate boundary. The oldest rocks in New Zealand date from the Cambrian period, 512 million years ago. New Zealand became part of the global super-continent Pangaea. When that split (End-Triassic/early Jurassic), New Zealand became part of the southern super-continent Gondwana. Finally Gondwana broke up, leaving the continents rather as they are today. New Zealand was isolated from the rest of the world for a long time. It split from Australia 83 million years ago. Because of this, there are many plants and animals that only live in New Zealand. Before humans came to New Zealand, there were no mammals, except three species of bat and marine mammals such as seals, dolphins, and whales. Instead, New Zealand has many different kinds of bird. New Zealand has several species of flightless bird, including the kiwi and Kakapo. For the lizards, especially important is the Tuatara, the only living member of a whole order of reptiles. New Zealand used to have more rare species, but some, mostly birds, were hunted to extinction early in its history. The giant Moa, \"Dinornis\", is a famous example. The group of birds which the moa belongs to had been in existence since the Cretaceous period. Humans arrived in New Zealand about a thousand years ago, when many moa were living, especially on the South Island. Archaeological sites with evidence of moa hunting are all over New Zealand. The moa became extinct about five hundred years ago. Extinctions closer to today have been caused by habitat change and introduced species like rats, dogs, cats, and possums, which kill the native birds and lizards, or eat their eggs."], "response": "Christchurch is the largest city in the South Island of New Zealand and the third largest urban area in the country. It is located on the South Island\u2019s east coast and is known as the oldest established city in New Zealand, having become a city by Royal Charter on July 31, 1856. The city is famous for its Nor'westers, hot dry, dusty winds, and is also known as \u201cthe garden city.\u201d Christchurch has a rich history, including being the site of significant M\u0101ori and European interactions and settlements. It was severely affected by the earthquake in February 2011, which damaged the city center. The city is also a hub for various outdoor activities and tourism [File: wiki_26.txt, Section: Christchurch].", "reference": "Christchurch is the largest city on the South Island of New Zealand."}
{"user_input": "What is the significance of Paris within the European Union?", "retrieved_contexts": ["Paris\n\nParis (nicknamed the \"\"City of light\"\") is the capital city of France, and the largest city in France. The area is , and around 2.15 million people live there. If suburbs are counted, the population of the Paris area rises to 10.7 million people. It is the most densely populated city in the European Union, with 20.653 people per square kilometer. The Seine river runs through the oldest part of Paris, and divides it into two parts, known as the Left Bank and the Right Bank. It is surrounded by many forests. Paris is also the center of French economy, politics, traffic and culture. Paris has many art museums and historical buildings. As a traffic center, Paris has a very good underground subway system (called the \"Metro\"). It also has two airports. The Metro was built in 1900, and its total length is more than . The city has a multi-cultural style, because 19% of the people there are from outside France. There are many different restaurants with all kinds of food. Paris also has some types of pollution like air pollution and light pollution. Julius Caesar conquered the Celtic \"Parisii\" tribe in 51 BC. The largest clan of French people in Paris is Parisii in 2023. The Romans called the place \"Lutetia\" of the Parisii, or \"\"Lutetia Parisiorum\"\". The place got a shorter name, \"\"Paris\"\", in 212 AD. As the Roman Empire began to fall apart in the West, the Germanic tribe called the Franks moved in, taking it in 464. In 507, their king Clovis I made it his capital. Charlemagne moved his capital to Aachen in Germany, but Paris continued as an important town and was attacked by the Vikings twice.", "Council of Europe\n\nThe Council of Europe (, ) is an international organization of 47 member states in the European region. One of its first successes was the European Convention on Human Rights in 1950, which serves as the basis for the European Court of Human Rights. The seat of the Council of Europe is in Strasbourg on the Franco-German border. The original meeting place was in the city's University Palace. The Palais de l'Europe, about two kilometres from city centre, has taken its place. Membership is open to all European democracies which accept the principle of the rule of law and guarantee fundamental human rights, civil rights and freedoms to their citizens and respect of rights of minority groups. The Council of Europe is not to be confused with the Council of the European Union or the European Council, as it is a separate organisation and not part of the European Union. But all member states of European Union are also the member states of Council of Europe. On 15 March 2022, Russia is excluded from Council of Europe because of 2022 Russian invasion of Ukraine.", "European Union\n\nThe European Union (abbreviation: EU) is a union of 27 member countries in Europe established by the Maastricht Treaty in 1992-1993. It is a sui generis political organisation that has both the characteristics of a federation and of a confederation. The EU grew out of the European Economic Community (EEC) which was established by the Treaty of Rome in 1957. It has created a common economic area with Europe-wide laws allowing the citizens of EU countries to move and trade in other EU countries almost the same as they do in their own. Nineteen of these countries also share the same type of money: the euro. The name of Europe comes from the Latin Europa, which in turn derives from the Greek \u0395\u1f50\u03c1\u03ce\u03c0\u03b7, from \u03b5\u1f50\u03c1\u03cd\u03c2 eurys \"wide\" and \u1f64\u03c8 ops \"face\". The Treaty of Lisbon is the most recent treaty that says how the Union is run. Every member state signed to say that they each agreed with what it says. Most importantly, it says which jobs (\u2019powers\u2019) the Union should do for the members and which jobs they should do themselves. The members decide how the Union should act by voting for or against proposals. The objective of the EU is to bring its member states closer together with respect to human rights and democracy. It does this with common rules about fair trading with each other, common agreements about law enforcement, a common style of passport, and other agreements. Most members share a common currency (the euro) and most allow people to travel from one country to another without having to show a passport. It does this with common rules about fair trading with each other, common agreements about law enforcement, and other agreements. It has a common style for (its) passports.", "Bucharest\n\nBucharest is the capital city of Romania. It is the largest city in the country. The city has a population of 1.9 million people. It is made up of 6 \"sectors\". It has a humid continental climate (\"Cfa\" in the Koeppen climate classification). It became the capital of Romania in 1862. It is the centre of Romanian media, culture and art. Bucharest is the 6th largest city in the European Union by population within city limits. According to European standards, Bucharest is an old city. The first mention of it appears in 1459. Its eclectic architecture is a mixture of historical, transitional, Communist and modern styles. In the period between the two World Wars, thanks to the elegant urban architecture and ingenuity of the urban elite, Bucharest was named \"Paris of the East\", or \"Little Paris\" (Micul Paris).", "European Union member state\n\nA European Union member state is any one of the twenty-seven countries that have joined the European Union (EU) since it was found in 1958 as the European Economic Community (EEC). From an original membership of six states, there have been five successive enlargements. The largest happened on 1 May 2004, when ten member states joined. Following the addition of Croatia in 2013, the EU's membership now stands at twenty-eight. Negotiations are also under way with other states. The process of enlargement is sometimes referred to as European integration. However, this term is also used to refer to the intensification of cooperation between EU member states as national governments allow for the gradual centralising of power within European institutions. Before being allowed to join the European Union, a state must fulfill the economic and political conditions generally known as the Copenhagen criteria: these basically require that a candidate member state must enjoy a secular, democratic system of government, together with the corresponding freedoms and institutions, and respect the rule of law. Under the terms of the Treaty on European Union, enlargement of the Union is conditional upon the agreement of each existing member state as well as approval by the European Parliament. Bulgaria and Romania make up the second part of the EU's fifth enlargement, and joined the EU on 1 January 2007. This date was agreed upon at the Thessaloniki Summit in 2003, confirmed at Brussels on 18 June 2004, and affirmed by the country reports of October 2004 and the final report delivered on 26 September 2006. Bulgaria and Romania signed their Treaty of Accession on 25 April 2005 at a ceremony held at Neum\u00fcnster Abbey in Luxembourg. The United Kingdom was a former EU member state. It joined the European Economic Community on 1 January 1973.", "Council of the European Union\n\nThe Council of the European Union \"(often called Council of Ministers or just Council)\" is one of the three organisations that manage the European Union. Along with the European Parliament, it is responsible for law making for the European Union (EU). Its members are the government ministers of the member countries who are responsible for the law that is being discussed. As an example, suppose the law is going to be about farming, then the Agriculture Ministers are the council for that day. As well as making laws, they can meet to discuss their problems. For example, the European Union does not decide on tax - each country decides on its own tax. But the Finance Ministers meet anyway because sometimes they can help each other catch people who do not want to pay tax at all. The council is called different things in different countries, according to the language they speak (for example in French it is \"Conseil de l'Union Europ\u00e9enne\" and in German it is \"Rat der Europ\u00e4ischen Union\"). It is also known internationally, and so it appears on its logo, with the Latin word Consilium. A simple way of putting it, is that The 'Council of the European Union' is helped by most countries in the world and it is very important.", "The European Commission runs the day-to-day running of the EU and writes laws, like a government. Laws written by the commission are discussed and changed by the European Parliament and the Council of the European Union. The commission has one President and 27 Commissioners, selected by the European Council. The Commission President is appointed by the European Council with the approval of the European Parliament. The commission operates like a cabinet government. There is one Commissioner per member state, though Commissioners are bound to represent the interests of the EU as a whole rather than their home state. The Parliament has a total of 705 members (called Members of the European Parliament, or MEP). They are elected in their countries every five years by the citizens of the European Union member countries. The Parliament can approve, reject or change proposed laws. It can also sack the European Commission. In that case, the entire commission would have to give up their jobs. There are many discussions in the EU about how it should develop and change in the future. The main reasons why European countries came together are political and economic: In 1951, six countries made the \"European Coal and Steel Community\", a basic version of what the EU is now. These six then went further and in 1957 they made the European Economic Community and the European Coal and Steel Community. The UK and others decided not to join, and then when the UK changed its mind it was stopped from joining by French President Charles de Gaulle. When he was no longer President, the UK and others started to join. Today there are 27 members but the idea that more should join is not seen as a good one by everyone. Serbia, Montenegro, North Macedonia, Turkey and Iceland are \"candidate countries\"; they are being considered for membership. Albania, Bosnia and Herzegovina and Kosovo are expected to follow."], "reference_contexts": ["Paris Paris (nicknamed the \"\"City of light\"\") is the capital city of France, and the largest city in France. The area is , and around 2.15 million people live there. If suburbs are counted, the population of the Paris area rises to 10.7 million people. It is the most densely populated city in the European Union, with 20.653 people per square kilometer. The Seine river runs through the oldest part of Paris, and divides it into two parts, known as the Left Bank and the Right Bank. It is surrounded by many forests. Paris is also the center of French economy, politics, traffic and culture. Paris has many art museums and historical buildings. As a traffic center, Paris has a very good underground subway system (called the \"Metro\"). It also has two airports. The Metro was built in 1900, and its total length is more than . The city has a multi-cultural style, because 19% of the people there are from outside France. There are many different restaurants with all kinds of food. Paris also has some types of pollution like air pollution and light pollution. Julius Caesar conquered the Celtic \"Parisii\" tribe in 51 BC. The largest clan of French people in Paris is Parisii in 2023. The Romans called the place \"Lutetia\" of the Parisii, or \"\"Lutetia Parisiorum\"\". The place got a shorter name, \"\"Paris\"\", in 212 AD. As the Roman Empire began to fall apart in the West, the Germanic tribe called the Franks moved in, taking it in 464. In 507, their king Clovis I made it his capital. Charlemagne moved his capital to Aachen in Germany, but Paris continued as an important town and was attacked by the Vikings twice. When Hugh Capet became king of France in 987, he again made Paris his capital. For a long time, the kings only controlled Paris and the surrounding area, as much of the rest of France was in the hands of barons or English. During the Hundred Years' War, the English controlled Paris from 1420 to 1437. During the Protestant Reformation, a huge massacre of French Protestants started there in 1572, called the Saint Bartholomew Day Massacre. Paris saw many other troubles over the years of the \"\"Ancien R\u00e9gime\"\" (Old Kingdom), then in 1789, the French Revolution began in Paris, leading to more massacres. Paris was the Capital of the French Empire which, as well as France, covered Spain, Belgium, Holland, Luxembourg, Switzerland, Italy, most of Germany and some of Austria, Croatia, Slovenia and Poland. The Empire ruled by Napoleon was from 1804 to 1814/1815. The Russian army seized Paris from Napoleon in 1814, and the Prussian army captured it in 1871. The next time it was captured was by the Nazi Germans in 1940. The Allies freed the city in 1944 and it has not since been captured. Also, the city has been featured in many songs including the #1 hit song by Jay-Z and Kanye West called \"Niggas in Paris\". Paris has an oceanic climate in the K\u00f6ppen climate classification. It has warm summers and cold winters, and rainfall year-round. Paris has much to offer for sightseeing. Here are five very famous examples: Because the city of Paris is roughly only 10 kilometres/6 miles across, visitors have a wide range of options when it comes to transportation. While much of the more well-known attractions are in the center of the city and are best experienced by walking, there are many destinations that require other means of transport. While taxis offer a fast and relatively inexpensive means of travel, Paris\u2019 public transportation system offers an enjoyable, stress-free way to explore the city. The Paris M\u00e9tro system was built in 1900 by engineer Fulgence Bienven\u00fce and architect Hector Guimard. The M\u00e9tro covers over 198 kilometers/124 miles with 300 stations and 16 lines. Servicing over 6 million residents and tourists every day, the M\u00e9tro was designed to be an efficient and reliable alternative to the congestion of traffic. Every building in Paris is less than 500 meters from a train station, so accessibility is never a problem. The 16 M\u00e9tro lines are identified by their final destinations. A rider can simply select the appropriate line and take it in the direction s/he wants. The M\u00e9tro stations are well marked, and there are ticket booths at most entrances. There are five airports that serve Paris: Charles de Gaulle Airport, Orly Airport, Beauvais-Till\u00e9 Airport and Paris\u2013Le Bourget Airport, and Ch\u00e2lons Vatry Airport."], "response": "Paris is significant within the European Union as it is the capital city of France, which is one of the EU's founding members. It is the largest city in France and serves as the center of French economy, politics, traffic, and culture. Paris is also a major traffic center with a well-developed subway system and two airports, contributing to its role in the EU's connectivity and transportation network. Additionally, its multicultural style reflects the diverse population within the EU [File: wiki_03.txt, Section: Paris].", "reference": "Paris is the most densely populated city in the European Union, with 20.653 people per square kilometer, and serves as the center of French economy, politics, traffic, and culture."}
{"user_input": "What significant event is associated with Simbirsk in relation to Lenin?", "retrieved_contexts": ["Ulyanovsk\n\nUlyanovsk (), formerly Simbirsk (), is a city on the Volga River in Russia. It was founded in the year 1648. Ulyanovsk had a population of 638,300 in 2005. It is the administrative center of Ulyanovsk Oblast. In 1924, the city was renamed Ulyanovsk after Vladimir Ulyanov, better known as Lenin, who was born there.", "Vladimir Lenin\n\nVladimir Ilyich Ulyanov, better known as (22 April 1870 \u2013 21 January 1924) was a Russian lawyer, revolutionary, the leader of the Bolshevik party and of the October Revolution. He was the first leader of the USSR and the government that took over Russia in 1917. Lenin's ideas became known as Leninism. Vladimir Ulyanov was born on 22 April 1870 in the town of Simbirsk in the Russian Empire. His mother was a schoolteacher and his father was an education official (technically, his father's job made him and his family noblemen). Lenin began studying politics in high school. In 1886, the year that Lenin was doing his final gymnasium exams, his father died, his brother Alexander was hanged for his part in a bomb plot to kill Tsar Alexander III, and their sister Anna was sent to Tatarstan. This made Lenin furious, and he promised to get revenge for his brother's death. The family drama didn't stop Lenin from completing the exams with high results: he got the second-highest grade in his class. Lenin excelled in school and learned the Latin and Greek languages. In 1887, he was thrown out of Kazan State University because he protested against the Tsar who was the king of the Russian Empire. He continued to read books and study ideas by himself, and in 1891 he got a license to become a lawyer. While he studied law in St. Petersburg he learned about the writings of Karl Marx and Friedrich Engels, who were both philosophers from Germany. Karl Marx's thoughts were called Marxism. To talk or write about Marxism positively was illegal in Russia, and Lenin was arrested for that and sent to prison in Siberia. This punishment was harsh because Siberia is very cold and isolated, and almost impossible to escape.", "This punishment was harsh because Siberia is very cold and isolated, and almost impossible to escape. In July 1898, while still in Siberia, Lenin married Nadezhda Krupskaya. In 1899 he wrote a book he called \"\". In 1900, Lenin was set free from prison and allowed to go back home. He then traveled around Europe. He began to publish a Marxist newspaper called \"Iskra\", the Russian word for \"spark\" or \"lightning\". He also became an important member of the Russian Social Democratic Labour Party, or RSDLP. In 1901 he began calling himself \"Lenin\". In 1903, Lenin had a major argument with another leader of the party, Julius Martov, which divided the party in two. Lenin wanted to establish socialism right away, rather than establishing capitalism first and then making the transition to socialism. Martov disagreed, he wanted to cling to the Classical Marxist idea that in order to achieve socialism, you must go through capitalism first. People who agreed with Martov were called Mensheviks (meaning \"the minority\"). The people who agreed with Lenin were called Bolsheviks (\"the majority\"). In 1907 he traveled around Europe again, and visited many socialist meetings and events. During World War I he lived in big European cities like London, Paris and Geneva. At the beginning of the war, a big left-wing meeting called the Second International included the Bolsheviks. The meeting shut down when a lot of the groups argued whether or not to support the war. Lenin and the Bolsheviks were one of only a few groups who were against the war because of their Marxist ideas. After Tsar Nicholas II gave up his throne during the February Revolution, Lenin went back to Russia where he was still a very important Bolshevik leader.", "After Tsar Nicholas II gave up his throne during the February Revolution, Lenin went back to Russia where he was still a very important Bolshevik leader. He wrote that he wanted a revolution by ordinary workers to overthrow the government that had replaced Nicholas II. In 1917, The Kadets, a right-wing party, and elements of the Okhrana (secret police) started rumors that Lenin had got money from the Germans, because they had sent him through Germany in a special train to reach Russia. That may have made him look bad because a lot of Russians had died fighting Germany in the war. After the July Days, a popular uprising in Petrograd which was crushed by the Russian Provisional Government, he left Russia and went to Finland, where he could hide and carry on with his work on Communism. In November 1917, the Bolsheviks, led by Lenin and Trotsky, headed the Petrograd Soviet and other Soviets all over Russia in a revolution against Kerensky's government, which was known as the October Revolution. They won, and announced that Russia was a socialist country. In November, Lenin was chosen as its leader. Because Lenin wanted an end to World War I in Russia, he signed the Treaty of Brest-Litovsk with Germany in February 1918. While the treaty ended the attack by Germany, Russia lost a large amount of land that it used for farming. The treaty also made Germany's other enemies angry, and together with Russian people who supported the Tsar or Kerensky's government, they attacked Russia. Lenin made rules that as much food as possible was to be given to Bolshevik soldiers in Russia's new Red Army. This meant that they won the war, but ordinary people were starving, and many died of hunger or disease.", "This meant that they won the war, but ordinary people were starving, and many died of hunger or disease. After the war, Lenin brought in the New Economic Policy to try and make things better for the country and move from capitalism towards socialism. Some private enterprise was still allowed, but not much. Businessmen, known as nepmen, could only own small industries, not factories. Factories and large industry became public property to be owned by the workers. A woman named Fanny Kaplan shot Lenin whilst he was making an official visit. She missed his head and instead the bullet was lodged into his neck. Fearing that he would be killed by political dissenters, he refused to have the bullet removed until a guaranteed Communist doctor could be found. As a result of his direct refusal to be treated, the bullet was never removed, and is often cited as the reason he started having strokes in May and December 1922 (both of which he recovered from). In March 1923 a stroke paralyzed him and left him unable to speak, and he died on January 24, 1924 of a stroke. Just before he died, Lenin had wanted to get rid of Stalin because he thought he was dangerous to the country and the government. The city of St. Petersburg had been renamed Petrograd by the Tsar in 1914, but was renamed Leningrad in memory of Lenin in 1924. When the Soviet Union collapsed in 1991, Leningrad was again named St. Petersburg. Before Lenin died, he said he wished to be buried beside his mother. When he died, Stalin let the people in Russia look at his body. Because people kept coming they decided not to bury him, and preserved his body instead. A building was built in Red Square, Moscow over the body so that people could see it. It is called the Lenin Mausoleum. Many Russians and tourists still go there to see his body today.", "Many Russians and tourists still go there to see his body today. After Lenin died, Stalin used him to justify his own rule, by making it look like he was Lenin's chosen successor. Some Historians argue that Lenin laid the groundwork for the later development of totalitarian regimes, such as Nazi Germany under Adolf Hitler, Fascist Italy under Benito Mussolini, North Korea under the Kim Dynasty, and others. His consolidation of power, one-party rule, and suppression of opposition certainly contributed to this perception."], "reference_contexts": ["October Revolution. He was the first leader of the USSR and the government that took over Russia in 1917. Lenin's ideas became known as Leninism. Vladimir Ulyanov was born on 22 April 1870 in the town of Simbirsk in the Russian Empire. His mother was a schoolteacher and his father was an education official (technically, his father's job made him and his family noblemen). Lenin began studying politics in high school. In 1886, the year that Lenin was doing his final gymnasium exams, his father died, his brother Alexander was hanged for his part in a bomb plot to kill Tsar Alexander III, and their sister Anna was sent to Tatarstan. This made Lenin furious, and he promised to get revenge for his brother's death. The family drama didn't stop Lenin from completing the exams with high results: he got the second-highest grade in his class. Lenin excelled in school and learned the Latin and Greek languages. In 1887, he was thrown out of Kazan State University because he protested against the Tsar who was the king of the Russian Empire. He continued to read books and study ideas by himself, and in 1891 he got a license to become a lawyer. While he studied law in St. Petersburg he learned about the writings of Karl Marx and Friedrich Engels, who were both philosophers from Germany. Karl Marx's thoughts were called Marxism. To talk or write about Marxism positively was illegal in Russia, and Lenin was arrested for that and sent to prison in Siberia. This punishment was harsh because Siberia is very cold and isolated, and almost impossible to escape. In July 1898, while still in Siberia, Lenin married Nadezhda Krupskaya. In 1899 he wrote a book he called \"\". In 1900, Lenin was set free from prison and allowed to go back home. He then traveled around Europe. He began to publish a Marxist newspaper called \"Iskra\", the Russian word for \"spark\" or \"lightning\". He also became an important member of the Russian Social Democratic Labour Party, or RSDLP. In 1901 he began calling himself \"Lenin\". In 1903, Lenin had a major argument with another leader of the party, Julius Martov, which divided the party in two. Lenin wanted to establish socialism right away, rather than establishing capitalism first and then making the transition to socialism. Martov disagreed, he wanted to cling to the Classical Marxist idea that in order to achieve socialism, you must go through capitalism first. People who agreed with Martov were called Mensheviks (meaning \"the minority\"). The people who agreed with Lenin were called Bolsheviks (\"the majority\"). In 1907 he traveled around Europe again, and visited many socialist meetings and events. During World War I he lived in big European cities like London, Paris and Geneva. At the beginning of the war, a big left-wing meeting called the Second International included the Bolsheviks. The meeting shut down when a lot of the groups argued whether or not to support the war. Lenin and the Bolsheviks were one of only a few groups who were against the war because of their Marxist ideas. After Tsar Nicholas II gave up his throne during the February Revolution, Lenin went back to Russia where he was still a very important Bolshevik leader. He wrote that he wanted a revolution by ordinary workers to overthrow the government that had replaced Nicholas II. In 1917, The Kadets, a right-wing party, and elements of the Okhrana (secret police) started rumors that Lenin had got money from the Germans, because they had sent him through Germany in a special train to reach Russia. That may have made him look bad because a lot of Russians had died fighting Germany in the war. After the July Days, a popular uprising in Petrograd which was crushed by the Russian Provisional Government, he left Russia and went to Finland, where he could hide and carry on with his work on Communism. In November 1917, the Bolsheviks, led by Lenin and Trotsky, headed the Petrograd Soviet and other Soviets all over Russia in a revolution against Kerensky's government, which was known as the October Revolution. They won, and announced that Russia was a socialist country. In November, Lenin was chosen as its leader. Because Lenin wanted an end to World War I in Russia, he signed the Treaty of Brest-Litovsk with Germany in February 1918. While the treaty ended the attack by Germany, Russia lost a large amount of land that it used for farming. The treaty also made Germany's other enemies angry, and together with Russian people who supported the Tsar or Kerensky's government, they attacked Russia. Lenin made rules that as much food as possible was to be given to Bolshevik soldiers in Russia's new Red Army. This meant that they won the war, but ordinary people were starving, and many died of hunger or disease. After the war, Lenin brought in the New Economic Policy to try and make things better for the country and move from capitalism towards socialism. Some private enterprise was still allowed, but not much. Businessmen, known as nepmen, could only own small industries, not factories. Factories and large industry became public property to be owned by the workers. A woman named Fanny Kaplan shot Lenin whilst he was making an official visit. She missed his head and instead the bullet was lodged into his neck. Fearing that he would be killed by political dissenters, he refused to have the bullet removed until a guaranteed Communist doctor could be found. As a result of his direct refusal to be treated, the bullet was never removed, and is often cited as the reason he started having strokes in May and December 1922 (both of which he recovered from). In March 1923 a stroke paralyzed him and left him unable to speak, and he died on January 24, 1924 of a stroke. Just before he died, Lenin had wanted to get rid of Stalin because he thought he was dangerous to"], "response": "Simbirsk, now known as Ulyanovsk, is significant as it is the birthplace of Vladimir Lenin, who was born there on 22 April 1870 [File: wiki_03.txt, Section: Vladimir Lenin].", "reference": "Simbirsk is significant as it is the birthplace of Vladimir Ulyanov, who later became known as Lenin, the first leader of the USSR."}
{"user_input": "What historical significance does Leningrad hold in relation to Lenin and the Soviet Union?", "retrieved_contexts": ["This meant that they won the war, but ordinary people were starving, and many died of hunger or disease. After the war, Lenin brought in the New Economic Policy to try and make things better for the country and move from capitalism towards socialism. Some private enterprise was still allowed, but not much. Businessmen, known as nepmen, could only own small industries, not factories. Factories and large industry became public property to be owned by the workers. A woman named Fanny Kaplan shot Lenin whilst he was making an official visit. She missed his head and instead the bullet was lodged into his neck. Fearing that he would be killed by political dissenters, he refused to have the bullet removed until a guaranteed Communist doctor could be found. As a result of his direct refusal to be treated, the bullet was never removed, and is often cited as the reason he started having strokes in May and December 1922 (both of which he recovered from). In March 1923 a stroke paralyzed him and left him unable to speak, and he died on January 24, 1924 of a stroke. Just before he died, Lenin had wanted to get rid of Stalin because he thought he was dangerous to the country and the government. The city of St. Petersburg had been renamed Petrograd by the Tsar in 1914, but was renamed Leningrad in memory of Lenin in 1924. When the Soviet Union collapsed in 1991, Leningrad was again named St. Petersburg. Before Lenin died, he said he wished to be buried beside his mother. When he died, Stalin let the people in Russia look at his body. Because people kept coming they decided not to bury him, and preserved his body instead. A building was built in Red Square, Moscow over the body so that people could see it. It is called the Lenin Mausoleum. Many Russians and tourists still go there to see his body today.", "Saint Petersburg\n\nSaint Petersburg () is a Russian city in northwestern Russia, near the Gulf of Finland of the Baltic Sea. Over five million people live in St. Petersburg as of 2015, and it is the second biggest city in Russia. It is a major port, connecting with the world's shipping paths through the Neva River and the Baltic. Part of Saint Petersburg is designated a World Heritage Site called The Historic Centre of Saint Petersburg and Related Groups of Monuments. Saint Petersburg was started by the Russian Tsar, Peter I as the capital of the Russian Empire in 1703, to take the place of the earlier capital, Moscow. It was the capital of Russia until 1918. Peter the Great established Saint Petersburg as a warm-weather port in order to show Russian dominance in the Baltic and to increase trading opportunities. Peter sought to modernize Russia, therefore he tried to make Saint Petersburg as different as possible from the former capital, Moscow, by modernizing the city. Saint Petersburg has changed its name many times. During World War I, when Russia and Germany were fighting each other, Russians thought the name Sankt Peterburg sounded too German, so Tsar Nicholas II, on August 31 (August 18, Old Style), 1914 decided that the city was renamed Petrograd. In 1918 during the Russian revolution, the Soviet capital was moved to Moscow, still the capital of Russia now. On January 26, 1924, five days after Lenin's death, Petrograd was renamed Leningrad in his honor. During World War II, the city was surrounded by the German army and under siege for twenty-nine months until January 1944. Leningrad again took its old name of St. Petersburg on September 6, 1991, when Russia stopped being communist. In every-day Russian, the city is often called just \"\"Piter\"\".", "Soviet Union\n\nThe Soviet Union officialy Union of Soviet Socialist Republics also known as USSR was the Russian state after end of Tsarist Period and the world's first single-party Marxist\u2013Leninist state from 1922 until 1991. It was the first country to declare itself socialist and build towards a communist society. It was a union of 14 Soviet socialist republics and one Soviet Federative Socialist Republic (Russian SFSR). The Soviet Union was created about five years after the Russian Revolution. It was announced after Vladimir Lenin overthrew Alexander Kerensky as Russian leader. The communist government developed industry and over time became a major, powerful union. The largest country in the Union was Russian SFSR, Kazakh SSR was the second, and Ukrainian SSR the third largest. The capital city of the Soviet Union and RSFSR was Moscow. The Soviet Union expanded its political control greatly after World War II. It took over the whole of Eastern Europe. Those countries were not made part of the Soviet Union, but they were controlled by the Soviet Union indirectly. These countries, like Poland, Czechoslovakia, Hungary, Bulgaria, Romania and East Germany, were called satellite states. The top-level committee which made the laws was the Supreme Soviet of the Soviet Union. In practice, the General Secretary of the Communist Party of the Soviet Union was the leader and most important decision-maker in their system of government. Although the constitution said the Republics could leave the Union if they wanted, it was a completely centralized government, with no states' rights for the member countries. The Union was formed with the idea to give everyone equal social and economic rights (equality).", "On 1 February 1924, the USSR was accepted as a country by the British Empire. Also in 1924, a Soviet Constitution (set of laws) was approved, making true the December 1922 union of the Russian SFSR, the Ukrainian SSR, the Belarusian SSR, and the Transcaucasian SFSR to form the \"Union of Soviet Socialist Republics\" (USSR). The big changes of the economy, industry, and politics of the country began in the early days of Soviet power in 1917. A large part of this was performed according to Bolshevik Initial Decrees, documents of the Soviet government, signed by Vladimir Lenin. One of the most important and notable breakthroughs was the GOELRO plan, that planned a major change of the Soviet economy based on total electrification of the country. The Plan was developed in 1920 and covered a 10- to 15-year period. It included the making of a network of 30 regional power stations, including ten large hydroelectric power plants, and numerous electric-powered large industrial organizations. The Plan became the prototype for subsequent Five-Year Plans and was basically fulfilled by 1931. From its beginning years, government in the Soviet Union was ruled as a one-party state by the Communist Party (Bolsheviks). After the economic policy of War Communism during the Civil War, the Soviet government permitted some private enterprise to coexist with nationalized industry in the 1920s and total food requisition in the countryside was replaced by a food tax (\"see\" New Economic Policy). Soviet leaders argued that one-party rule was necessary because it ensured that 'capitalist exploitation' would not return to the Soviet Union and that the principles of Democratic Centralism would represent the people's will. Debate over the future of the economy provided the background for Soviet leaders to take more power in the years after Lenin's death in 1924.", "Debate over the future of the economy provided the background for Soviet leaders to take more power in the years after Lenin's death in 1924. Initially, Lenin was to be replaced by a \"troika\" composed of Grigory Zinoviev of Ukraine, Lev Kamenev of Moscow, and Joseph Stalin of Georgia. Stalin led the country through World War II and into the Cold War. Gulag camps greatly expanded to take a lot of prisoners. After he died, Georgy Malenkov briefly continued his policies. Nikita Khrushchev reversed some of Stalin's policies,but Leonid Brezhnev and Alexei Kosygin kept things as they were. After the 1936 revised constitution, the Soviet Union stopped acting as a union of republics and more as a single super-country. Stalin died on 5 March 1953. Nikita Khrushchev eventually won the following power struggle by the mid-1950s. In 1956, he denounced Stalin's repression and eased controls over party and society. This was known as de-Stalinization. Moscow considered Eastern Europe to be a very vital buffer zone for the forward defense of its western borders. For this reason, the USSR sought to strengthen its control of the region. It did this by transforming the Eastern European countries into satellite states, dependent upon and obedient to its leadership. Soviet military force was used to suppress anti-Stalinist uprisings in Hungary and Poland in 1956. During the Khrushchev\u2019s power program of relocating every urban family to a separate apartment was started. There were built a lot of 5-floor buildings to live for 20 years. After Krushchev\u2019s visit to the USA, corn became a very popular in the USSR. In the late 1950s, a confrontation with China regarding the USSR's policies led to the Sino\u2013Soviet split.", "In every-day Russian, the city is often called just \"\"Piter\"\". The \"Oblast\" (administrative province) where the city is the capital is still called \"Leningrad Oblast\". Saint Petersburg was a beautiful city planned by Peter I. There are many man-made rivers (or canals) in the city, so the city is sometimes called the \"Venice of the North\". There are also beautiful buildings built by Russian emperors in other places of the city. Some of these buildings are the Hermitage Museum and the Winter Palace. Saint Petersburg is located in Northwestern Federal district of Russia. The area of the city is 605.8 km\u00b2. Saint Petersburg has an area called Leningrad oblast. The city has also many islands such as Vasilyevsky Island, Kotlin Island, Kamerny Island, Aptekarsky Island etc. The climate is a humid continental.", "Vladimir Putin\n\nVladimir Vladimirovich Putin (, ) is the current President of Russia. Putin was born in Leningrad, now Saint Petersburg, on the 7 of October in 1952. He was the Prime Minister of Russia from 1999 to 2000, then President of Russia from March 2000 to May 2008, and Prime Minister again from 2008 to 2012. He became president again in 2012. He originally trained as a lawyer. Putin was born on 7 October 1952, in Leningrad, Russian SFSR, Soviet Union (now Saint Petersburg, Russia) during the rule of Joseph Stalin. His parents were Vladimir Spiridonovich Putin (1911\u20131999) and Maria Ivanovna Putina (\"n\u00e9e\" Shelomova; 1911\u20131998). Spiridon Putin, Vladimir Putin's grandfather, was a cook to Vladimir Lenin and Joseph Stalin. From 1985 to 1990, Putin worked for the KGB, the Soviet Union's secret spy service. Putin worked in Dresden, which was part of the former East Germany. After East Germany collapsed in 1989, Putin was told to come back to the Soviet Union. He chose to go to Leningrad, which is where he went to university. In June 1990, he started working in the International Affairs section of Leningrad State University. In June 1991, he was appointed head of the International Committee of the Saint Petersburg Mayor's office. His job was to promote international relations and foreign investments. Putin gave up his position in the KGB on August 20, 1991, during the putsch against Soviet President Mikhail Gorbachev. In 1994, he became First Deputy Chairman of the city of Saint Petersburg. In August 1996, he came to Moscow, and served in a variety of important positions in Boris Yeltsin's government.", "7 (Shostakovich)\n\nSymphony No. 7 in C major, Op. 60 is a symphony by Dmitri Shostakovich. It is also called the Leningrad symphony. It was composed in 1941. It is very long, lasting about 75 minutes. It was first performed by the Bolshoi Theatre Orchestra on 5 March 1942. Shostakovich was awarded a Stalin Prize by the Soviet government for the symphony. Shostakovich gave the symphony its title because it is about what was happening in Leningrad in 1941. It was during the World War II and the German army had invaded the Soviet Union and blocked communication between the city of Leningrad (now called St Petersburg) and the rest of the world. Conditions were terrible: the people hardly had any food to eat and they were very cold in the winter. About a million people died during the siege. Shostakovich lived in fear most of his life because if Josef Stalin, the Soviet dictator, did not like his music he could have been sent to prison or put to death. Sometimes Shostakovich was made a hero by the government and sometimes he was told that his music was not good because it was not in the style that the government thought he should write it in. The symphony was very popular at first in countries that fought on the same side as Russia in World War II, as well as in Russia. It was performed many times in the United States and the United Kingdom. Many people in these countries liked the symphony because it seemed to show the Russians as heroes fighting to save their city from the Germans. Later, during the Cold War, many people in these same countries did not like the work very much, because the Russians were now their enemies and they thought that music written there was propaganda meant to show Russia and its leaders as better than other countries and their leaders.", "Moscow is one of the world's largest cities. It is the most populous city that is only in Europe. It is also the largest urban and metropolitan area in Europe and the largest city by land area on the European continent. It was first wrote about in 1147. Moscow grew to become a powerful city that was the capital of the Grand Duchy of Moscow. Moscow stayed the political and economic center of the country when the Tsardom of Russia was made. When the Tsardom turned into the Russian Empire, the capital was moved from Moscow to Saint Petersburg which lowered the influence of the city. The capital was moved back to Moscow after the October Revolution. This brought the city back as the political center of the Russian SFSR and then the Soviet Union. After the dissolution of the Soviet Union, Moscow stayed the capital city of the new Russian Federation. Moscow is the northernmost and coldest megacity in the world. It has a history that goes through eight centuries. Moscow is a federal city of Russia since 1993 that is the political, economic, cultural, and scientific center of Russia and Eastern Europe. Moscow has one of the world's largest urban economies as an alpha world city. The city is one of the fastest-growing tourist destinations in the world, and it is one of Europe's most visited cities. Moscow is home to the seventh-highest number of billionaires of any city in the world. The Moscow International Business Center is one of the largest financial centers in Europe and the world. Moscow has most of Europe's tallest skyscrapers. Moscow was the host city of the 1980 Summer Olympics, and one of the host cities of the 2018 FIFA World Cup. Moscow is the home of many Russian artists, scientists, and sportspeople. The city also has several UNESCO World Heritage Sites. Moscow is well known for its Russian architecture.", "Boris Yeltsin was elected (democratically) the President of the Russian SFSR even though Gorbachev did not want him to come into power. Lithuania announced its independence from the Union and the Soviet government demanded it surrender its independence or it would send the Red Army to keep order. Gorbachev invented the idea of keeping the Soviet Union together with each republic being more independent but under the same leader. He wanted to call it the 'Union of Soviet Sovereign Republics' to keep the Russian initials as CCCP (USSR in English). A group of communist leaders, unhappy with Gorbachev's idea, tried to take over Moscow and stop the Soviet Union from collapsing. It only made people want independence more. Although he survived the attempted takeover, he lost all of his power outside of Moscow. Russia declared independence in December 1991. Later in the month, leaders of Russia, Byelorussia, and Ukraine signed a treaty called the Belavezha Agreement to dissolve the USSR, extremely angering Gorbachev. He had no choice but to accept the treaty and resigned on Christmas Day 1991. The Soviet Union's parliament (Supreme Soviet) made the Belavezha Agreement law, marking formally the dissolution of the Soviet Union. The next day, the Soviet flag was lowered from the Kremlin for the last time. Since 2013, the document that confirmed the dissolution of the Soviet Union has been missing. Made on July 20th, 1924, in Moscow, \"Sovetsky Sport\" was the first sports newspaper of the Soviet Union. Sports in the Soviet Union were highly prioritized and tightly controlled. The government invested heavily in athletic programs to showcase Soviet superiority. Success in sports was seen as a reflection of the political system's strength. The emphasis on Olympic success led to the development of talented athletes in various disciplines."], "reference_contexts": ["the country and the government. The city of St. Petersburg had been renamed Petrograd by the Tsar in 1914, but was renamed Leningrad in memory of Lenin in 1924. When the Soviet Union collapsed in 1991, Leningrad was again named St. Petersburg. Before Lenin died, he said he wished to be buried beside his mother. When he died, Stalin let the people in Russia look at his body. Because people kept coming they decided not to bury him, and preserved his body instead. A building was built in Red Square, Moscow over the body so that people could see it. It is called the Lenin Mausoleum. Many Russians and tourists still go there to see his body today. After Lenin died, Stalin used him to justify his own rule, by making it look like he was Lenin's chosen successor. Some Historians argue that Lenin laid the groundwork for the later development of totalitarian regimes, such as Nazi Germany under Adolf Hitler, Fascist Italy under Benito Mussolini, North Korea under the Kim Dynasty, and others. His consolidation of power, one-party rule, and suppression of opposition certainly contributed to this perception. Chemical change A chemical change (chemical reaction) is a change of materials into other materials with different properties. Chemical changes occur when a substance combines with another to form a new substance, or, chemical decomposition into two or more different substances. These processes are called chemical reactions. Burning of wood is a chemical change as new substances which cannot be changed back (e.g. carbon dioxide) are formed. For example, if wood is burned in a fireplace, there is not wood anymore but ash. Other examples include burning of a candle, rusting of iron, baking a cake, etc. Special details that describe how a chemical change takes place are called chemical properties. Compare: physical change. The opposite of a chemical change is a physical change. Physical changes are a change in which no new substances are formed, and the substance which is changed is the same. For instance, if a stick of wood is broken, there is still a stick of wood; it is just broken. More examples include changes of shape, changes of states, passing electricity through a copper wire, breaking of wood, shattering of glass, pouring of water, etc. Special details which do not change in a substance without new substances being formed are called physical properties. Anne Bront\u00eb Anne Bront\u00eb (17 January 1820 \u2013 28 May 1849) was an English writer and poet. She is best known for writing \"Agnes Grey\" (1847) and \"The Tenant of Wildfell Hall\" (1848). Anne was born on 17 January 1820 in Thornton, Yorkshire, England. She was the daughter of Patrick and Marie Bront\u00eb and the youngest of their six children. She was taught at her family's home in Haworth by her aunt Elizabeth Branwell. She worked as a governess in 1839 and then again between 1841 and 1845. In 1846 Anne contributed 21 poems to \"Poems by Currer, Ellis and Acton Bell\". This was a joint work with her sisters, Charlotte and Emily. \"Agnes Grey\" was published in 1847 in three volumes with \"Wuthering Heights\", a book written by her sister Emily. \"The Tenant of Wildfell Hall\" was published in 1848 and sold well. Anne Bront\u00eb died on 28 May 1849 in Scarborough, Yorkshire, England of tuberculosis."], "response": "Leningrad, originally named Saint Petersburg, holds historical significance in relation to Lenin and the Soviet Union for several reasons. After Lenin's death on January 24, 1924, the city of Petrograd was renamed Leningrad on January 26, 1924, in his honor [File: wiki_10.txt, Section: Saint Petersburg]. This renaming was a tribute to Lenin's impact on the Soviet Union and marked the city's connection to his legacy. Additionally, Leningrad played a significant role during World War II, enduring a prolonged siege by the German army, which resulted in severe hardships and the loss of about a million lives [File: wiki_27.txt, Section: Symphony No. 7 (Shostakovich)]. The city was later renamed back to Saint Petersburg in 1991 after the collapse of the Soviet Union [File: wiki_03.txt, Section: Vladimir Lenin].", "reference": "Leningrad was renamed in memory of Lenin in 1924 after the city of St. Petersburg had been renamed Petrograd by the Tsar in 1914. When the Soviet Union collapsed in 1991, Leningrad was again named St. Petersburg."}
{"user_input": "How did Napoleon influence the production of pencils during the Napoleonic Wars?", "retrieved_contexts": ["The Italians first thought of wooden holders. In 1560, an Italian couple named Simonio and Lyndiana Bernacotti created the first blueprints for the modern carpentry pencil to mark their carpentry pieces. Their version was instead a flat, oval, more compact type of pencil. They did this at first by hollowing out a stick of juniper wood. Shortly thereafter, a superior technique was discovered: two wooden halves were carved, a graphite stick inserted, and the two halves then glued together\u2013essentially the same method in use to this day. English and German pencils were not available to the French during the Napoleonic Wars. France was under naval blockade imposed by Great Britain and could not import the pure graphite sticks from the British Grey Knotts mines \u2013 the only known source in the world for solid graphite. France was also unable to import the inferior German graphite pencil substitute. It took the efforts of an officer in Napoleon's army to change this. In 1795, Nicholas Jacques Cont\u00e9 discovered a method of mixing powdered graphite with clay and forming the mixture into rods that were then fired in a kiln. By varying the ratio of graphite to clay, the hardness of the graphite rod could also be varied. This method of manufacture, which had been earlier discovered by the Austrian Joseph Hardtmuth of Koh-I-Noor in 1790, remains in use. In England, pencils continued to be made from whole sawn graphite. Henry Bessemer's first successful invention (1838) was a method of compressing graphite powder into solid graphite thus allowing the waste from sawing to be reused. American colonists imported pencils from Europe until after the American Revolution.", "American colonists imported pencils from Europe until after the American Revolution. Benjamin Franklin advertised pencils for sale in his \"Pennsylvania Gazette\" in 1729, and George Washington used a three-inch pencil when he surveyed the Ohio Territory in 1762. It is said that William Munroe, a cabinetmaker in Concord, Massachusetts, made the first American wood pencils in 1812. This was not the only pencil-making occurring in Concord. Henry David Thoreau discovered how to make a good pencil out of inferior graphite using clay as the binder; this invention was prompted by his father's pencil factory in Concord, which employed graphite found in New Hampshire in 1821 by Charles Dunbar. On 30 March 1858, Hymen Lipman received the first patent for attaching an eraser to the end of a pencil. In 1862 Lipman sold his patent to Joseph Reckendorfer for $100,000, who went to sue the pencil manufacturer Faber-Castell for infringement. In 1875, the Supreme Court of the United States ruled against Reckendorfer declaring the patent invalid. The metal band used to mate the eraser with pencil is called a ferrule. The first attempt to manufacture graphite sticks from powdered graphite was in Nuremberg, Germany in 1662. They used a mixture of graphite, sulfur and antimony. Though usable, they were not as good as the English pencils. English and German pencils were not available to the French during the Napoleonic wars. It took the efforts of an officer in Napoleon's army to change this. In 1795 Nicholas Jacques Cont\u00e9 discovered a method of mixing powdered graphite with clay and forming the mixture into rods which were then fired in a kiln.", "Napoleonic Wars\n\nThe Napoleonic Wars were fought during the rule of Napoleon Bonaparte over France. They started after the French Revolution ended, and Bonaparte became powerful in France in November 1799. War restarted between the United Kingdom and France in 1803 despite the Treaty of Amiens. The wars changed European military systems. Cannons became lighter and moved faster. Armies were much larger but had better food and supplies and were very large and destructive, mainly because of compulsory conscription. The French became powerful very fast and conquered most of Europe but then lost quickly after the French invasion of Russia failed. The Napoleonic Wars ended with the Second Treaty of Paris on 20 November 1815, just after the huge Battle of Waterloo, a large battle that the French lost. Napoleon was sent into exile, and the House of Bourbon ruled France again. Some people call the time between 20 April 1792 and 20 November 1815 \"the Great French War\". On one side were the France, the Kingdom of Italy and others. On the other side were Great Britain, Prussia, Austria, Russia, Sweden, Portugal, Spain, Sicily, and others. On May 18 1804, Napoleon Bonaparte was crowned Emperor of the French at Notre-Dame de Paris. The following year, the Third Coalition startedin response, but he crowned himself King of Italy. Austrian Emperor Franz I angrily declared war on him and began the War of the Third Coalition. The British destroyed the French Navy at the Battle of Trafalgar in October. In December the Austrians and the Russians allied and fought the French at the Battle of Austerlitz. The Russo-Austrian army suffered a devastating defeat and had to sign a treaty with Napoleon. In 1806, the War of the Fourth Coalition started. The Kingdom of Prussia declared war on France first but was crushed by Napoleon's troops at the Battle of Jena. Napoleon captured Berlin before the Russians could help.", "Vincent Cronin disagrees with the view, saying that most of the Napoleonic Wars were started by Napoleon's enemies. Others argue that Napoleon made the mistake of trying to conquer too much land and that if he had stopped in 1808, his enemies might have left him alone. Other historians have said that he was a good ruler. They usually focus on the changes he brought to France and the countries he conquered. Andrew Roberts lists the greatest ideas that Napoleon brought to France and other countries as the Napoleonic code, freedom of religion, better civil services, better education, more equality, support for science and art and others. In popular culture, the \"Napoleon complex\", also known as \"Napoleon syndrome\" and \"short man syndrome\", is a purported condition normally attributed to people of short stature, with overly aggressive or domineering social behavior, and is named after Napoleon Bonaparte, who was estimated to have been 5' 2\" tall (in pre\u2013metric system French measures), which equals around 1.67 meters, or just under 5' 6\" in imperial measure.", "Napoleon was again captured and taken to his second exile on the island of Saint Helena on the Atlantic Ocean. Napoleon was sent to the island of Saint Helena, off the coast of Africa. He died on May 5 1821 of stomach cancer. Napoleon kept himself up to date of the events through The Times and hoped for release in the event that Henry Vassall-Fox, 3rd Baron Holland became Prime Minister. There were other plots to rescue Napoleon from captivity including one from Texas, where exiled soldiers from the Grande Arm\u00e9e wanted a resurrection of the Napoleonic Empire in America. There was even a plan to rescue him with a primitive submarine. For Lord Byron, Napoleon was the epitome of the Romantic hero, the persecuted, lonely and flawed genius. The news that Napoleon had taken up gardening at Longwood also appealed to more domestic British sensibilities. French people remain proud of Napoleon's glory days. The Napoleonic Code reflects the modern French Constitution. Weapons and other kinds of military technology remained largely static through the Revolutionary and Napoleonic eras, but 18th century operational mobility underwent significant change. Napoleon's biggest influence was in the conduct of warfare. His popularity would later help his nephew Louis-Napol\u00e9on to become ruler of France more than 30 years later. On the world stage, Napoleon's conquest spread the ideas of the revolution. He failed to make Europe into a French Empire. Instead, he sparked nationalist feeling across Europe. He was also known as \u201cThe Leader Of France\u201d. Historians have many different views on Napoleon. Some historians say that he caused wars that killed many people in Europe, and therefore he was a bad ruler. Vincent Cronin disagrees with the view, saying that most of the Napoleonic Wars were started by Napoleon's enemies.", "Napoleon captured Berlin before the Russians could help. In 1807, Napoleon defeated the Russian army at the Battle of Friedland, which ended the Fourth Coalition. In 1809, the War of the Fifth Coalition began by Austria declaring war on Napoleon. In the early phases of the war, the Austrians had advantage of the war, but later the French captured Vienna and ended the Fifth Coalition. At the height of his power in 1810, Napoleon had controlled France, Spain, northern Italy, Germany and part of Russia. In 1808, the Peninsular War began when Napoleon crowned his brother Joseph Bonaparte as King of Spain, and France fought British, Spanish, and Portuguese troops. In 1809, the Finnish War began between Russia and Sweden after Sweden and Portugal made peace with France. That led to the annexation of Finland by Russia and the decisive failure of Sweden. In 1811, France and Russia made disagreements again, and Napoleon allied with Prussia and Austria and invaded Russia. Napoleon staged a French invasion of Russia in 1812 by gathering the largest army that Europe and possibly the whole world had ever seen, just as the Americans and the British started the War of 1812. In Russia, Napoleon barely won the huge Battle of Borodino but lost many of his soldiers. Napoleon hoped to make peace with the Russias, but they decided to retreat and abandon Moscow to the advancing French troops. Napoleon found Moscow empty and burning. The cold winter along with starvation from scorched earth tactics devastated Napoleon's army. That was the first important defeat in his conquest of Europe Napoleon's weakened \"Grande Arm\u00e9e\" had to retreat to Paris through the freezing winter of Russia but was finally defeated by the Russians. Prussia and Austria declared war after Napoleon's failure and began the War of the Sixth Coalition.", "The defeat of the Royalist rebellions ended the threat to the Convention and earned Bonaparte sudden fame, wealth, and the patronage of the new Directory. On March 9, 1796, Napoleon married Josephine de Beauharnais, a widow older than he was and a very unlikely wife to the future ruler. The campaign in Italy is the first time Napoleon led France to war. Late in March 1796, Bonaparte began a series of operations to divide and defeat the Austrian and Sardinian armies in Italy. He defeated the Sardinians in April 21, bringing Savoy and Nice into France. Then, in a series of brilliant battles, he won Lombardy from the Austrians. Mantua, the last Lombard stronghold fell in February 1797. In May 1798, General Napoleon left for a campaign in Egypt. The French needed to threaten British India and the French Directory was concerned that Napoleon would take control of France. The French Army under Napoleon won an overwhelming victory in the Battle of Pyramids. Barely 300 French soldiers died, while thousands of Mamluks (an old power in the Middle East) were killed. But his army was weakened by bubonic plague and poor supplies because the Navy was defeated at the Battle of the Nile. The Egyptian campaign was a military failure but a cultural success. The Rosetta Stone was found by French engineer Captain Pierre-Fran\u00e7ois Bouchard, and French scholar Jean-Fran\u00e7ois Champollion was able to read the words in the stone. Napoleon went back to France because of a change in the French government. Some believe that Napoleon should not have left his soldiers in Egypt. Napoleon helped lead the Brumaire coup d'\u00e9tat of November 1799. Bonaparte returned to Paris in October 1799. France's situation had been improved by a series of victories but the Republic was bankrupt, and the ineffective Directory was unpopular with the French population."], "reference_contexts": ["Pencil A pencil is a kind of writing equipment that is also used to draw, usually on paper. Most pencil cores are made of graphite powder mixed with a clay binder. So, a pencil is usually made with a piece of graphite mixed with clay that has a wood case around it. The shape is usually a hexagonal prism but some pencils are square or cylinder. Colored pencils are a kind that do not use greyish silver graphite. Instead, the core is colorful. Colored pencils or crayons are usually meant for drawing rather than writing. The important difference between pens and pencils is that the tip of a pencil is made of solid graphite (or other material) which is rubbed off onto the paper. A pen has a tip, usually made of metal, with liquid ink coming out and onto the paper. Writing with a pen can smudge when it is still wet. Writing from a pencil can be erased, but writing from a pen usually cannot, unless it uses a special type of ink and eraser. An early writing tool was the reed pen used by ancient Egyptians, who wrote with ink on sheets of papyrus paper. Another early writing instrument was the stylus, which was a thin stick of wood or metal, often lead. It was used for scratching onto black wax that covered white wood, a method used by the Romans. The word \"pencil\" comes from the Latin word which means \"little tail\". It is an invention of the 16th century in England. Some time before 1565 (it may have been as early as 1500), a large deposit of graphite was found in Borrowdale, Cumbria. The locals found that it was very useful for marking sheep. This deposit of graphite was extremely pure and solid, and it could easily be sawn into sticks. This is still the only large scale deposit of graphite ever found in this solid form. Chemistry was in its early stages and the substance was thought to be a form of lead. Consequently, it was called \"plumbago\" (Latin for \"lead ore\"). The black core of pencils is still referred to as \"lead\", even though it never had the element lead. The value of graphite was soon realized, mainly because it could be used to line the moulds for cannonballs. The mines were taken over by the Crown and guarded. When enough stocks of graphite had been added up, the mines were flooded to prevent theft until more was needed. Graphite had to be sneakily moved out for use in pencils. Because graphite is soft, it requires some form of holder. Graphite sticks were at first wrapped in string or in sheepskin for stability. The news of the usefulness of these early pencils spread far and wide, attracting the attention of artists all over the known world. England continued to have a monopoly on the production of pencils until a method of reconstituting the graphite powder was found. The distinctively square English pencils continued to be made with sticks cut from natural graphite into the 1860s. The town of Keswick, near the original findings of block graphite, has a pencil museum. The first attempt to manufacture graphite sticks from powdered graphite was in Nuremberg, Germany, in 1662. It used a mixture of graphite, sulphur, and antimony. Residual graphite from a pencil stick is not poisonous, and graphite is harmless if consumed. The Italians first thought of wooden holders. In 1560, an Italian couple named Simonio and Lyndiana Bernacotti created the first blueprints for the modern carpentry pencil to mark their carpentry pieces. Their version was instead a flat, oval, more compact type of pencil. They did this at first by hollowing out a stick of juniper wood. Shortly thereafter, a superior technique was discovered: two wooden halves were carved, a graphite stick inserted, and the two halves then glued together\u2013essentially the same method in use to this day. English and German pencils were not available to the French during the Napoleonic Wars. France was under naval blockade imposed by Great Britain and could not import the pure graphite sticks from the British Grey Knotts mines \u2013 the only known source in the world for solid graphite. France was also unable to import the inferior German graphite pencil substitute. It took the efforts of an officer in Napoleon's army to change this. In 1795, Nicholas Jacques Cont\u00e9 discovered a method of mixing powdered graphite with clay and forming the mixture into rods that were then fired in a kiln. By varying the ratio of graphite to clay, the hardness of the graphite rod could also be varied. This method of manufacture, which had been earlier discovered by the Austrian Joseph Hardtmuth of Koh-I-Noor in 1790, remains in use. In England, pencils continued to be made from whole sawn graphite. Henry Bessemer's first successful invention (1838) was a method of compressing graphite powder into solid graphite thus allowing the waste from sawing to be reused. American colonists imported pencils from Europe until after the American Revolution. Benjamin Franklin advertised pencils for sale in his \"Pennsylvania Gazette\" in 1729, and George Washington used a three-inch pencil when he surveyed the Ohio Territory in 1762. It is said that William Munroe, a cabinetmaker in Concord, Massachusetts, made the first American wood pencils in 1812. This was not the only pencil-making occurring in Concord. Henry David Thoreau discovered how to make a good pencil out of inferior graphite using clay as the binder; this invention was prompted by his father's pencil factory in Concord, which employed graphite found in New Hampshire in 1821 by Charles Dunbar. On 30 March 1858, Hymen Lipman received the first patent for attaching an eraser to the end of a pencil. In 1862 Lipman sold his patent to Joseph Reckendorfer for $100,000, who went to sue the pencil manufacturer Faber-Castell for infringement. In 1875, the Supreme Court of the United States ruled against Reckendorfer declaring the patent invalid. The metal band used to mate"], "response": "During the Napoleonic Wars, France was unable to import pure graphite sticks from the British Grey Knotts mines due to a naval blockade imposed by Great Britain. This led to an officer in Napoleon's army, Nicholas Jacques Cont\u00e9, discovering a method in 1795 to mix powdered graphite with clay and form it into rods, which were then fired in a kiln. This method allowed for the production of pencils with varying hardness and remains in use today [File: wiki_03.txt, Section: Pencil].", "reference": "During the Napoleonic Wars, France was under a naval blockade imposed by Great Britain, which prevented the import of pure graphite sticks from British mines. Consequently, France could not access the high-quality English pencils or the inferior German substitutes. An officer in Napoleon's army, Nicholas Jacques Cont\u00e9, discovered a method in 1795 to mix powdered graphite with clay to create rods that could be fired in a kiln. This innovation allowed for the production of pencils in France despite the blockade."}
{"user_input": "What significant contribution did Nicholas Jacques Cont\u00e9 make to pencil manufacturing?", "retrieved_contexts": ["In 1795 Nicholas Jacques Cont\u00e9 discovered a method of mixing powdered graphite with clay and forming the mixture into rods which were then fired in a kiln. By varying the ratio of graphite to clay, the hardness of the graphite rod could also be varied (the more clay, the harder the pencil, and the lighter the color of the mark). This method of making pencils is still used today. Today, pencils are made industrially by mixing finely ground graphite and clay powders, adding water, forming long spaghetti-like strings, and firing them in a kiln. The resulting strings are dipped in oil or molten wax which seeps into the tiny holes of the material, resulting in smoother writing. A juniper or incense-cedar plank with several long parallel grooves is cut to make something called a slate, and the graphite/clay strings are inserted into the grooves. Another grooved plank is glued on top, and the whole thing is then cut into individual pencils, which are then varnished or painted. A few common brands of colored pencils (among other items) are Crayola, RoseArt, Derwent, Faber Castell, Caran d'ache, and Cra-Z-Art.", "American colonists imported pencils from Europe until after the American Revolution. Benjamin Franklin advertised pencils for sale in his \"Pennsylvania Gazette\" in 1729, and George Washington used a three-inch pencil when he surveyed the Ohio Territory in 1762. It is said that William Munroe, a cabinetmaker in Concord, Massachusetts, made the first American wood pencils in 1812. This was not the only pencil-making occurring in Concord. Henry David Thoreau discovered how to make a good pencil out of inferior graphite using clay as the binder; this invention was prompted by his father's pencil factory in Concord, which employed graphite found in New Hampshire in 1821 by Charles Dunbar. On 30 March 1858, Hymen Lipman received the first patent for attaching an eraser to the end of a pencil. In 1862 Lipman sold his patent to Joseph Reckendorfer for $100,000, who went to sue the pencil manufacturer Faber-Castell for infringement. In 1875, the Supreme Court of the United States ruled against Reckendorfer declaring the patent invalid. The metal band used to mate the eraser with pencil is called a ferrule. The first attempt to manufacture graphite sticks from powdered graphite was in Nuremberg, Germany in 1662. They used a mixture of graphite, sulfur and antimony. Though usable, they were not as good as the English pencils. English and German pencils were not available to the French during the Napoleonic wars. It took the efforts of an officer in Napoleon's army to change this. In 1795 Nicholas Jacques Cont\u00e9 discovered a method of mixing powdered graphite with clay and forming the mixture into rods which were then fired in a kiln.", "The Italians first thought of wooden holders. In 1560, an Italian couple named Simonio and Lyndiana Bernacotti created the first blueprints for the modern carpentry pencil to mark their carpentry pieces. Their version was instead a flat, oval, more compact type of pencil. They did this at first by hollowing out a stick of juniper wood. Shortly thereafter, a superior technique was discovered: two wooden halves were carved, a graphite stick inserted, and the two halves then glued together\u2013essentially the same method in use to this day. English and German pencils were not available to the French during the Napoleonic Wars. France was under naval blockade imposed by Great Britain and could not import the pure graphite sticks from the British Grey Knotts mines \u2013 the only known source in the world for solid graphite. France was also unable to import the inferior German graphite pencil substitute. It took the efforts of an officer in Napoleon's army to change this. In 1795, Nicholas Jacques Cont\u00e9 discovered a method of mixing powdered graphite with clay and forming the mixture into rods that were then fired in a kiln. By varying the ratio of graphite to clay, the hardness of the graphite rod could also be varied. This method of manufacture, which had been earlier discovered by the Austrian Joseph Hardtmuth of Koh-I-Noor in 1790, remains in use. In England, pencils continued to be made from whole sawn graphite. Henry Bessemer's first successful invention (1838) was a method of compressing graphite powder into solid graphite thus allowing the waste from sawing to be reused. American colonists imported pencils from Europe until after the American Revolution.", "There is evidence to suggest that a patient's wealth plays an important role in how they receive medical treatment. Historically, Romanian researches and inventors have made notable contributions to several fields, such as: aeronautics, medicine, mathematics, computer science/engineering, physics, biophysics, chemistry, biochemistry and biology. In the history of flight, Traian Vuia and Aurel Vlaicu built and flew some of the earliest successful aircraft, while Henri Coand\u0103 discovered the Coand\u0103 effect of fluidics. Preceding him, Elie Carafoli was a pioneering contributor to the field of aerodynamics in the world. Victor Babe\u015f discovered more than 50 germs and a cure for a disease named after him, babesiosis; biologist Nicolae Paulescu discovered insulin. Another biologist, Emil Palade, received the Nobel Prize for his contributions to cell biology. George Constantinescu created the theory of sonics, while Laz\u0103r Edeleanu was the first chemist to synthesize amphetamine and also invented the modern method of refining crude oil. Costin Neni\u0163escu found new methods for the synthesis of pirilium salts, of carbenes, tryptamine, serotonin, two new syntheses for the indole nucleus, and a new method of polymerisation of ethylene. Several mathematicians distinguished themselves as well, among them: Gheorghe \u0162i\u0163eica, Spiru Haret, Grigore Moisil, Miron Nicolescu, Nicolae Popescu and \u015etefan Odobleja; the latter is also regarded as the ideological father behind cybernetics."], "reference_contexts": ["the eraser with pencil is called a ferrule. The first attempt to manufacture graphite sticks from powdered graphite was in Nuremberg, Germany in 1662. They used a mixture of graphite, sulfur and antimony. Though usable, they were not as good as the English pencils. English and German pencils were not available to the French during the Napoleonic wars. It took the efforts of an officer in Napoleon's army to change this. In 1795 Nicholas Jacques Cont\u00e9 discovered a method of mixing powdered graphite with clay and forming the mixture into rods which were then fired in a kiln. By varying the ratio of graphite to clay, the hardness of the graphite rod could also be varied (the more clay, the harder the pencil, and the lighter the color of the mark). This method of making pencils is still used today. Today, pencils are made industrially by mixing finely ground graphite and clay powders, adding water, forming long spaghetti-like strings, and firing them in a kiln. The resulting strings are dipped in oil or molten wax which seeps into the tiny holes of the material, resulting in smoother writing. A juniper or incense-cedar plank with several long parallel grooves is cut to make something called a slate, and the graphite/clay strings are inserted into the grooves. Another grooved plank is glued on top, and the whole thing is then cut into individual pencils, which are then varnished or painted. A few common brands of colored pencils (among other items) are Crayola, RoseArt, Derwent, Faber Castell, Caran d'ache, and Cra-Z-Art. Parliament A parliament is a type of legislature. The most famous parliament is probably the Parliament of the United Kingdom, which is sometimes called the \"Mother of all Parliaments\". The word \"parliament\" comes from the French word \"parler\", which means a talk. The Althing, the national parliament of Iceland, was founded earlier (930 AD), so it is the oldest legislature in the world still existing. However, the Althing did not function as a legislature for four centuries, and its role as a \"primary\" legislature is modern. Other parliaments have copied the UK and work similarly. They have three levels - a lower house which makes the law, an upper house which reviews the law (Decides if they like it or not, and suggest changes to it), and a head of state who is mostly for show and who starts and ends each year of parliament. The Prime Minister is almost always the person whose party has the most seats, but if the lower house does not think he is doing a good job they can call a vote of no confidence and ask him to leave his job as Prime Minister or have an election. Sometimes people use the word \"parliament\" to describe a legislature, even if it is not a real parliament. A \"parliament\" is a type of legislature which has a Prime Minister. A parliament is a lot like a congress but a congress cannot ask the head of the government to leave his job. Also, a congress runs for a number of years according to the country's constitution, but a parliament can be stopped as long as enough members agree. Elections are held after this happens."], "response": "Nicholas Jacques Cont\u00e9 discovered a method of mixing powdered graphite with clay and forming the mixture into rods, which were then fired in a kiln. This method allowed for varying the hardness of the graphite rod by adjusting the ratio of graphite to clay. This technique, discovered in 1795, is still used in pencil manufacturing today [File: wiki_03.txt, Section: Pencil].", "reference": "In 1795, Nicholas Jacques Cont\u00e9 discovered a method of mixing powdered graphite with clay to form rods, which were then fired in a kiln. This method allowed for the variation of the hardness of the graphite rod by adjusting the ratio of graphite to clay, a technique that is still used in pencil manufacturing today."}
{"user_input": "In the context of urban planning, how does storm surge contribute to flooding, particularly in economically vibrant regions like Hong Kong?", "retrieved_contexts": ["Storm surge\n\nA storm surge is a sudden rise of water hitting areas close to the coast. Storm surges are usually created by a hurricane or other tropical cyclone. The surge happens because a storm has fast winds and low atmospheric pressure. Water is pushed on shore, and the water level rises. Strong storm surges can flood coastal towns and destroy homes. A storm surge is considered the deadliest part of a hurricane. They kill many people each year.", "Flood damage can be prevented by moving away from places that flood. However, people have long liked to have their homes and businesses alongside water because water is good for agriculture and transport and in other ways. Floods are also caused due to improper management of drains. Rainfall is the most common cause. Snow melt is also a cause of flooding. Tsunamis and Storm Surge are less common ways that floods happen. Coastal Flooding is another common cause of flooding, and this is caused by low pressure systems or storms.You can control floods by improving the drainage and grading of your home. Installing a flood detection system in your home also helps to prevent flooding.", "Flood\n\nA flood is an overflow of water. Floods are very hard to deal with. This is most commonly due to an overflowing river, a dam break, snowmelt, or heavy rainfall. Less commonly happening are tsunamis, storm surge. The most deadly flooding was in 1931 in China and killed between 20,00,000 and 40,00,000 people. The Kerala flood in India was another flood that has destroyed people's houses. During a flood, people try to move themselves and their most precious belongings to higher ground quickly. The process of leaving homes in search of a safe place is called a flood evacuation. Floods have inspired myths and legends, especially the story of the great flood. During a flood there is plenty of water logging and overflow of water, it is mostly polluted and not safe to drink. If people drink this dirty water, they may suffer from diseases such as typhoid and cholera, hepatitis and other such diseases. People can get ready to survive a flood by filling many containers with fresh and clean drinking water and storing other emergency supplies; like: medicine and food. During flood people try to go to higher sides because the flood water wouldn't reach high areas. Also drains overflow and mix with clean water and people who drink it might fall ill. Flooding is usually caused when a volume of water within a water body, such as a lake, overflows outside it.Sometimes if a dam breaks, it suddenly releases a large amount of water. The result is that some of the water travels to land, and 'floods' the area. Many rivers are in a channel, between river banks. They flood when the strength of the river causes it to flow beyond the banks. This is more common at bends or meanders. Flood damage can be prevented by moving away from places that flood.", "These and the other cities have either started trying to deal with rising sea level and related storm surge, or are discussing this, according to . All other coastal cities are in some danger.", "Hong Kong\n\nHong Kong (; , , literally \"Fragrant Port\"), officially The Hong Kong Special Administrative Region of The People's Republic of China, is one of two Special Administrative Regions (SARs) of the People's Republic of China (the other is Macau). It is one of the richest and most developed parts in the world, and one where the cost of living is one of the highest. Hong Kong grew quickly in the decades after World War II, becoming a famous world-class financial centre. Hong Kong was one of the last territories of the British Empire until 1997, when United Kingdom handed it over to China. China then promised to grant it special status for 50 years. The population of Hong Kong is over seven million. The economy has rapidly grown from a trading port to a very rich city. Hong Kong has the most skyscrapers in the world. Hong Kong is divided into 3 main parts: Hong Kong was a British colony from 1842 to 1997 as China surrendered the city after losing the Second Opium War. After the handover in 1997, Hong Kong became under Chinese control under special status. Hong Kong has its own constitution that is different from that of the People's Republic of China (PRC). Hong Kong is in a sub-tropical area, and has monsoon winds. It is cool and wet in winter (January-March), hot and rainy from spring through summer (April-September), and warm, sunny and dry in the autumn (October-December). The rainy season is from May until September. In summer and early autumn, there is a frequent threat of typhoons. The population of Hong Kong reached 7 million (7,413,070) in 2021. Most of the people in Hong Kong are Chinese. Hong Kong is one of the most densely populated countries in the world."], "reference_contexts": ["Neuron A neuron (or neurone) is a nerve cell that carries electrical impulses. Neurons are the basic units of our nervous system. Neurons have a cell body (\"soma\" or \"cyton\"), dendrites and an axon. Dendrites and axons are nerve fibers. There are about 86 billion neurons in the human brain. Almost all brain cells are neurons. The human brain has about 16 billion neurons in the cerebral cortex. The neurons are supported by glial cells and astrocytes. Neurons are connected to one another, but they do not actually touch each other. Instead they have tiny gaps called synapses. These gaps are chemical synapses or electrical synapses which pass the signal from one neuron to the next. Flood A flood is an overflow of water. Floods are very hard to deal with. This is most commonly due to an overflowing river, a dam break, snowmelt, or heavy rainfall. Less commonly happening are tsunamis, storm surge. The most deadly flooding was in 1931 in China and killed between 20,00,000 and 40,00,000 people. The Kerala flood in India was another flood that has destroyed people's houses. During a flood, people try to move themselves and their most precious belongings to higher ground quickly. The process of leaving homes in search of a safe place is called a flood evacuation. Floods have inspired myths and legends, especially the story of the great flood. During a flood there is plenty of water logging and overflow of water, it is mostly polluted and not safe to drink. If people drink this dirty water, they may suffer from diseases such as typhoid and cholera, hepatitis and other such diseases. People can get ready to survive a flood by filling many containers with fresh and clean drinking water and storing other emergency supplies; like: medicine and food. During flood people try to go to higher sides because the flood water wouldn't reach high areas. Also drains overflow and mix with clean water and people who drink it might fall ill. Flooding is usually caused when a volume of water within a water body, such as a lake, overflows outside it.Sometimes if a dam breaks, it suddenly releases a large amount of water. The result is that some of the water travels to land, and 'floods' the area. Many rivers are in a channel, between river banks. They flood when the strength of the river causes it to flow beyond the banks. This is more common at bends or meanders. Flood damage can be prevented by moving away from places that flood. However, people have long liked to have their homes and businesses alongside water because water is good for agriculture and transport and in other ways. Floods are also caused due to improper management of drains. Rainfall is the most common cause. Snow melt is also a cause of flooding. Tsunamis and Storm Surge are less common ways that floods happen. Coastal Flooding is another common cause of flooding, and this is caused by low pressure systems or storms.You can control floods by improving the drainage and grading of your home. Installing a flood detection system in your home also helps to prevent flooding."], "response": "Storm surges contribute to flooding by causing a sudden rise of water that hits coastal areas. This is particularly relevant in economically vibrant regions like Hong Kong, which are often located near the coast and face threats from tropical cyclones. The fast winds and low atmospheric pressure associated with these storms push water onshore, raising water levels and potentially flooding coastal towns and infrastructure. This can lead to significant damage in densely populated and economically important areas [File: wiki_29.txt, Section: Storm surge].", "reference": "Storm surge is a less common cause of flooding, which occurs due to low pressure systems or storms. In economically vibrant regions like Hong Kong, storm surge can significantly contribute to coastal flooding, exacerbating the challenges faced by urban planners in developing sustainable solutions for densely populated areas."}
{"user_input": "In the context of urban planning, how does the presence of mica in granite influence the selection of materials for sustainable construction in densely populated cities like Hong Kong?", "retrieved_contexts": ["Granite\n\nGranite is a kind of igneous rock, found on Earth but nowhere else in the Solar System. It is formed from hot, molten magma. Its colour can be dark or light grey, brown, or even pink, according to the proportions of its minerals. It is called a plutonic rock because it forms under ground. The magma is forced between other layers of rock by the pressure under the Earth's surface. The magma cools and turns slowly into solid stone. Granite has many different types of minerals in it. These include quartz, feldspar, hornblende, and sometimes mica. As the magma cools, these minerals form crystals. The crystals can be seen easily if the granite is cut and polished. Granite is a common stone on Earth, and makes up a big part of the crust (the Earth's outer layer). It is usually found in the continental plates of the Earth's crust. Although it forms under the surface of the Earth, there are many places where it has been forced upwards by tectonic movement. When plates in the Earth's crust move together, they get bent and pushed upwards. When this happens, granite mountains can be formed. Granite forms from silica-rich (felsic) magmas. It is the most abundant basement rock. It lies under the thin sedimentary rocks which cover the continents A worldwide average of the chemical composition of granite, by weight percent, based on 2485 analyses: Granite is dense, and can be cut, carved and shaped. It is resistant to water and pollution, and has a range of different colours. Kitchen benches are often made of polished granite. Granite is found in many countries of the world. Some countries have beautifully patterned granite which is quarried (cut in open mines) and sold for building material. 1970", "Concrete\n\nConcrete is an important material for making different buildings and structures. It is a composite made of Portland cement, sand, gravel or rock aggregate, and water. The amount of each can change depending upon what the concrete will be used for. Concrete is used more than any other man-made material in the world. As of 2006, about 7.5 billion cubic meters of concrete are made each year\u2014more than one cubic meter for every person on Earth. The ingredients are mixed together into a paste, a bit like making dough for bread. The concrete is then poured into a frame. After a few hours it sets hard. Concrete solidifies due to a chemical reaction known as hydration. The water reacts with the cement, which bonds the other components together, eventually creating a strong stone-like material. Concrete is used to make pavements, pipe, architectural structures, dams, foundations, motorways, bridges, multi-story parking, walls, footings for gates, fences and poles and even boats. Its biggest advantage is that it bonds together bricks and stones better than any other method known to mankind. Concrete is strong in compression but weak in tension. For some purposes it needs to be reinforced with steel rods. Reinforced concrete buildings can be made to link all the parts together, the foundations, walls, floors and roofs, but concrete construction does not make buildings earthquake-proof. Concrete is as old as 5600 BC. It was not invented by Romans, but much used by them. Some kinds of concrete are waterproof, and some kinds even set underwater. Its importance was great for civilizations which were not in near-desert conditions. They needed something to stand up to the rain. Fired bricks and concrete were two things they invented. These inventions let you build almost anywhere on land.", "Stone\n\nA stone is a piece of rock. It is a mass of hard, compacted mineral. The word is often used to mean a small piece of rock. The word \"stone\" also refers to natural rock as a material, especially a building material. Natural stones used as building material include granite, marble and sandstone. Manufactured, artificial products, such as concrete or clay bricks, are not stone. Stone takes a while to heat up, and stays hot for a while. It does not conduct electricity well Stone was one of the first materials used to make tools and buildings. It is a very sturdy material. It is less affected by weather than wood or brick. Depending on the type of rock, stone weathers away much more slowly. A stone in the river is reshaped by the water and sediment flowing around it. Stones can be used as primitive weapons. A person can throw it at an enemy or animal, or use it to cause more damage in hand-to-hand combat. A stone is larger than a grain of sand, gravel or pebbles. A boulder is a large rock or stone."], "reference_contexts": ["Granite Granite is a kind of igneous rock, found on Earth but nowhere else in the Solar System. It is formed from hot, molten magma. Its colour can be dark or light grey, brown, or even pink, according to the proportions of its minerals. It is called a plutonic rock because it forms under ground. The magma is forced between other layers of rock by the pressure under the Earth's surface. The magma cools and turns slowly into solid stone. Granite has many different types of minerals in it. These include quartz, feldspar, hornblende, and sometimes mica. As the magma cools, these minerals form crystals. The crystals can be seen easily if the granite is cut and polished. Granite is a common stone on Earth, and makes up a big part of the crust (the Earth's outer layer). It is usually found in the continental plates of the Earth's crust. Although it forms under the surface of the Earth, there are many places where it has been forced upwards by tectonic movement. When plates in the Earth's crust move together, they get bent and pushed upwards. When this happens, granite mountains can be formed. Granite forms from silica-rich (felsic) magmas. It is the most abundant basement rock. It lies under the thin sedimentary rocks which cover the continents A worldwide average of the chemical composition of granite, by weight percent, based on 2485 analyses: Granite is dense, and can be cut, carved and shaped. It is resistant to water and pollution, and has a range of different colours. Kitchen benches are often made of polished granite. Granite is found in many countries of the world. Some countries have beautifully patterned granite which is quarried (cut in open mines) and sold for building material. 1970 1970 (MCMLXX) was ."], "response": "My knowledge base does not provide information for this query.", "reference": "Mica is one of the minerals found in granite, which is a common stone on Earth and makes up a significant part of the Earth's crust. The presence of mica in granite can influence the selection of materials for sustainable construction due to granite's density, resistance to water and pollution, and its aesthetic appeal when polished. These properties make granite, including its mica content, a suitable choice for building materials in urban environments, contributing to the development of sustainable solutions in economically vibrant regions."}
{"user_input": "Wht is the radius of the observable universe according to the context?", "retrieved_contexts": ["The observable Universe contains more than 2 trillion (10) galaxies and, overall, as many as an estimated stars (more stars than all the grains of sand on planet Earth). Typical galaxies range from dwarf galaxies with as few as ten million (10) stars up to giants with one trillion (10) stars, all orbiting the galaxy's center of mass. Thus, a rough estimate from these numbers would suggest there are around one sextillion (10) stars in the observable Universe; though a 2003 study by Australian National University astronomers resulted in a figure of 70 sextillion (7 x 10). The matter that can be seen is spread throughout the Universe when averaged over distances longer than 300 million light-years. However, on smaller length-scales, matter is observed to form 'clumps', many atoms are condensed into stars, most stars into galaxies, most galaxies into galaxy groups and clusters and, lastly, the largest-scale structures such as the Great Wall of galaxies. The present overall density of the Universe is very low, roughly 9.9 \u00d7 10 grams per cubic centimetre. This mass-energy appears to consist of 73% dark energy, 23% cold dark matter and 4% ordinary matter. The density of atoms is about a single hydrogen atom for every four cubic meters of volume. The properties of dark energy and dark matter are not known. Dark matter slows the expansion of the universe. Dark energy makes its expansion faster. The Universe is old, and changing. The best good guess of the Universe's age is 13.798\u00b10.037 billion years old, based on the cosmic microwave background radiation. Independent estimates (based on measurements such as radioactive dating) agree, although they are less precise, ranging from 11 to 20 billion years. to 13\u201315 billion years.", "Radius\n\nIn geometry, the radius of a circle or sphere, written as formula_1, is the shortest connection between the center and the boundary. It is either the distance from the center to the perimeter (in the case of a circle), or the distance from the center to the surface (in the case of a sphere). It is half of the diameter. That is, when \"r\" is the radius and \"d\" is the diameter: \"r\" = \"d\" \u00f7 2 \"d\" = 2 x \"r\" = \"r\" + \"r\" The relationship between the radius formula_2 and the circumference formula_3 of a circle is formula_4 The area formula_5 of a circle of radius formula_2 is formula_7", "Shape of the universe\n\nThe shape of the Universe cannot be discussed with everyday terms, because all the terms need to be those of Einsteinian relativity. The geometry of the universe is therefore not the ordinary Euclidean geometry of our everyday lives. According to the special theory of relativity, it is impossible to say whether two distinct events occur at the same time if those events are separated in space. To speak of \"the shape of the universe (at a point in time)\" is naive from the point of view of special relativity. Due to the relativity of simultaneity we cannot speak of different points in space as being \"at the same point in time\" nor, therefore, of \"the shape of the universe at a point in time\". What astrophysicists do is ask whether a particular model of the universe is consistent with what is known through observations and measurements of the universe. If the observable universe is smaller than the entire universe (in some models it is many orders of magnitude smaller or even infinitesimal), observation is limited to a part of the whole. Consideration of the shape of the universe can be split into two:<br> The observable universe is the basis for testing any model of the universe. It is a spherical volume (a ball) centered on the observer, regardless of the shape of the universe as a whole. Every location in the universe has its own observable universe, which may or may not overlap with the one centered on Earth. Recent measurements have led NASA to state, \"We now know that the universe is flat with only a 0.4% margin of error\". Within one model, the FLRW model, the present most popular shape of the Universe found to fit observational data is the infinite flat model. There are other models that also fit the data.", "This means the light will never be able to reach us here on Earth, so we will never be able to see these parts of the universe. We call the part of the universe we can see the observable universe. The word \"universe\" comes from the Old French word \"univers\", which comes from the Latin word \"universum\". The Latin word was used by Cicero and later Latin authors in many of the same senses as the modern English word is used. A different theory is an early Greek model of the universe. In that model, all matter was in rotating spheres centered on the Earth; according to Aristotle, the rotation of the outermost sphere was responsible for the motion and change of everything within. It was natural for the Greeks to assume that the Earth was stationary and that the heavens rotated about the Earth, because careful astronomical and physical measurements are needed to prove otherwise. The most common term for \"universe\" among the ancient Greek philosophers from Pythagoras onwards was \"\u03c4\u03bf \u03c0\u03b1\u03bd\" (The All), defined as all matter (\"\u03c4\u03bf \u03bf\u03bb\u03bf\u03bd\") and all space (\"\u03c4\u03bf \u03ba\u03b5\u03bd\u03bf\u03bd\"). The broadest word meaning of the Universe is found in \"De divisione naturae\" by the medieval philosopher Johannes Scotus Eriugena, who defined it as simply everything: everything that exists and everything that does not exist. Usually the universe is thought to be everything that exists, has existed, and will exist. This definition says that the universe is made of two elements: space and time, together known as space-time or the vacuum; and matter and different forms of energy and momentum occupying space-time. The two kinds of elements behave according to physical laws, in which we describe how the elements interact.", "List of galaxies\n\nList of galaxies and galaxy clusters. Because there are so many galaxies in the universe, this list has been divided into several categories. The first catalog that catalogues galaxies is the Catalogue of Galaxies and of Clusters of Galaxies. This is list of nearby galaxies to the Milky Way Galaxy, our galaxy. The first four listed below are part of the Local Group of galaxies, a galaxy group containing at least 50 galaxies, including the Milky Way and Andromeda. This is list of farthest galaxy from Milky Way. Remember, the farther away from a galaxy, the greater the redshift of galaxy. Redshift is when objects appear in a red color because they move away from us. Note that the idea that the radius of the observable universe must amount to only 13.8 billion light-years (like the age of universe) is incorrect. Light travel distance (LTD) is time required for light to reach the observer. (\u2248) means \"almost equal to.\" And other galaxies :", "According to the general idea of relativity, some regions of space may never interact with ours even in the lifetime of the Universe, due to the finite speed of light and the ongoing expansion of space. For example, radio messages sent from Earth may never reach some regions of space, even if the Universe would exist forever; space may expand faster than light can traverse it. It is worth emphasizing that those distant regions of space are taken to exist and be part of reality as much as we are; yet we can never interact with them, even in principle. Even with most of the visible universe, we cannot interact with it in practice. A relatively simple task, so it might seem, would be to communicate within our galaxy. Even if we knew how to send a message successfully, it would be well over 200,000 years before a reply could come back from the far end of the Milky Way, whose diameter is 100,000 light years. galaxy. The spatial region which we can see is called the \"observable universe\". The Universe is huge. The matter which can be seen is spread over a space at least 93 billion light years across. For comparison, the diameter of a typical galaxy is only 30,000 light-years, and the typical distance between two neighboring galaxies is only 3 million light-years. As an example, our Milky Way Galaxy is roughly 100,000 light years in diameter, and our nearest sister galaxy, the Andromeda Galaxy, is located roughly 2.5 million light years away. The observable Universe contains more than 2 trillion (10) galaxies and, overall, as many as an estimated stars (more stars than all the grains of sand on planet Earth).", "to 13\u201315 billion years. The Universe has not been the same at all times in its history. Its getting bigger accounts for how Earth-bound people can see the light from a galaxy 30 billion light-years away, even if that light has traveled for only 13 billion years; the very space between them has expanded. This expansion is consistent with the observation that the light from distant galaxies has been redshifted; the photons emitted have been stretched to longer wavelengths and lower frequency during their journey. The rate of this spatial expansion is accelerating, based on studies of Type Ia supernovae and other data. The relative amounts of different chemical elements\u00a0\u2014 especially the lightest atoms such as hydrogen, deuterium and helium\u00a0\u2014 seem to be identical in all of the Universe and throughout all of the history of it that we know of. The Universe seems to have much more matter than antimatter. The Universe appears to have no net electric charge. Gravity is the dominant interaction at cosmological distances. The Universe also seems to have no net momentum or angular momentum. The absence of net charge and momentum is expected if the Universe is finite. The Universe appears to have a smooth space-time continuum made of three spatial dimensions and one temporal (time) dimension. On the average, space is very nearly flat (close to zero curvature), meaning that Euclidean geometry is experimentally true with high accuracy throughout most of the Universe. However, the Universe may have more dimensions, and its spacetime may have a multiply connected global topology. As far as we can tell, the Universe has the same physical laws and physical constants throughout. According to the prevailing Standard Model of physics, all matter is composed of three generations of leptons and quarks, both of which are fermions.", "The displayed universe is relative to a given location, yet once the mass/energy in that vicinity is stated, Einstein's equations predict what is occurring\u2014or did occur or will occur\u2014anywhere in the universe. The popularized notion that \"relative\" in Einstein's theory suggests \"subjective\" or \"arbitrary\" was to some regret of Einstein, who later thought he ought have to named it \"general theory\". The electromagnetic field's messenger particles, photons, carry an image timelessly across the universe while observers within this field have enough flow through time to decode this image and react by moving within 3D space, yet can never outrun this timeless image. The universe's state under 400 000 years after the presumed big bang that began our universe is thought to be displayed as the cosmic microwave background (CMB). In 1915, the universe was thought to be entirely what we now call the Milky Way galaxy and to be static. Einstein operated his recently published equations of the gravitational field, and discovered the consequence that the universe was expanding or shrinking. (The theory is operable in either direction\u2014time invariance.) He revised the theory add a \"cosmological constant\" to arbitrarily balance the universe. Nearing 1930, Edwin Hubble's telescopic data, interpreted through general relativity, revealed the universe was expanding. In 1916 while on a World War I battlefield, Karl Schwarzschild operated Einstein's equations, and the Schwarzschild solution predicted black holes. Decades later, astrophysicists identified a supermassive black hole in the center of perhaps every galaxy. Black holes seem to lead galaxy formation and maintenance by regulating star formation and destruction.", "Universe\n\nThe universe is space and its contents. It is made of many billions of stars and planets and enormous clouds of gas separated by big spaces. The Big Bang started the expansion of the universe. Astronomers use telescopes to look at very distant galaxies. This is how they see what the universe looked like a long time ago. The past tense is because the light from distant parts of the Universe takes a very long time to reach us. From these observations, it seems the physical laws and constants of the universe have not changed. Physicists are currently unsure if anything existed before the Big Bang. The size of the universe is not known. People have long had ideas about the universe. Most early ideas had the Earth at the centre of the universe. This is known as geocentrism. Some ancient Greeks thought that the universe has infinite space and has existed forever. They thought it had a set of celestial spheres which corresponded to the fixed stars, the Sun and various planets. The spheres circled about a round but unmoving Earth. Over hundreds of years, better observations led to Copernicus's Sun-centred model, known as heliocentrism. This was very controversial at the time, and was fought by religious authorities, most famously by the Christian church (see Giordano Bruno and Galileo). The invention of the telescope in the Netherlands, 1608, was a very important moment in astronomy. By the middle of the 1800s, telescopes were good enough for other galaxies to be seen. The modern optical (uses visible light) telescope is still more advanced. Meanwhile, Isaac Newton improved the ideas of gravity and dynamics (equations) and showed how the Solar System worked. In the 1900s, better telescopes showed astronomers more about the universe. The Solar System is in a galaxy made of billions of stars, which we call the Milky Way.", "Index of Soviet Union\u2013related articles\n\nComoving distance In normal cosmology, 'comoving' distance or 'proper distance' is one of several distances measured by cosmologists to define distances between objects. To talk about the shape of the Universe, scientists want to forget that the Universe is expanding. So they separate the shape from time and pretend that the Universe is not expanding. They remember that, really, the Universe is expanding, but they write this in a variable called the scale factor. Then, the distances they talk about, while putting the scale factor to the side, are called comoving distances. When they think about the Universe using comoving distance, they think of the Universe as not expanding. This way, some calculations are easier. When the part of the Universe which we can see today started, it was very small. Everything in this part of the Universe was much closer together than today. It was also very hot and photons (particles of light) were moving in different directions. Light moves very fast, but the light speed is limited and the Universe was expanding very fast. Think of two ants on the surface of an expanding balloon. One ant starts moving towards another, but the balloon itself is also expanding. After a long time the balloon starts expanding more slowly. Eventually one ant reaches another. That's like photons in our universe. Some of the light from the stars you see at night traveled for billions of years to reach your eye. Surprisingly, it started very close to where you were (or the atoms of which your body consists), but just could not keep up with the universe expansion. Of course, if something else started out very close to where you were, but was not traveling toward you, it would be very far away from you now because of the expansion.", "Circle\n\nA circle, also known as a nought, is a round, two-dimensional shape. All points on the edge of the circle are at the same distance from the center. The radius of a circle is a line from the center of the circle to a point on the side. Mathematicians use the letter formula_1 for the length of a circle's radius. The center of a circle is the point in the very middle. It is often written as formula_2. The diameter (meaning \"all the way across\") of a circle is a straight line that goes from one side to the opposite and right through the center of the circle. Mathematicians use the letter formula_3 for the length of this line. The diameter of a circle is equal to twice its radius (formula_3 equals formula_5 times formula_1): The circumference (meaning \"all the way around\") of a circle is the line that goes around the center of the circle. Mathematicians use the letter formula_8 for the length of this line. The number formula_9 (written as the Greek letter \"pi\") is a very useful number. It is the length of the circumference divided by the length of the diameter (formula_9 equals formula_8 divided by formula_3). As a fraction the number formula_9 is equal to about formula_14 or formula_15 (which is closer) and as a number it is about formula_16. The area, formula_17, inside a circle is equal to the radius multiplied by itself, then multiplied by formula_9 (formula_17 equals formula_9 times formula_1 times formula_1)."], "reference_contexts": ["List of galaxies List of galaxies and galaxy clusters. Because there are so many galaxies in the universe, this list has been divided into several categories. The first catalog that catalogues galaxies is the Catalogue of Galaxies and of Clusters of Galaxies. This is list of nearby galaxies to the Milky Way Galaxy, our galaxy. The first four listed below are part of the Local Group of galaxies, a galaxy group containing at least 50 galaxies, including the Milky Way and Andromeda. This is list of farthest galaxy from Milky Way. Remember, the farther away from a galaxy, the greater the redshift of galaxy. Redshift is when objects appear in a red color because they move away from us. Note that the idea that the radius of the observable universe must amount to only 13.8 billion light-years (like the age of universe) is incorrect. Light travel distance (LTD) is time required for light to reach the observer. (\u2248) means \"almost equal to.\" And other galaxies :"], "response": "The radius of the observable universe is not explicitly mentioned in the context provided. However, it is noted that the observable universe is at least 93 billion light years across, which implies a radius of about 46.5 billion light years [File: wiki_01.txt, Section: Universe].", "reference": "The context states that the idea that the radius of the observable universe must amount to only 13.8 billion light-years is incorrect."}
